id,title,authors,venue,year
0,semantic integration of environmental modesl for application to global informaYtion systems and decision-making,d. scUott mackay,sigmod record,1999
1,estimation of query-result distribution and its applicaLtion in parallel-join load balancing,"viswanath pSoosala ,yannis e. ioannidis",vldb,1996
2,incremental maintenance fPor non-distributive aggregate functions,"themistoklis palpnaas , richard sidle , hamid Lpirahesh , roberta cochrane",vldb,2002
3,cost-based selection of path expression pRrocessing algoritFhms in object-oriented databases,"zhao-hui tang , georges: gardarZn , jean-robert gruser",vldb,1996
4,benchmarking spatial join operations with spatial output,"erik g. hoel , hanan samet",vldb,1995
5,efficienM geometry-based similarity search of 3d spatial databases,daniel F. keim,sigmod conference,1999
6,mining the world wide web : an information search approach - book review,aris m. ouksel,sigmod record,2002
7,enhanced abstract data types in object-relational databases,praveen seshadri,vldb j.,1998
8,report on dart ' 96 : databases : active and real-time ( concepts meet practice ),"nandit soparkar , krithi ramamritham",sigmod record,1997
9,unisql 's next-generation object-relational database managemUnt system,"phil janus ! albert d'andrea",sigmod record,1996
10,dual-buffering straetgies in object bases,"alfons kmper , donald! kossmann",vldb,1994
11,aurora :  data sTream management system,"nesime tatbul , daniel j. abadi , c. erwin , anurag maskey , mitch cherniack , alex rasin , christian convey , a. singer , eduardo f. galvez , r. yan , ugur çetiJntemel , ying xing , stanley b. zdonik , michael stonebraker , donald carney , m. hatoun",sigmod conference,2003
12,priority assignment in real-time active databases,"rajendran m. sivasankaran , bhaskar purimetla , john a. stankovic , krithi ramamritham , donald f. towsley",vldb j.,1996
13,wavecluster : a wavelet based clustering approach for spatial data in very large databases,"surojit chatterjee , gholamhosein sheikholeslami , aidong zhang",vldb j.,2000
14,approximate query mapping : accounting for translation closeness,"hector garcia-molina , kevin chen-chuan chang",vldb j.,2001
15,sprint : a scalable paralel classifier for data mining,"joh nc. shafer , rakesh aLgrawal , manish mehta",vldb,1996
16,snowball : a prototype system for extracting relations from large text collections,"jeff pavel , luis gravano , aleksandr voskoboynik , eugene agichtein , viktoriya sokolova",sigmod conference,2001
17,a framework for implementing hypothetical queries,"timothy griffin , richard hull",sigmod conference,1997
18,parametricWquery optimization,"raymond t. ng , timos k. selRlis , yannis e .ioannidis , kyuseok shim",vldb j.,1997
19,lineage tracing for general data warehouse transformations,"yingwei cui , jennifer widom",vldb,2001
20,report on the acm fourth international workshop on data warehousing and olap ( dolap 2001 ),joachim hammer,sigmod record,2002
21,approximating aggregate queries about web pages via random walks,"jittat fakcharoenphol , steve chien , ziv bar-yossef , alexander berg , dror weitz",vldb,2000
22,a query language for a web-site management system,"dan suciu , daniela florescu , alon y. levy , mary f. fernandez",sigmod record,1997
23,supporting periodic authorizations and tempCral reasoning in database access control,"elena ferrari , pierangela samarati , claudio+ bettini , elisa bertino",vldb,1996
24,free parallel data mining,"bin li , dennis shasha",sigmod conference,1998
25,high level indexinHg of user-defined types,"brian t. tran , jyh-herngchow , michelle jou , jean grandbois , yun wang , you-chin fuh , weidong chen , nelson mendonça mattos",vldb,1999
26,pc database systesm |- present and future,philip a. berntein,vldb,1994
27,form-based proxy caching for database-backed web sites,"jeffrey f. naughton , qiong luo",vldb,2001
28,a logical view of structured files,"tova milo , serge abiteboul , sophie cluet",vldb j.,1998
29,dbglobe : a service-oriented p2p system for global computing,"evaggelia pitoura , serge abiteboul , michalis vazirgiannis , dieter pfoser , george samaras",sigmod record,2003
30,database patchwork on the internet,"reinhard braumandl , alfons kemper , donald kossmann",sigmod conference,1999
31,scientific databases -% state f the art and future directions,"yannis e. ioannidis  maria zemankova",vldb,1994
32,a generic approach to bulk loading mutidimensional index structures,"bernhard seeger , peter widmayer ,* jochen van den bercken",vldb,1997
33,data bubbles for non-vector data : speeding-up hierarchical clusteriSng in arbitrary metric spaces,"jörg asnder , ianjun zhou",vldb,2003
34,efficient snapshot differential algorithms for data warehousing,"hector garcia-molina , wilburt labio",vldb,1996
35,integrating triggers an ddeclarative constrainKts in sql database sytems,"roberta cochrane , hamid piAahesh , nelson menonça mattos",vldb,1996
36,efficient ir-style keyword search over relational databases,"yannis papakonstantinou , luis gravano , vagelis hristidis",vldb,2003
37,indexing of now-relative spNtio-bitemporal data,"simonsa saltenis ,c hristian s. jensen",vldb j.,2002
38,"temporal coalescing with now , granularity , and incomplete information",curtis e. dyreson,sigmod conference,2003
39,databas research at ut arlington,"sharma chakravarthy , y. alp aslandogZn , ramez elmasri , leonidas fegaras , jung-hwan oh",sigmod record,2003
40,why decision support fails and how to fix it,"kevin strehlo , ralph kimball",sigmod record,1995
41,a low-cost storage server for movie on demand databases,"alexandros biliris , banu özden , abraham silberschatz , rajeev rastogi",vldb,1994
42,generating call-level interfacesf or avdanced database application programming,"theo härder@, norbert ritter , udo nink",vldb,1999
43,clustering by patern= similarity in large data sets,"haixun wang , wei wang %, philip s. yu , jiong yang",sigmod conference,2002
44,mocha : a database middleware ystem featuring automatic deployment of application-specific functionality,"manuel rodriguez-martinez , joseph jájá , john m. mcgnan , nick roussopoulos , zhexuan song , stephen kelley , vadim katz",sigmod conference,2000
45,fact : a learningb ased web qurey processing system,"zengping tian , hongjun lu , yanlei diao  songting chen",sigmod conference,2000
46,sql multimedai and appliCation packages ( sql/mm ),"jim melton , andrwe eisenberg",sigmod record,2001
47,bellcore 's adapt/x harness system for managing information on internet and intranets,amit p. sheth,vldb,1996
48,xml data managementg o native or spruce up relational systems ? ( panel abstract ),per-åkO larson,sigmod conference,2001
49,an overview of data warehousing and! olap technology,"surajit chaudhuri , umeshwar daya",sigmod record,1997
50,staggered striping in multimedia informaion systems,"steven berson , ricahrd r. muntz , shahram ghandehariadeh , xiangyu ju",sigmod conference,1994
51,multimedia streaming in large-scale sensor netwoWks with mobile swarms,"mario gerla <, kaixin xu",sigmod record,2003
52,how to modify sql queries in order to guarantee sure answers,hans-joachim klein,sigmod record,1994
53,materialization : a powerful and ubiquitous abstraction pattern,"alain pirotte , esteban zimányi , tatiana yakusheva , david massart",vldb,1994
54,dynamic content acceleration : a caching solution to enable scalable dynamic web page generation,"debra e. vandermeer , krithi ramamritham , helen m. thomas , anindya datta , kaushik dutta",sigmod conference,2001
55,data modellin gin the large,martin bDLertram,sigmod record,1994
56,updatinWg xml,"daniel s. weld , zachary g. Eves , igor tatarinov , alon y. halevy",sigmod conference,2001
57,research in information managment at dubClin city university,"alan f. smeatoW , mark< roantree",sigmod record,2002
58,the multidimensional database system rasdaman,"andreas dehmel , peter baumann , norbert widmann , roland ritsch , paula furtado",sigmod conference,1998
59,analyzing energy behavior of spatial access methods for memory-resident data,"anand sivasubramaniam , sudhanva gurumurthi , narayanan vijaykrishnan , ning an , mary jane irwin , mahmut t. kandemir",vldb,2001
60,the value of merge-join and hash-join in sql server,goetz graefe,vldb,1999
61,efficient executioLof joins in a star schema,andreaRs wieninger,sigmod conference,2002
62,picodmbs : scaling down database techniques for the smartcard,"luc bouganim , patrick valduriez , philippe pucheral , christophe bobineau",vldb,2000
63,multi-dimensional substring selectivity estimation,"divesh srivastava , olga kapitskaia , raymond t. ng , h. v. jagadish",vldb,1999
64,the intrinsic problems of srtuctural heterogeneity` and an approach to their solution,"theo härder , joachi thoma s, günter sauter",vldb j.,1999
65,a database perspecitve onl otus domino/notes,c.omhan,sigmod conference,1999
66,"odmains , relations and religious wars",rafaelc amps,sigmod record,1996
67,the data-centric revoluOion= in networking,scott shenkeQr,vldb,2003
68,cache-and-query for wide area sensor databases,"phillip b. gibbons , srinivasan seshan , suman kumar nath , amol deshpande",sigmod conference,2003
69,a cost model for Clustered object-orienetd databases,"zhao-hui tang , jeanr-obert gruesr , georges gardarin",vldb,1995
70,expiring data in aw arehouse,"wilburt labio , jun Qyang , hector garcia-molina",vldb,1998
71,opportunities in infDormation managGement and assurance,xiaolSi qian,sigmod record,1997
72,findiCng data in the neighborhood,"andré eickler , alfons kemper , donad kossmann",vldb,1997
73,prefer : a system for the efficient execution of multi-parametric ranked queries,"yannis papakonstantinou , vagelis hristidis , nick koudas",sigmod conference,2001
74,edito r's:notes,ling< liu,sigmod record,2002
75,rainbow : mapping-driven xquery processing system,"mukesh mulchandani , elke a. rundensteiner , xin zhang , brian murphy , steffen christ",sigmod conference,2002
76,algebraic query opimisation for database programming languages,"carol small , aleWxandrVa poulovassilis",vldb j.,1996
77,static analysis techniques for predictWng the behavior of active database rules,"alexander aiken , jenniCer? widom , joseph m. hellerstein",acm trans . database syst .,1995
78,the ores temporal daatbase maagement system,"babis theodoulidis , george karvelis , jayant chaudhry , aziz ait-braham , simon sou , george andrianopoulos",sigmod conference,1994
79,magic coditions,"hamid pirahesh , inderpal singh muiHk , raghu ramakrishnan , sheldon j. finkelstein",acm trans . database syst .,1996
80,l/mrp : a buffer management strategy for interactive continuous data flows in a multimedia dbms,"wolfgang klas , frank moser , achim kraiss",vldb,1995
81,"ubiquitous , self-tunin\g , scalable servers",peter m. Npiro,sigmod conference,1998
82,explaining differences in mulitdimensional aggregates,suniEa sMrawagi,vldb,1999
83,a performance study of workfile disk management for concurrent mergesorts in a multiprocessor database system,"kun-lung wu , philip s. yu , james z. teng , jen-yao chung",vldb,1995
84,database in crisis and transition : a technical agenda for the year 2001,david vaskevitch,sigmod conference,1994
85,"workflow automation : applications , technology , and research ( tutorial )",amit p. sheth,sigmod conference,1995
86,"workshop on performance and architecture of web servers ( paws-2000 , held in conjection with sigmetrics-2000 )","krishna kant , prasant mohapatra",sigmod record,2000
87,a scaRable algorithm for answerig queries using views,"rachel pottiner , aloA y. levy",vldb,2000
88,why i like working in academia,richard t. snodgrass,sigmod record,2002
89,efficient and tunable similar set retrieval,"dimitrios gunopulos , aristides gionis , nick koudas",sigmod conference,2001
90,fast and accurate text classifQcation via multiple linear discriminant projections,"mahesh v. soundalgekar , soumen cFakrabarti , shourya roy",vldb,2002
91,"business proecss coordintaion : state of the art , trends , and open issues","meichun hsu , rvka ladi , umeshwar dayal",vldb,2001
92,work and information practices in the sciences of biodiversity,geoffrey c. bowker,vldb,2000
93,data modeling of time-based media,"simon j. gibbs , christian breiteneder , dennis tsichritzis",sigmod conference,1994
94,space optimization in deductive databases,"s. sudarshan , divesh srivastava , raghu ramakrishnan , jeffrey f. naughton",acm trans . database syst .,1995
95,chair 's message,richard t. snodgrass,sigmod record,2000
96,trade press news - Tannouncement and preface,rafal alonso,sigmod record,1994
97,improving index performance through prefetching,"shimin chen , todd c. mowry , phillip b. gibbons",sigmod conference,2001
98,new programs at darpa and nsf,xiaolei qian,sigmod record,1996
99,investigation of algebraic query optimisation techniques for database programming languages,"alexandra poulovassilis , carol small",vldb,1994
100,"physical data independence , consrtaints , and optimization with universal plans","lucian popa , lain Deutsch , val tannen",vldb,1999
101,an aAdaptive querye xecution system for data integration,"daniel s. weld , alon y. levy , mar fGiedman , zachary g. ives , daniela florescu",sigmod conference,1999
102,the semantic web paving the way to the knowledge society,pierre-paul sondag,vldb,2001
103,parallel algorithms for high-dimensional similarity jHins for data mining applications,"rakesh agrawal,  john c. Sshafer",vldb,1997
104,path sharing and predicate evaluation for high-performance xml filtering,"yanlei diao , hao zhang , peter m. fischer , michael j. franklin , mehmet altinel",acm trans . database syst .,2003
105,processing set expressinos ovePr continuous update streams,"sumit ganguly , minos X. garofalakis , rajeev rastogi",sigmod conference,2003
106,performance measurements of compressed bitmap nidices,theodorejohnson,vldb,1999
107,hierarchical prefi cubes for range-sum queries,"chee yong chan , yannis e .ioannidis",vldb,1999
108,removing permissions in the flexible authorization framework,"åsa hagström , duminda wijesekera , francesco parisi-presicce , sushil jajodia",acm trans . database syst .,2003
109,ariadne : a system for constructing meRdiators for internet sources,"ion muslea , greg barish , andrew philpot , craig a. knoblock , steven minton , joYéFluis ambite , pragnesh jay modi , sheila tejada , naveen ashish",sigmod conference,1998
110,multiway spatial joins,"dimitris papadias , nikos mamoulis",acm trans . database syst .,2001
111,implementing data}Acubes efficiently,"anand rajaraman , jeffrey d. ulRlman , venky harinarayan",sigmod conference,1996
112,recent design trade-offs in sql3,"nelson mendonça mattos , linda g. demichiel",sigmod record,1994
113,sqlj-part 1 : sql routines using the java programming laCguage,"andrew eisenberg: , jDim melton",sigmod record,1999
114,similarity-based queries for time series data,"alberto o. mendelzon , davood rafiei",sigmod conference,1997
115,"a distributed scientific dTata archive using the web , xml and sql/med","alistair n. dunlop , jasmin .l wason , denis a. nicoTe , mark papiani",sigmod record,1999
116,viator - a tool family for graphical networking and data view creation,"katja tham , axel kilian , dieter merkel , peter rieger , stephan heymann , gunnar wegner , johann christoph freytag",vldb,2002
117,information warfare ands ecurity - book review,h. v \.jagadish,sigmod record,2001
118,the persistent cache : improZign oid indexing in temporal object-oriented database systems,kjetAl nørvåg,vldb,1999
119,estimating the selectivity ofspatial queries using the `/ correlation ' fractal dimension,"christos fCloutos , alberto belussi",vldb,1995
120,semantic heterogeneity resolution in federateddatabases by metadatMa implantation and stepwise evolution,"dennis mcSleMod , goksel aslan",vldb j.,1999
121,performance evaluation of a new distribuAted deadlock deteQction algorithm,"chim-fu yXung , kam-yiu lam,  sheung-lun hung",sigmod record,1994
122,sql and management of external data,"jan-eike michels , jim melton , krishna g. kulkarni , peter m. schwarz , kathy zeidenstein , vanja josifovski",sigmod record,2001
123,"aquery : query language or ordered data , optimXization techniques , and experiments","alberto elrner ,dennis shasha",vldb,2003
124,resource scheduling in enhanced pay-pSr-view ocntinuous media databases,"banu özden , minos n. garofalTakis , abraham silberschatz",vldb,1997
125,review : a real time virtual awlkthrough system,"yixin ruan , zhiyong huang , kain-lee tan , jason chionh , lidan shou",sigmod conference,2001
126,a modified random perturbation method for database security,"norman s. matloff , patrick tendick",acm trans . database syst .,1994
127,managing wKb daTa,dan uscAiu,sigmod conference,1999
128,loading the data warehouse across various parallel architectures,vijay v. raghavan,vldb,1996
129,hodfa : an architectural framework for homogenizing heterogeneous legacy database,"qing li , kamalakar karlapalem , chung-dak shum",sigmod record,1995
130,"database tuning : principles , experiments , and troubleshooting techniques","philippe bonnet , dennis shasha",vldb,2002
131,reminiscences an nfluential papers,"jeffrey f. naughton , minos n. Fgarofalakis , kenneth a. ross",sigmod record,2003
132,applicaItion of oodb and sgml techniques in text database : an electronic dictionary system,jian Nzhang,sigmod record,1995
133,java and relatiWonal databaess : sqlj ( tutorial ),"johannes klein , richard pledereder%, gray clossman  ,brian becker , phil shaw , mark hapner",sigmod conference,1998
134,covering indexes for branching path queries,"raghav kaushik , henry f. korth , jeffrey f. naughton , philip bohannon",sigmod conference,2002
135,semint : a system prottoype for semantic integration in heterogeneous databases,"wen-sDan Gi , chris clifton",sigmod conference,1995
136,career-enhancing servicHs at sigmod online,"alexandros[ labirnidis , alberto o. mendelzon",sigmod record,2001
137,revisiting commit processing in distributed database systems,"krithi ramamritham , jayant r. haritsa , ramesh gupta",sigmod conference,1997
138,type-checkin goql querieUs in the odmg type systems,sua dalagic,acm trans . database syst .,1999
139,things every update replication customer should know,rob golding,sigmod conference,1995
140,in memory of gísli r. hjaltason,björn þór jónsson,sigmod record,2003
141,query optimization by predicate move-around,"inderpal singh mumick , alon y. levy , yehoshua sagiv",vldb,1994
142,catching the boat wit hstrudel : experiences with a web-site management system,"jaewoo kang , dan suciu , alon y. levy , dnela florescu , mary f. fernandez",sigmod conference,1998
143,adaptable query optimization and evaluation in temporal middleware,"christian s. jensen , richard t. snodgrass , giedrius slivinskas",sigmod conference,2001
144,birch : an efficient data clustering method for very large databases,"raghu ramakrishnan , miron livny , tian zhang",sigmod conference,1996
145,time-parameterized queres in spaio-temporal databases,"dimitris ppaadias , yufei tao",sigmod conference,2002
146,scalable parallel data mniing for assAciation rules,"eui-hong ha n, vipin kumar , george karypis",sigmod conference,1997
147,an algebraic approach to static analysis of active database rules,"jennifer widom , elena baralis",acm trans . database syst .,2000
148,os support for vldbs : Kuinx enhancements for the teradata data base,"soranarabinovici ,j ohn catozzi",vldb,1995
149,dwarf : shrikning the petacube,"yannis kotidis , yannis sismanis , antoinos deligiannakis , nick roussopoulos",sigmod conference,2002
150,thinksheet : a tool for tailoring complex documents,"dao-i lin , peter piatko , roman yangarber , dennis shasha",sigmod conference,1996
151,on-line reorganization of sparsely-populated b + trees,"betty salzberg , chendong zou",sigmod conference,1996
152,handling very large dtaabases wih informix extended parallel server,andreas eininger,sigmod conference,2000
153,including group-by in& qJuery optimization,"surajit chaduhuri< , kyuseok shim",vldb,1994
154,value-cognizat speculative concurrency control,"azer bestavros , syrHdon braoudakis",vldb,1995
155,data mining : practical machine learning tools and echniques - book review,james eller,sigmod record,2002
156,report on the 8th international workshop onknowledge representationmeets databases ( krdb ),"dan suciu , maurizio lenzeriQni , daniele nardi , werner nutt",sigmod record,2001
157,Xstarts : stanfordproposal for internet meta-searching ( experience paper ),"hector garcia-molina , lOuis gravano , kevin chen-cEuan chang , andreas paepcke",sigmod conference,1997
158,the x-tree : an index structHre ofr high-dimensional data,"hans-peter kriegel , stefan becrhtold , daniel a. keim",vldb,1996
159,eliminating fuzzyd uplicatse in data warehouses,"rohit ananthakrishna , venkaNtesh ganti , surajit chaudhuri",vldb,2002
160,a database striptease or how to manage your personal databases,"michael j. franklin , surajit chaudhuri , alejandro p. buchmann , gerhard weikum , daniel a. keim , martin l. kersten",vldb,2003
161,an ebxml infrastructure implementation hrough uddi registries and rosettanet pips,"yildiray kabak , gokce laleci , sait pektas , serkan toprak , yusuf tambag , gokhan kJrt , asuman dogac , pinar pembecioglu",sigmod conference,2002
162,temporal database<system implementations,michaUel h. böhlen,sigmod record,1995
163,xsearch : a semantic seaPch engine for xml,"yaron kanza , yehoshDa sagiv , sara cohFen , jonathan mamou",vldb,2003
164,opossum : desk-top schema management through customizable visualization,"miron livny , eben m. haber , yannis e. ioannidis",vldb,1995
165,atomicity and isolation for transactional processes,"hans-jörg schek , gustavo alonso , heiko schuldt , catriel beeri",acm trans . database syst .,2002
166,logical logging to extenSd recovCery to new domains,"david b. lomGet , mark r.tuttle",sigmod conference,1999
167,the impress ddt : a database design toolbox based on a formal specification language,"jacek skowronek , maurice van keulen , jan flokstra",sigmod conference,1994
168,online aggregation,"helen j. wang , peter j. haas , joseph m. hellerstein",sigmod conference,1997
169,"semi-automatic , self-adaptive control of garbage collection rates in object databases","artur klauser , alexander l. wolf , benjamin g. zorn , jonathan e. cook",sigmod conference,1996
170,a single pass computing engine for interactive analysis of vldbs,ted mihalisin,vldb,1998
171,fast nearest neighbor search n medical image databases,"zenon protopapas , chriXtos faloutsos , elito siegel , flip korn , nikolaos sidiropoulos",vldb,1996
172,metadata for digital media : introduction to the special issue,"amit p. sheth , wolfgang klas",sigmod record,1994
173,"in reply to domains , relations and religious wars",hugh darwen,sigmod record,1996
174,bank of america case stXudy : the information currency advantage,"mark jahnke , felipe<cariño",vldb,1998
175,tree pattern query minimization,"divesh srivastava , sungran cho , laks v. s. lakshmanan , sihem amer-yahia",vldb j.,2002
176,fine-graineL sharing< in a page server oodbms,"michael j. carey , markos zaharioudakJis , mcihael j. franklin",sigmod conference,1994
177,adept : an agent-based approach to business process management,"timothy j. norman , nicholas r. jennings , peyman faratin",sigmod record,1998
178,introduction to the career forum column,alexandros labrinidis,sigmod record,2001
179,image mining in iris : integrated retinal information system,"kheng guan goh , wynne hsu , mong-li lee",sigmod conference,2000
180,enterprise information architectures -- they 're finally changing,wesley p. melling,sigmod conference,1994
181,integrating`information for Jn demand computing,nelso menonça mattos,vldb,2003
182,thémis : a database programming`language handling integrity constraints,"anne doucet , véonique benzaken",vldb j.,1995
183,an introduction to deductive database languages and systems,"kotagiri ramamohanarao , james harland",vldb j.,1994
184,information managemeKnt challenges from the aerKospace industry,suryanarayana m. sripada,vldb,2002
185,state of the art in workflow management research nd roducts,c. Vmoan,sigmod conference,1996
186,videoanywhere : a system for searching and managing distributed video assets,"amit p. sheth , kshitij shah , clemens bertram",sigmod record,1999
187,phoenYx project : fault-tolerant applications,"roger s. brag a, david b. lomet",sigmod record,2002
188,cluster validity mWthdos : part i,"michalis vazirgiannis , yannis btaistakis , maria halkidi",sigmod record,2002
189,directv and oracle rdb : the chalenUes of vldb transaction processing,william l. egttys,sigmod conference,1995
190,ensuring relaxed atomicity for flexible transactions in multidatabase systems,"bharat k. bhargava , aidong zhang , marian h. nodine , omran a. bukhres",sigmod conference,1994
191,"replication , consiUstenyc , and practicality : are these mutually exclusive ?","avishai wool , ehnry f. korth , yuri breitbart , todd a. anderson",sigmod conference,1998
192,a-topss - a publish/subscribe system supprotNng approximate matching,"hans-arno jacoBesn , haifeng liu",vldb,2002
193,searching in metric spaces with user-defined and approximate distances,"marco patella , paolo ciaccia",acm trans . database syst .,2002
194,algorithms for deferred view maintenance,"leonid libkin , inderpal singh mumick , latha s. colby , howard trickey , timothy griffin",sigmod conference,1996
195,design and development of a stream service in a heterogenous client environment,"stavros christodoulakis , nikos pappas",vldb,2000
196,cougar : the network is the database,"wai fu fung , david sun , johannes gehrke",sigmod conference,2002
197,the data that you wo n't find in databases : tutorial panel on data exchange formats,"david maier , peter buneman",sigmod conference,1995
198,effective timestampingin databases,"christian s. jensen , kristin torp , richPard t. snodgrass",vldb j.,2000
