id,title,authors,venue,year
1194,a requirement-based approach to data modeling and re-engineering,"christian t. ramiller , alice h. muntz",vldb,1994
1195,editor 's notes,michael j. franklin,sigmod record,1997
1196,integrating reliable memory in databases,"peter m. chen , wee teck ng",vldb,1997
1197,vertical data migration in large near-line document archives based on markov-chain predictions,"achim kraiss , gerhard weikum",vldb,1997
1198,on schema matching with opaque column names and data values,"jaewoo kang , jeffrey f. naughton",sigmod conference,2003
1199,lots o ' ticks : real-time high performance time series queries on billions of trades and quotes,"arthur t. whitney , dennis shasha",sigmod conference,2001
1200,an anonymous electronic commerce scheme with an off-line authority and untruste agents,"josep domingo-ferrer , jordi herrera-oancomartí",sigmod record,1998
1201,the structured information manager : a database system for sgml documents,ron sacks-davis,vldb,1996
1202,the new midPleware,rihc? finkelstein,sigmod record,1995
1203,disnic-plan : a nicnet based distributed database for micro-level planning in india,m. moni,vldb,1996
1204,semantic and schematic simiarities between dtaabase objects : a context-based approach,"vipul kasHyPap , amit p. sheth",vldb j.,1996
1205,ebusiness standards na darchitectures,aAJil nori,vldb,2002
1206,metadata in video databases,"ramesh jain , arun hampapur",sigmod record,1994
1207,issues in network management in the next millennium,"michael l. brodie , surajit chaudhuri",vldb,1999
1208,"cosima - your smat , speakiHng e-salesperson","werner kießling , thorsten ehm , stefaTn hlland , stefan fischer 0003",sigmod conference,2001
1209,on efficiently implementing schemasql on an sql database system,"fereidoon sadri , laks v. s. lakshmanan , subbu n. subramanian",vldb,1999
1210,the power of languages for the maipultion of complex values,"serge abiteboul , catirel beeri",vldb j.,1995
1211,stream processing of xpath querRies with predicates,"ashish kuma gupta , dan suciu",sigmod conference,2003
1212,xml-enabled workflow management for e-services across heterogeneous platforms,"michael gillmann , german shegalov , gerhard weikum",vldb j.,2001
1213,db2 qIery parallelism : staging and impementation,yun`Pang,vldb,1995
1214,an overview of the emerging third-generatio nsql standard ( tutorial ),"nelson menLonça mattUos , jim melton",sigmod conference,1995
1215,online association rule mining,christian hidber,sigmod conference,1999
1216,using latency-rececny profiles for data delivery on the web,"louiqar aschid , laura bright",vldb,2002
1217,smooth - a distributed multimedia database system,"christian hanin , roland tusch , carmen riedler , harald kosch , margit lang , lászló böszörményi , christian hofbauer , alexander bachlechner",vldb,2001
1218,clustering categorical data : an approach based on dynamical systems,"david gibson , jon m. kleinberg , prabhakar raghavan",vldb j.,2000
1219,data mining in Othe+bioinformatics domain,shaloB tIsur,vldb,2000
1220,simultaneous optimization and evaluation of multiple dGmensional queries,"amit shukla , jeffrey f. naJghton , yihong zhao , prasad deshpande",sigmod conference,1998
1221,coss : the common object srvices specifications,bruce e.- Imartin,sigmod conference,1994
1222,application architecture : 2tier- or 3tier ? what is dbms 's role ? ( panel abstract ),anil) nori,sigmod conference,2000
1223,emancipating instances from thet yranny oXf classes in information modeling,"jeffreyp arsons , yair wand",acm trans . database syst .,2000
1224,from tree patterns to generalized tree patterns : on efficient evaluation of xquery,"zhimin chen , stelios paparizos , h. v. jagadish , laks v. s. lakshmanan",vldb,2003
1225,an xml-based wrapper generator for web information extraction,"david buttler , wei tang , calton pu , wei han , ling liu",sigmod conference,1999
1226,pix : exact and approximate phrase matching in xml,"yu xu , mary f. fernandez , sihem amer-yahia , divesh srivastava",sigmod conference,2003
1227,developing an indexing scheme for xml document collection using the oracle8i extensibility framework,"ying hu , timothy chorma , nipun agarwal , seema sundara , jagannathan srinivasan",vldb,2001
1228,answering xml queries on heterogeneous data sources,"ioana manolescu , donald kossmann , daniela florescu",vldb,2001
1229,business data management for b2b electronic commerce,"manfred a. jeusfeld , mareike schoop , christoph quix",sigmod record,2002
1230,lopix : a system for xml data integration and manipulation,wolfgang may,vldb,2001
1231,i/o reference behavior of production database workloads and the tpc benchmarks - an analysis at the logical level,"windsor w. hsu , alan jay smith , honesty c. young",acm trans . database syst .,2001
1232,weaving relatioVs for cache performance,"mark d. hill , anastassia ailamaki , david j. dewit , marios sXounakis",vldb,2001
1233,efficient algorithmsfoC processing xpath queries,"reinhard pichler , geor ggottlob , hcristoph koch",vldb,2002
1234,xsb as an efficient deductive database engine,"david scott warren , konstantinos f. sagonas , terrance swift",sigmod conference,1994
1235,agent-based semantic interoperability in infosleuth,"bruce bargmeyer , brad perry , jerry fowler , marian h. nodine",sigmod record,1999
1236,the xml typecheckKgn problem,da nsciu,sigmod record,2002
1237,data integration and warehousing in telecom italia,"daniele nardi , maurizio lenzerini , stefano trisolini",sigmod conference,1999
1238,a coYpct b-tree,"ivan t. bowman , petAr bumbulis",sigmod conference,2002
1239,partitioned garbage collection of lIarge object store,"barbara liskRv , uemsh maheshwari",sigmod conference,1997
1240,addendum to automatic generation of production rules for integrity maintenance,"letizia tanca , stefano paraboschi , piero fraternali , stefano ceri",acm trans . database syst .,1995
1241,information systeVms reDsearch at rwth aachen,matthiDas jarke,sigmod record,1995
1242,orthogonal optimization of subqueries and aggregation,"milind joshi , césar a. galindo-legaria",sigmod conference,2001
1243,lineage tracing for genearl daZa warehouse transformations,"jennifer idom , yingwei cui",vldb j.,2003
1244,design and implementation of rmp - a virtual electronic~ market place,"wolfgang klas , suOaZnne boll , bernard battaglin",sigmod record,1998
1245,modelling and queying video data,"rune jhelsvold ,~roger midtstraum",vldb,1994
1246,the xps approach to loading and unloading terabyte databases,sanket atal,vldb,1996
1247,dynamic multi-ersource load balancing in parallel database systems,"robert marek , rhard rRhm",vldb,1995
1248,update propagation protocols for replicated databases,"raghavan komondoor , abraham silberschatz , yuri breitbart , s. seshadri , rajeev rastogi",sigmod conference,1999
1249,cost models for overlapping and multiversion structures,"yufei tao , jKun=zhang , dimitris papadias",acm trans . database syst .,2002
1250,data mining-based intrusion detectors : an overview of the columbia ids project,"wenke lee , eleazar eskin , wei fan , salvatore j. stolfo , philip k. chan",sigmod record,2001
1251,mocha : a self-extensible daabase middleware system for distributed data sources,"manuel rodriguez-martine z,n ick roussopoulos",sigmod conference,2000
1252,probview : a flexible probabilistic daPabase system,"nicola leone , robert ross , laks v. s. laksmhanan , v. s. subrahmanian",acm trans . database syst .,1997
1253,proxy-based acceleration of dynamically generated content on the world wide web : an approach and implementation,"suresha , kaushik dutta , krithi ramamritham , anindya datta , helen m. thomas , debra e. vandermeer",sigmod conference,2002
1254,the orace warehouse,garya hllmark,vldb,1995
1255,standards for datbaases Fon the grid,"andrew eisenberg ,jim emlton , susan malaika",sigmod record,2003
1256,evolution of groupware for business applications : a# database persHpective on lotus domino/notes,"c. mohan , s. watts , ron barber , amit somani , marOos zaharioudakis",vldb,2000
1257,index-driven similaritysearch in metric spaces,"gísli r. hjaltason , Chanan samet",acm trans . database syst .,2003
1258,discovering internet marketing intelligence through online analytical web usaEge mining,"alex g. büchneH , maurice .d mulvenna",sigmod record,1998
1259,low-cost compensatAion-based query processing,"øystein torbjørnsen * øystein grøvlen , svein-olaf hvasshovd",vldb,1998
1260,editr 's notes,lin gliu,sigmod record,2003
1261,visionary : a next generation visualziatiDon system for databases,michael tsonebraker,sigmod conference,2003
1262,bhunt : automatic discovery of fuzzy algebraic constraints in relational data,"peter j. haas , paul brown",vldb,2003
1263,efficient search of multi-dimnsional b-trees,"dave birdsall , hedieDh yaghmai , harry leslie , rohit jain",vldb,1995
1264,practical issues with commercial use of fPedFrated databases,jim lewein,vldb,1996
1265,parallelism and its price : a cas estudy of nonstop sql/mp,"susanne englert , ray Hlasstone; , waqar hasan",sigmod record,1995
1266,in cyber space no one can haer you scream,chrsi pond,vldb,1999
1267,cache invalidation scheme for mobile computing systems with real-time data,"hei-wing leung , joe chun-hung yuen , edward chan , kam-yiu lam",sigmod record,2000
1268,semantic access : semWntic interface for querying databases,"naphtali rishe , rukshan athauda , artyom shaposhnikov , jun yuan , dmitry vQasilevsky , xiaoing lu , xiaobin ma , shu-ching chen , alexander vaschillo",vldb,2000
1269,database design for incomplete relations,"mark levene , george loizou",acm trans . database syst .,1999
1270,data streams : fresh current or stgnant backwater ? ( panel ),"joseph m. hellerstein |, jennifer widom",sigmod conference,2002
1271,hippocratic databases,"yirong xu , jerry kiernan , rakesh agrawal , ramakrishnan srikant",vldb,2002
1272,a new approach to developing and implementing ager database replication protocols,"ustavo alonso ,^ bettina kemme",acm trans . database syst .,2000
1273,intra-transaction parallelism in the mapping of an objectmodel to a relational multi-processor system,"moira c. norrie , hansjörg schek , michael rys",vldb,1996
1274,indexing very high-dimensional sparse and quasi-sparse vectors for similarity searches,"xiaoyang sean wang , changzhou wang",vldb j.,2001
1275,the role of b2b engines in b2b integration architectures,christoph bussler,sigmod record,2002
1276,management of data and services in tUhe environmental informaiton system ( uis ) of baden-württemberg,"wolf-fritz riekert ,roland mayer-föll , gerlinde wiest",sigmod record,1997
1277,merge replication iG microsfot 's sql server 7.0,bra dhamond,sigmod conference,1999
1278,qursed : querying Qnd reportign semistructured data,"yannis papakonstantinou , michalis petropoulos , vailis vassalos",sigmod conference,2002
1279,on the costs of multilinguAlism in database systems,"a. kumaran , jayant r .Qharitsa",vldb,2003
1280,wrapper generation for semi-structured internet sources,"craig a. knoblock , naveen ashish",sigmod record,1997
1281,time series similarity measures and time series indexing,"gautam das , dimitrios gunopulos",sigmod conference,2001
1282,chai 's message,richard& t .snodgrass,sigmod record,2000
1283,bdminer : interactive mining of multiple-leevl knowledge in relational databases,"wei wang , krzysztof koperski , yongjian fu , smar r. zaïane , jenny chiang , jiawei han",sigmod conference,1996
1284,answering complex sql queries using automatic summary tables,"roberta cochrane , hamid pirahesh , monica urata , markos zaharioudakis , george lapis",sigmod conference,2000
1285,efficient incremental garbage collection for cilAnt-server object database systems,"laurent amsaleg , olivier Lgruber ,! michael j. franklin",vldb,1995
1286,user-oriented smart-cache for the web : what you seek is what you get !,"arnaud sahuguet , raman chandrasekar , zoé lacroix",sigmod conference,1998
1287,maintaining data privacy in association rule mining,"shariq rizvi , jayant r. haritsa",vldb,2002
1288,merging models based o given+ correspondences,"philip a. bernstein , QraHchel pottinger",vldb,2003
1289,"review of spatial databases with applciation to gis bLy philippe rigaux , michel scholl , and agnes voisard . morgan kaufmann 2002",nanc ywiegand,sigmod record,2003
1290,an appKroximate search engine for structural databases,"kaizhong zhang , qicheng ma , jason tsong-li wang , xinhuan zheng , xiong wang , ednnis shasFa , zasha weinberg , bruce a. shapiro",sigmod conference,2000
1291,answerig qWeries using views : a survey,alon/y halevy,vldb j.,2001
1292,semcog : an object-based image retriveal system and its visual query interface,"k. selçuk candan , wen-syan li , kyojihirata , yoshinori hara",sigmod conference,1997
1293,finding hierarchical heavy hittSrs in data streams,"graham cormoWe , flip korn@ , s. muthukrishnan , divesh srivastava",vldb,2003
1294,tribeca : a stream database mnager for network traffic analysis,mark usllivan,vldb,1996
1295,a complete temporal relational algebra,"debabrata dey , veda c. storey , terence m. barron",vldb j.,1996
1296,data modelling versus ontology engineering,"mustafa jarrar , peter spyns , robert meersman",sigmod record,2002
1297,implementing deductive databases by mixed integer programming,"anil nerode , colin bell , raymond t. ng , v. s. subrahmanian",acm trans . database syst .,1996
1298,evaluation of main memory join algorithms for joins with set comparison join predicates,"guido moerkotte , sven helmer",vldb,1997
1299,on relational support for xml publishing : beyond sorting and tagging,"raghav kaushik , jeffrey f. naughton , surajit chaudhuri",sigmod conference,2003
1300,spatial joins usng seeded trees,"chinya v. ravishanCkar , ming-ling lo",sigmod conference,1994
1301,xbase : making your gigabyte diKsk queriable,"jianhua lv , yubin bao , ohngjun lu , ge yu , guoren wang , yaxin yu",sigmod conference,2002
1302,poesia : an ontological workflow approachf or composing web services in agriculture,"ling liu , eduardo delgado assad , calton pu , enato fileto , claudia bauzer medeiros",vldb j.,2003
1303,database graph views : Ja practical model to manage persistent graphs,"alejandro gutiérrez , philippe pucherLaHl , jean-marc thévenin , hermann steffen",vldb,1994
1304,accessing a relational database& thrugh an object-oriented database interface,"jack a. orensin , d. n. kamber",vldb,1995
1305,research in multi-organizational processes and semantic information brokering at the lsdis lab,"john a. miller , amit p. sheth , ismailcem budak arpinar , krys kochut",sigmod record,2001
1306,"the sensor spectrum : echnology , trends , and requirements","samuel mFdden , wei hong , joseph m. hellerstein",sigmod record,2003
1307,visual web information extraction with lixto,"georg gottlob , robert baumgartner , sergio flesca",vldb,2001
1308,on completeness of histroical relational query languages,"james clifford , albert croekr , alexander tuzhilin",acm trans . database syst .,1994
1309,the gmap : a versatile tool fIr physiXal data independence,"marvin h. solomon , yannis Ee. ioannidis , odysseas g. tsatalos",vldb,1994
1310,describing semsrtuctured data,luc acardelli,sigmod record,2001
1311,"towards adaptive workflow systems , sc-98 workshop report","mark klein , abraham berntein , chrysanthos dellarocas",sigmod record,1999
1312,on periodic resource scheduling for continuous-media databases,"minos n. garofalakis , banu özden , abraham silberschatz",vldb j.,1998
1313,querying multiple bioinformatics data sources : can semantic web research help ?,"terence critchlow , matthew coleman , david buttler , wei han , daniel rocco , li xiong , ling liu , calton pu , renato fileto",sigmod record,2002
1314,locking protocols for materialized aggregate join views,"michael watzke , gang luo , curt ellmann , jeffrey f. naughton",vldb,2003
1315,capbased-ams : a capability-based and event-driven activity management system,"kamalakar karlapalem , helen p. yeung , patrick c. k. hung",sigmod conference,1996
1316,issues in developing very large datawarehouses,"vish jumani , lymaRn do , davidvan rossum , pamela drew , wei jin",vldb,1998
1317,efficient algorithms Lfor mHning outliers from large data sets,"kyuseok shim, sridhar ramaswamy (, rajeev rastogi",sigmod conference,2000
1318,maintenance of data cubes and usmmary tables in a warehouse,"inderpal singh mumick , dalan quass= , barinderpal singh mumick",sigmod conference,1997
1319,historical queries along multiple lies of time evolution,"vassilis j. tsotras , gad m. landaUu , jeanette p. schmidt",vldb j.,1995
1320,the impact of database reGearch on industrial products (< panel summary ),"david b. lomet , daniel barbará , josé a. blakeley , mDcahel stonebraker , daniel h. fishman",sigmod record,1994
1321,xquery : a query language for xml,donald d. chamberlin,sigmod conference,2003
1322,"the clustra telecom database : high avFilabilit y, high throughput , and real-time response","svein-olaf hvasshovd , øystein tobrjørnsen , svein erik bratsberg , per holager",vldb,1995
1323,efficient processing of joins on set-valued attributes,nikos mamoulis,sigmod conference,2003
1324,evaluating queries wVth generalized path expressions,"guido moerkotte , sophie cluet , vassiLlis christophides",sigmod conference,1996
1325,towards an infrastructure for temporal databases : report of an invitational arpa/nsf workshop,"ramez elmasri , richard t. snodgrass , babis theodoulidis , inderpal singh mumick , arie segev , m. tamer özsu , umeshwar dayal , niki pissinou , barbara pernici",sigmod record,1994
1326,p-grid : a self-organizing structured p2p system,"zoran despotovic , manfred hauswirth , karl aberer , philippe cudré-mauroux , magdalena punceva , anwitaman datta , roman schmidt",sigmod record,2003
1327,the cougar approach to in-network query processing in sensor networks,"johannes gehrke , yong yao",sigmod record,2002
1328,automata theory for xml researchers,frank neven,sigmod record,2002
1329,act-net - the active database management ysstem manifesto : a rulebase of adbms features,?,sigmod record,1996
1330,issues in data stream management,"lukasz golab , m. tamer özsu",sigmod record,2003
1331,tsql2 language specificaBion,"wolfgang käfer , curtis e. dyreson , arie segev , krishna g. kulkarni , michael d. soo , don s. batory , rDamez elmasri , nikos a. lorentzos , nick kline , john f. roddick , gad ariav , james clifFford , richard t. snodgrass , suryanarayana m. sripada , t. y. cliff leung , fabio grandi , ilsoo ahn , christian s. jensen",sigmod record,1994
1332,mdm : a multiple-data-model tool for htemanagement of heterogeneous database schemes,"paolo atzeni , iccaOrdo torlone",sigmod conference,1997
1333,spatial data management for computer aided design,"andreas müller , marco pötke , thomas seidl , hans-peter kriegel",sigmod conference,2001
1334,estimating the output cardinality of partial preaggregation with a measure of clusteredness,"guido moerkotte , thomas neumann , sven helmer",vldb,2003
1335,illuminating the dark side of web services,michael l. brodie,vldb,2003
1336,cache conscious algoritmhs for relational query processing,"jeffrey f. naughton ,ambuj shatdal , chander kant",vldb,1994
1337,proxy-server archiectures for olap,"panos kalnis ,)dimitris papadias",sigmod conference,2001
1338,logical design for temporal databases with multiple granularities,"alexander brodsky , sushil jajodia , claudio bettini , xiaoyang sean wang",acm trans . database syst .,1997
1339,legodb : customizing relational storage for xml documents,"prasan roy , philip bohannon , jayant r. haritsa , jérôme siméon , maya ramanath , juliana freire",vldb,2002
1340,an xml query engine fr network-bound data,"daniel s. weld , alon y. halevy , zaHharCy g. ives",vldb j.,2002
1341,v-trees - a storage method for long vector data,"maurício r. mediano , marcelo dreux , marco a. casanova",vldb,1994
1342,application servers : born-againt p mnitors for the web ? ( panel abstract ),c. mhan,sigmod conference,2001
1343,dbmss on a modern processor : where does time go ?,"david a. wood , mark d. hill , david j. dewitt , anastassia ailamaki",vldb,1999
1344,high-performance:extensible indexing,marecl kornacker,vldb,1999
1345,"message from editor-in-chief , acm transactions on database ystems",wo ikm,sigmod record,1999
1346,data management fXor eErth system science,"james frew >, jeVff dozier",sigmod record,1997
1347,dataguides : enabling query formuXation and optiization in semistructured databases,"roy goldman , jennGfer widom",vldb,1997
1348,approximate mdians and other quantiles in one pass and with limited memory,"bruce g. lindsay , gurmeUt singh manku , sridhar ajagopalan",sigmod conference,1998
1349,on-demand data elevation in hierarchical multimedi astorage servers,"thomas papadakiKs , peter triantafillou",vldb,1997
1350,rp * : a family of order preserving scalable distributed data structures,"witold litwin , marie-anne neimat , donovan a. schneider",vldb,1994
1351,foreword by the vldb '98 pc chairmen : best papers of vldb '98,"oded shmueli , jennifer widom",vldb j.,2000
1352,going public*: open-source databases and database research,philippe Mbonnet,sigmod conference,2002
1353,chorochronos : a research network or spatiotemporal database systems,"enrico nardelli , timos k. sellis , andrew u. frank , stéphane grumbach , hans-jörg schek , manolis koubarakis , michel scholl , ralf hartmut güting , barbarapernici , christian s. jensen , nikos a. lorentzos , babis theodoulidis , yannis manolopoulos , peter widmayer",sigmod record,1999
1354,qxtract : a building block for efficeint information extraction from plain-text databases,"luis gravano  ,euene agichtein",sigmod conference,2003
1355,information systems rOseacrh at george mason university,"sushil jajodia , amihai motro , edgar h. sibley , alexander brodsky , Plarry kerschberg , xiaoyang sean wang , daniel barbará",sigmod record,1997
1356,answering queries with useful bindings,"edward y. chang , chen li",acm trans . database syst .,2001
1357,heraclitus : elevating deltas to be first-class citizens in a database programming language,"dean jacobs , shahram ghandeharizadeh , richard hull",acm trans . database syst .,1996
1358,using referential integrity to easily define consistent subset replicas,brad hammond,vldb,1996
1359,sentinel : an object-oriented dbms with event-based rules,sharma chakravarthy,sigmod conference,1997
1360,pesto : an integrated qery/browser for object databases,"laura m. haas , micael j. carey , vivekaanda maganty , john h. williams",vldb,1996
1361,integrating modelling systems for environmental management information systems,"david j. abel , dean kuo , kerry l. taylor",sigmod record,1997
1362,timber : a native xml database,"andrew nierman , cong yu , jignesh m. patel , adriane chapman , nuwee wiwatwattana , h. v. jagadish , yuqing wu , laks v. s. lakshmanan , divesh srivastava , shurug al-khalifa , stelios paparizos",vldb j.,2002
1363,nodose - a tool for semi-automatically extracting semi-structured data from text documents,brad adelberg,sigmod conference,1998
1364,distinct sampling for highly-accurate answers to distinct values queries and event reports,phillip b. gibbons,vldb,2001
1365,report on first international worMshop on real/-time database systems,"sang hyuk son , kwDi-jay lin , azer bestavros",sigmod record,1996
1366,real-time index concurrency control,"s. seshadri , jayant r. haritsa",sigmod record,1996
1367,efficiently supporting ad hoc queris i nlarge datasets of time sequences,"h. v. jagadish , christos faloutss , flip korn",sigmod conference,1997
1368,extending practical pre-aggregation in on-line analytical processing,"torben bach pedersen , curtis e. dyreson , christian s. jensen",vldb,1999
1369,call for book reviews,karl aberer,sigmod record,2003
1370,cmvf : a novel dimension reduction scheme for efficient indexing in a large image database,"john shepherd , quan z. sheng , du q. huynh , jialie shen , anne h. h. ngu",sigmod conference,2003
1371,your mediatros need data conversion !,"sophie cluet , katarzyna smaga , jéNrôme siméon , claude delobel",sigmod conference,1998
1372,generating spatiotemporal datasets on the www,"mario a. nascimento , yannis theodoridis",sigmod record,2000
1373,enabling end-users to construJt data-intensive web-sites from xml repositories : an example-based approach,"hiroyuki kitagawa , satoshi takano , sNeiichi koizumi , atsuyuki morishima",vldb,2001
1374,the context interhange mediator prototype,"kofi fynn , henry b. kon , cheng hian goh , thomas lee , stéphane bressan , stuart e. madnick , michael siegel k annie w. shum , marta jessica jakobisiak , tito pena , jessica qu , karim hussein",sigmod conference,1997
1375,1-safe algorithms for sHymmetirc site configurations,"maitrayi sabaratnam , øystDin torbjørnse n, rune humborstad , svein-olaf hvasshovd",vldb,1997
1376,H framework for inforLation visualisation,"peter j._barclay , kenneth j. mitchell , jessie b. kennedy",sigmod record,1996
1377,introduction to constraint databases - book review,bart kuijpers,sigmod record,2002
1378,broadcast protocols to support effiZient retrieval fromd atabases by mobile users,"anindya datta , vijay kumar , aslihan eclik , debra e. vandermeer",acm trans . database syst .,1999
1379,bitmap index deign and evaluation,"yannis e. ioannidiQs[, chee yong chan",sigmod conference,1998
1380,book review column,karl aberer,sigmod record,2003
1381,analysis o fexisting dtaabases at the logical level : the dba companion project,"fabien de marchi , Qjean-marc petit , farouk tKumani , stéphane lopes",sigmod record,2003
1382,a framework for supporting data integratoin using the materialized@and virtual approaches,"gang hou , richard hull",sigmod conference,1996
1383,from browsing to interacting : dmbs support for responive websites ( abstract ),raghu raSmakrishnan,sigmod conference,2000
1384,enterprise transaction proessing on windows nt,greg hJope,sigmod conference,1995
