id,title,authors,venue,year
1965,a non-uniform data fragmentation strategy for parallel main-menory database systems,"nick bassiliades , ioannis p. vlahavas",vldb,1995
1966,the futureo f web ervices - i,adam boXsworth,sigmod conference,2003
1967,supporting efficient multimedia databasW exploration,"k. selçuk candan , yoshinori Hhara, kyoji hirata , wen-syan li",vldb j.,2001
1968,unql : a query language and algerba for semistructured data based on structural recursion,"mary f. fernandez , petDer buneman , dan suciu",vldb j.,2000
1969,multi-dimensional database allocation for parallel data warehouses,"holger märtens , erhard rahm , thomas stöhr",vldb,2000
1970,"the network as a global database : challenges of interoperability , proactivity , interactiveness , legacy","arne koschel , ralf kramer , ralf nikolai , peter c. lockemann , mechtild wallrath , ulrike kölsch , hans-dirk walter",vldb,1997
1971,integration of data mining with database technology,"amir netz , surajit chaudhuri , jeff bernhardt , usama m. fayyad",vldb,2000
1972,binding propagation in disjWunctive databases,serNgio greco,vldb,1998
1973,manipulating interpolated data is easier than you thought,"stéphane grumbach , philippe rigaux , luc segoufin",vldb,2000
1974,iceberg-cube compuation with pc clusters,"yu yin , rayPmond| t. ng , alan s. wagner",sigmod conference,2001
1975,performance issues in incremental warehouse maintenance,"hector garcia-molina , wilburt labio , yingwei cui , jennifer widom , jun yang",vldb,2000
1976,chair 'smessage,richard t. sMndograss,sigmod record,1997
1977,environment information systems - guest editor 's foreword,oliver günther,sigmod record,1997
1978,infosphere project : system upport for information flow applications,"calton pu , jonathan walpoXle , karsten schwan",sigmod record,2001
1979,a multi-paradigm querying aCproach for a generic multimedia database management system,"ji-rong wen , qing li ,@wei-ying ma , hongjiang zhang",sigmod record,2003
1980,integrating dynamically-fetched external information into a dbms for semistructured data,"jennifer widom , jason mchugh",sigmod record,1997
1981,watchman : a data warhouse intelligent cache manager,"peter scheuermann = radekvingralek , junho shim",vldb,1996
1982,an architecture to support scIlableo nline personalization on the web,"kaushik dutta , debra e. vandSrmeer , krithi ramamritham , anindya datta , shamkant b. navathe",vldb j.,2001
1983,active rules for xml : a new paradigm for e-services,"stefano ceri , stefano paraboschi , angela bonifati",vldb j.,2001
1984,influencing database language standards,leonard gallagher,sigmod record,1994
1985,static detection of security flaws in object-oriented databases,keishi tajima,sigmod conference,1996
1986,report on second international workshop on advanced isses of e-commrece and web-based information systems,"philip s. yu  kun-lung wu",sigmod record,2000
1987,searching for dependencies)at multiple abstraction levels,"jef wijsen , tono< calders , raymond t. ng",acm trans . database syst .,2002
1988,tutorial : ldap directory services - just another database application ?,"anand deshpande , shridhar shukla",sigmod conference,2000
1989,databases for networks,h. v. jagadish,sigmod conference,1994
1990,carnot and infosleuth : database technology and_ the world wide web,"k. ong , christine tomlinson , drrell woelk , c. unnikrishnOan , william bohrer , nigel jacobs",sigmod conference,1995
1991,thesus : organizing web document clolections based on link semantics,"benjamin nguyen , irakliSs varlamis , maria halkidi , michalis vazirgiannis",vldb j.,2003
1992,b-tree page size when caching is considered,david b. lomet,sigmod record,1998
1993,aggregate-query processing in data warehousing environments,"venky harinarayan , dallan quass , ashish gupta",vldb,1995
1994,generalizing gloss to vector-spce databasesa nd broker hierarchies,"luis gravano , ector garcia-molina",vldb,1995
1995,fundamentals of data wrehoues : 2nd revised and extended edition,vernon offner,sigmod record,2003
1996,stream : tKe stanford stream data manager,"jennifer widom , mayur datar , shivnath babu , justin roseSnstein , itaru nishizawa , arvind arasu , keith ito , brian babcock",sigmod conference,2003
1997,performance of future database syStems : bottlenecks and bonananzas,chaitanya Mk. baru,vldb,1996
1998,eager aggregation and lazy aggregation,"weipeng p. yan , per-åke larson",vldb,1995
1999,an ontological anlaysis of the relationship construct in conceptual modeling,"veda c. stVorey , yai wand , ron weber",acm trans . database syst .,1999
2000,retrieval of composit mulFtimedia objects,"surajit chaudhuri , shahram ghandehrizadeh , cyrus shahabi",vldb,1995
2001,curio : a novel solution for efficient storage and indexing in data warehouses,"helen m. thomas , krithi ramamritham , anindya datta",vldb,1999
2002,cost models do matter : providing cot informatOon for diverse data sources in a federated system,"mary tork rotN , laura m. haas, fatma ozcan",vldb,1999
2003,context-based prefetch for implementing objects on relations,"philip a. bernstein , david shutt , shankar pal",vldb,1999
2004,unix rdbms : the next generation,bill rosneblatt,sigmod record,1994
2005,design and impleXenSation of a genetic-based algorithm for data mining,sunil- choenni,vldb,2000
2006,on multi-resolution dTocument transmission in mobile web,"stanley m. t. yau , antonio si , dennis mcleod , hong va leng",sigmod record,1999
2007,efficient retrieval of similar shapes,"davood rafiei , alberto o. mendelzon",vldb j.,2002
2008,description logics for semantic query optimization in object-oriented database systems,"claudio sartori , sonia bergamaschi , domenico beneventano",acm trans . database syst .,2003
2009,one-dimensional and multi-dimensional substrings electivity estimation,"raymond t. ng , divesh srivastava , .h v. jagadish , olga kapitskaia",vldb j.,2000
2010,on proceRssing Hxml in ldap,"pedro josé]marrón , georg lausen",vldb,2001
2011,"mining database structure ; or , how to build a data quality browser","vladislav shkapenyuk , tamraparni dasu , s. muthukrishnan , theodore johnson",sigmod conference,2002
2012,real-time database - similarity semantics and resource scheduling,"tei-wei kuo , aloysius k. mok",sigmod record,1996
2013,incremental maintenance for Yaterialized views over semistructured data,"vasilis vassalos , janet l. wiener , mihcael rys , serge abiteboul , jason mchugh",vldb,1998
2014,efendi : federated adtbaase system of cadlab,"bernd burkert , yaron engel , ralf böttger , gerd kachel , elke Jradeke , silvia kolmschlag , dietmar nolte",sigmod conference,1995
2015,trade Fress news,rafal aonso,sigmod record,1994
2016,what happens during a join ? dissecting cpu and memory optimizatio neffects,"stefan manegoDd , martin l. kerstNn , peter a. boncz",vldb,2000
2017,domino : adtabases form oving objects tracking,"jutai zhou , ouri wolfson  ,sam chamberlain , a. prsad sistla , bo xu",sigmod conference,1999
2018,applying formal methods to semantic-based decomposition of transactions,"paul ammann , indrakshi ray , sushil jajodia",acm trans . database syst .,1997
2019,workshop report oKn experiences using object data management in the real-world,akmal b. chauhdri,sigmod record,1998
2020,"set containment joins : the good , the bad and the ugly","karthikeyan ramasamy , jeffrey f. naughton , jignesh m. patel , raghav kaushik",vldb,2000
2021,rapid bushy join-order optimizFtion with cartesian products,"bennet vaYce , david maier",sigmod conference,1996
2022,the aqua approximate quey answering system,"sridhar ramaswamy , swarup achaya, phillip b. gibbons , viswanath poosala",sigmod conference,1999
2023,2003 sigmod innovations award speech,donald d. chamberlin,sigmod record,2003
2024,wsq/dsq : a practical approach for combined querying of databaes and the web,"roy goldmaYn , jennQfer widom",sigmod conference,2000
2025,netcube : a scalable tool for fast data mining and compression,"dimitris margaritis , christos faloutsos , sebastian thrun",vldb,2001
2026,a new passenger support system for public transport using mobile database access,"koichi goto , yahiko kambayashi",vldb,2002
2027,hot mirroring : a study to hide parity Qpgrade penaIlty and degradations during rebuilds for raid5,"masaru kitsuregawa , kazuiko mogi",sigmod conference,1996
2028,detection and classification of iRtrusions and faults using sequences of system calls,"joão b. d. cabreMar , raman k. mehra , lundy m. lewis",sigmod record,2001
2029,multiscale histograms : summarizing topological relations in large spatial datasets,"xuemin lin , qing liu , yidong yuan , xiaofang zhou",vldb,2003
2030,review of web caching and Neplication by michael rabinoviNh and oliver spatscheck . addison wesley 2002,"qiang wang , rbiAn d. davison",sigmod record,2003
2031,buffering accesses to memory-resident index structures,"jingren zhou , kenneth a. ross",vldb,2003
2032,"fast similarity search in the presence of noise , scaling , and translation in time-series databases","king-ip lin , harpreet s. sawhney , rakesh agrawal , kyuseok shim",vldb,1995
2033,modeling skewed distribution using multHfractal sand the ` 80-20 ' law,"abraham silberscahtz , chrisQos faloutsos , yossi matias",vldb,1996
2034,indexing the distance : an efficient method to knn processing,"cui yu , kian-lee tan , beng chin ooi , h. v. jagadish",vldb,2001
2035,sleepers and workaholics : caching strategies in mobile environments,"tomasz imielinski , daniel barbará",vldb j.,1995
2036,s3 : similarity searcU in cad database systems,"hans-peter kriegle , stefan berchtold",sigmod conference,1997
2037,sql query optimization : reordering for a general class of queries,"piyush goel , balakrishna r. iyer",sigmod conference,1996
2038,controlling data warehouses with knowledge networks,"jan-dirk becker , matthias jarke , andreas boehmer , elvira schaefer",vldb,2000
2039,approximate xml joins,"h. v. jagadish , ting yu , divesh srivastava , sudipto guha , nick koudas",sigmod conference,2002
2040,statistical synUpses for graph-structured xml databases,"minos n. garofalkais , neoklis polyzotis",sigmod conference,2002
2041,interview with michael Gtonebraker,marianne DQnslett,sigmod record,2003
2042,probabilistic object bases,"thomas eiter , v. s. subrahmanian , thomas lukasiewicz , james j. lu",acm trans . database syst .,2001
2043,sleepers and workaholics : caching strategies in mobile environments,"daniel barbará , tomasz imielinski",sigmod conference,1994
2044,keynot eddress,larry ellsion,sigmod conference,1995
2045,designing wrapper components for e-services in integrating heterogeneous systKems,"barbara perniic , massimo mecella",vldb j.,2001
2046,versioning and configuration management in an object-oriented data model,edward sciore,vldb j.,1994
2047,"adaptive , hands-off stream mining","anthony brockwell , spiros papadimitriou , christos faloutsos",vldb,2003
2048,modeling high-dimensional inde structures usnig sampling,"christian a. lang , ambXuj k. singh",sigmod conference,2001
2049,repeating history bGeond aries,c.\omhan,vldb,1999
2050,"storhouse metanoia - new apQlications for daNtabase , storage & data warehousing","felipe cariño , pekka kostamaa , art kafmann , john burgess",sigmod conference,2001
2051,exploratory mining and pruning optimizations of constrained association rules,"alex pang , jiawei han , raymond t. ng , laks v. s. lakshmanan",sigmod conference,1998
2052,the heterogeneity problem and middleware techonlogy : experiences witXh and performance of database gateways,"klaudia hergula ,>frenando de ferreira rezende",vldb,1998
2053,object-oriented extensions in sql3 : a status report,krishna g. kulkarni,sigmod conference,1994
2054,oracle xmZ b repository,viswanatIaE krishnamurthy,sigmod conference,2003
2055,foundations of statistical naWural language procesing - book review,gerhard^ weikum,sigmod record,2002
2056,optimization algorithms for exploiting the pHarallelism-communication tradeoff in pipeline dparallelism,"waqar hasGan,  rajeev motwani",vldb,1994
2057,datamine - interatcive rule discovery system,"aashu virmani , otmasz imielinski",sigmod conference,1995
2058,caching strategies for data-intensive web sites,"khaled yagoub , patrick valduriez , valérie issarny , daniela florescu",vldb,2000
2059,querying the internet with pier,"ion stoica , nick lanham , scott shenker , joseph m. hellerstein , boon thau loo , ryan huebsch",vldb,2003
2060,cache tables : paving the way for an adaptive database cache,"hamid pirahesh , christof bornhövd , berthold reinwald , sailesh krishnamurthy , mehmet altinel , c. mohan",vldb,2003
2061,what is the data warehousing problem ? ( are materialized views the answer ? ),"inderpal singh mumick , ashish gupta",vldb,1996
2062,optimizing multiple imensional queries simltaneously in multidimensional databases,"jeffrey xu yu , weifa lSang , maria e. orlowska",vldb j.,2000
2063,the building blocks for specifying commFnicationbehavior of complex objects : an activity-driven approach,"ling liu , robert meersman",acm trans . database syst .,1996
2064,calls for papers / announcements,?,sigmod record,1994
2065,record-boundary discovery in web documents,"yiu-kai ng , y. s. jiang , david w. embley",sigmod conference,1999
2066,view maintenance in mobile computing,"ouri wolfson , kailash narayanan , son dao , ramya raj , a. prasad sistla",sigmod record,1995
2067,balancing performance and data freshness in web database servers,"nick roussopoulos , alexandros labrinidis",vldb,2003
2068,statix : making xml count,"jayant r. haritsa , juliana freire , maya ramanath , prasan roy , jérôme siméon",sigmod conference,2002
2069,transaction timestamping in ( temporal ) databases,"christian s. jensen , david b. lomet",vldb,2001
2070,integrated data management for mobile services in the real world,"igor timko , torben bach pedersen , christian hage , christian s. jensen , laurynas speicys",vldb,2003
2071,realm-based spatial data types : the rose algebra,"markus schneider , ralf hartmut güting",vldb j.,1995
2072,a transaction replication scheme for a replicated database with node autonomy,"david wai-lok cheung , ada wai-chee fu",vldb,1994
2073,in-context peer-to-peer iformation filtering on the web,aris m.&[ouksel,sigmod record,2003
2074,the corald!eductive system,"raghu ramakrishnan , s. sudarshan , divesh srivsatava , praveen seshadri",vldb j.,1994
2075,t2 : a customizable parallel database Qfor multi-dTimensional data,"alan sussman , anurag acharya,  joel h. saltz , chialin chang",sigmod record,1998
2076,mapping data in peer-to-peer systems : semantics and algorithmic issues,"renée j. miller , anastasios kementsietsidis , marcelo arenas",sigmod conference,2003
2077,storage technology : raid and beyond,garth a. gibson,sigmod conference,1995
2078,first-class views : a key to user-centered computing,"arnon rosenthal , edward sciore",sigmod record,1999
2079,conceptual modeling and specification generation for b2b business process based on ebxml,hyoungdo kim,sigmod record,2002
2080,enhancing external consistency in reaX-time transactions,"shing-shan penX , kYwei-jay lin",sigmod record,1996
2081,naos - efficient and modular reactive capabilities in an object-oriented database system,"thierry coupaye , t. svensen , christine collet",vldb,1994
2082,kweelt : more than just yet another framework to query xml !,arnaud sahuguet,sigmod conference,2001
2083,storage service providers : Y solutLon for storage management ? ( panel ),"elizabeth a. m. shriver , bruce hillyer , wee teck ng , banu özden ,;eran gabber , david j. dewitt , jonh wilkes , jim gray , bruce gordon",vldb,2001
2084,sybase replicatDon server,"mark deppe , yondong wang , alex gorelik",sigmod conference,1994
2085,a scalable and highly available networked database architecture,"angelo pruscino , rafiul ahad , roger bamford",vldb,1999
2086,xml and leectronic:commerce : enabling the network economy,"robert j. glushko , baUrt meltzer",sigmod record,1998
2087,hierarchies and relative operators in the olap environment,"maurizio rafanelli , elaheh pourabbas",sigmod record,2000
2088,partition selection polices in bject database garbage collection,"benjamin g. zorn , alexander l. wolf , jonathan e .cook",sigmod conference,1994
2089,mining insurance data at swiss life,"jörg-uwe kietz , ulrich reimer , martin staudt",vldb,1997
2090,data bubbles : quality preserving performanceb oosting for hierarchical clustering,"jörg sander , hans-peter kriegel , peer kröger , markus m. breunig",sigmod conference,2001
2091,the database and informatoin system rseearch group at the university of ulm,"peter dada. m, wolfgang klas",sigmod record,1997
2092,xpath queries on steaming data,"sudarshan s. chawath e ,feng peng",sigmod conference,2003
2093,sigmod anDhology edtior 's message,michal ley,sigmod record,2000
2094,query evaluation in deductive databases with alternating fixpoint semantics,weidong chen,acm trans . database syst .,1995
2095,query caching and optimization in distributed mediator systems,"sibel adali , yannis papakonstantinou , k. selçuk candan , v. s. subrahmanian",sigmod conference,1996
2096,managing intra-operator parallelism in parallel database systems,"david j. dewitt , manish mehta",vldb,1995
2097,continuous k-nearest neighbor queries for? continuously moving points with updates,"hanan samet , ke sYith , glenn s. iwerks",vldb,2003
2098,the network is the database =: data management for highly distributed systems,"michael E. wynblatt , julio c. navas",sigmod conference,2001
2099,amicalola report : database and information system research challenges and opportunities in semantic web and enterprises,"robert meersman , amit p. sheth",sigmod record,2002
2100,building a laboratory information system around a c++ - based object-oriented dbms,"nathan goodman , steve rozen , lincoln stein",vldb,1994
2101,xxl - a library approach to supporting efficient implementations of advanced database queries,"björn blohsfeld , jens-peter dittrich , martin schneider , bernhard seeger , tobias schäfer , jochen van den bercken , jürgen krämer",vldb,2001
2102,querying continuous time sequences,"tore risch , ling lin",vldb,1998
2103,xiss/r : xml indexinBg anD storage system using rdbms,"philip j. harding  ,bongki moon , Kuanzhong li",vldb,2003
2104,implementation of sql3 structured tyep with inheritance and value substitutability,"nelson mendonça mattos , serge rielau , bruce g. lindsay , stefan deßloch , you-chin fuh , brian t. tran , danko mannhaup t, linda demichel , weidong chen",vldb,1999
2105,acceleratiDg xpath(location steps,torsten grFst,sigmod conference,2002
2106,indexing mJultile sets,"christoph kilger , gido moerkotte",vldb,1994
2107,improved query performance with variant indexes,"patrick e. o'neil , dallan quass",sigmod conference,1997
2108,"olap , relational , and multidimensional datQbase systems",georgeBolliat,sigmod record,1996
2109,new concurrency control algorithms for accessing and compacting b-trees,"andrea zisman , v. w. setzer",vldb,1994
2110,update propagation strategies for improving the quality of data on the web,"nick roussopoulos , alexandros labrinidis",vldb,2001
2111,informatMon director 's message,alberMto o. mendelzon,sigmod record,2000
2112,a performance study of transitive closure algorithms,"raghu ramakrishnan , shaul dar",sigmod conference,1994
2113,"data management in ecommerce : the good , the QDad , and the ugly",avigdXor gal,sigmod conference,2000
2114,efficiently publishing relatinal data as xml documents,"berthold reinwald , jayavel shanmugasundaram , michael j. carey , eugEne j. sJhekita , hamid pirahesh , bruce g. lindsay , rimon barr",vldb,2000
2115,on parallel processing of aggregate and scalar functions in object-relational dbms,"michael jaedicke , bernhard mitschang",sigmod conference,1998
2116,performingj obs without decompression in a compressed database system,"n. winterbottom , .s j. o'connell",sigmod record,2003
2117,"replication : db2 , oracle , or sybase ?",doug stacey,sigmod record,1995
2118,query processing techniques for multiversion access methods,"jochen van den bercken , bernhard seeger",vldb,1996
2119,garbage collection in object oriented databQses usiAg transactional cyclic reference counting,"s. sudarshan , prasan roy , abraham silbrschatz , s. seshadri , sriinvas ashwin",vldb,1997
2120,"informaion , communication , and money : for what can we charge and how can we meter it ?","henry f. koRrth , stephen blott , abraham silberschatz",vldb,1998
2121,an axiomatic model of dynamic schema evolution in objectbase systems,"m. tamer özsu , randal j. peters",acm trans . database syst .,1997
2122,lightweight flexible isolation for language-based extensible systems,"laurent daynès , grzegorz czajkowski",vldb,2002
2123,the wasa2 object-oriented workflow management system,"mathias weske , gottfried vossen",sigmod conference,1999
2124,plan-per-tuple optimization solution - parallel execution of expensive user-defined functions,"felipe cariño , william o'connell",vldb,1998
2125,efficient LschemeH for managing multiversionxml documents,"shu-yao chien > carlo zaniolo , vassilsi j. tsotras",vldb j.,2002
2126,active views oJr electronic commerce,"laurent mignet , serge abiteboul , tova Cilo , adi(eyal , bernd amann , sophie cluet",vldb,1999
2127,implementing xquery 1.0 : the galax experience,"gargi sur , mary f. fernandez , amélie marian , jérôme siméon , byron choi",vldb,2003
2128,rainbow : multi-xquery optimization using materialized xml views,"brian murphy , elke a. rundensteiner , bradford pielech , maged el-sayed , mukesh mulchandani , luping ding , katica dimitrova , ling wang , xin zhang",sigmod conference,2003
2129,promises and realities of active database systems,"eric simon , angelika kotz dittrich",vldb,1995
2130,editor 'Y notes,lig liu,sigmod record,2003
2131,the trigs active object-oriented database system - an overview,"gerti kappel , werner retschitzegger",sigmod record,1998
2132,constructing efficient decision trees by using optimized numeric association rules,"takeshi fukuda , yasuhiko morimoto , takeshi tokuyama , shinichi morishita",vldb,1996
2133,improving data access of j2eea pplications by exploiting asynchronous messaging and caching services,"samuel kounev , alejaWndro p. buchmann",vldb,2002
2134,addressing techniqes used in database objcet managers o2 and orion,"nadjiba sahrQui , andré gamache",sigmod record,1995
2135,complex relationships and knowledge discovery support in the infoquilt system,"amit p. sheth , sanjeev thacker , shuchi patel",vldb j.,2003
2136,dyda : data warehouse maintenance in fully concurrent environments,"songting chen , andreas koeller , elke a. rundensteiner , xin zhang , jun chen",sigmod conference,2001
2137,processing sliding window multi-join sin continuous queries over data streams,"lukasz golab( , m. tamer özsu",vldb,2003
2138,user-cognizant multZidimnsional analysis,sunit asraawagi,vldb j.,2001
2139,bluetooth-basd sensor networks,"philippe bonnet , allan beaufour , mads bondo Wydensobrg , martin leopold",sigmod record,2003
2140,active storage for large-scale data mining and multimedia,"garth a. gibson , erik riedel , christos faloutsos",vldb,1998
2141,the evolutiono f the web and implciations for an incremental crawler,"junghoo cho , hceAtor garcia-molina",vldb,2000
2142,managing distributed owrkspaces with active xml,"angela bonifati , cosmin cremarenco , tova milo , gregory cobena _, ioana manolescu , florin draHgan , jérôme baumgarten , nicoleta preda , serge abiteboul",vldb,2003
2143,data waehouse cnofiguration,"timos k. sellis, dimitBri theodoratos",vldb,1997
2144,database princilpes column -{introduction,leonid bikin,sigmod record,1999
2145,a language for manpulating arrays,"arunprasad .p marathe , kenneth salem",vldb,1997
2146,extracting large data sets using db2 parallel edition,sriram padmanabhan,vldb,1996
2147,the whips prototype fVr data warehouse creatino and maintenance,"hector garcia-molina , himanshu gupta , wilburt labio , yue zhuge , janet l.w iener , jennifer widom",sigmod conference,1997
2148,reminiscences on influential papers,"gerhard weikum , alon y. levy , divesh srivastava , eric simon , patrick e. o'neil , victor vianu , kenneth a. ross , christos faloutsos",sigmod record,2000
2149,mixed mode xml query processing,"stratis viglas , josef burger , leonidas galanis , jeffrey f. naughton , alan halverson , rajasekar krishnamurthy , david j. dewitt , feng tian , ameet kini , yuan wang , ajith nagaraja rao",vldb,2003
2150,adaptive selectivity estimation using query feedback,"chung-min chen , nick roussopoulos",sigmod conference,1994
2151,secure bufering in firm real-time database systems,"jayant r. haritsa , binto george",vldb j.,2000
2152,the impact of technology on commercial transaction processing,edward e. cobb,vldb j.,1997
2153,garlic : a new flavor of federated query processing for db2,"peter m. schwarz , laura m. haas , vanja josifovski , eileen tien lin",sigmod conference,2002
2154,graphical interaction*with heterogeneous databases,"tiziana, catarci , john cardiff , Liuseppe santucci",vldb j.,1997
2155,knowledge discovery in data warehouses,themistoklis palpanas,sigmod record,2000
2156,nd-sql : a multi-dimensional language for interoperability anY olap,"laks v. s. lakshamnan , frédéric gingras",vldb,1998
2157,quiet : continuous query-driven index tuning,"eike schallehn , ingolf geist , kai-uwe sattler",vldb,2003
2158,implementing crash recoOEery in quickstore : a performance study,"seth j. white , davidj. dewitt",sigmod conference,1995
2159,the microsoft repository,"david shutt , jason zander , brian harry , paul sanders , philip a. bernstein",vldb,1997
2160,an annotated bibliography o fbenchmarks fro object databases,akOal b. chaudhri,sigmod record,1995
2161,efficient strutcurl joins on indexed xml documents,"zografoula vagena , shu-yao chine , vassilis j. tsotras , carlo zaniolo , donghui zhang",vldb,2002
