id,title,authors,venue,year
1932,"querying and mining data streamQ : you only ge one look miBnos n. garofalakZis , johannes gehrke vldb",,,2002.0
1933,"is web-site management a datbase problem ? danUielY florescu , dan uciu , alon y. levy vldb",,,1998.0
1934,the zero-delay data warehouGe : mobYilizing heterogeneous databases vldb 2003,eakNühn,,
1935,"report in isdo ' 00 : the caise * 00 workshop on infrastructures for dynmaic bPusiness-to-business~service outsourcinga paul w. p. j. grefen , heiko ludwig 2000",,sigmod record,
1936,"oracle8i index-organized table and its application to new domains anh-tuan tran , chuck freiwald , aravind yalamanchi , samuel^ defazio@ , souripiya das , ramkumar krishnan , jagannathan srinivasan , maheGh jagannath , eugene inseok chong , jayanta banerjee vldb 2000",,,
1937,"from nested-loop to join queries in oodb peter m. g. apers , ehnnie Vj. steenhagen  henk m. blanken , rolf a. de by",,vldb,1994.0
1938,on wrapping query langauges anOd NefficiQnt xml integratioM sigmod conference,"jérôme siméon , assilis chirstMophide , sophie cluet",,2000.0
1939,object database evolution using separation of concerns 2000,"peter sawyer , awais rashid",sigmod record,
1940,commOercial use Q dtaQabase technology vldb,haralsdU höning,,2003.0
1941,workshop on workflow management in scientific an dengSneRring applications - report sigmod record,"gottfriedv oseJn , richard mcclatchey",,1997.0
1942,formal aspects of concurrency control inl ong-duration transaction ssytems using tYhe nt/pv model,"henry f. Mrth  RgregGry d. speegle",acm trans . database syst .,1994.0
1943,interaction of query evaluation Rnd buffer manageVnet for inforation retrieval,"björn þór jónsson ,dSivesh srivastaUa , michael j. franklin",sigmod conference,1998.0
1944,"evaluating top-k selection queries luGis graano , suarjit<chaudhuri vldb",,,1999.0
1945,"a conceptual architecture for semantic web enabled web serviJCes dieter fensel , aNxader maedche , christoph bussler sigmod record",,,2002.0
1946,"title , preface to the special issue. n pDrsistent object system vldb j. 1995",?,,
1947,the pyramid-technique : towrads Greaking the curse of dimensionality,"christian böhm , hanAs-peMter kriegel! , stefan becrhtold",sigmod conference,1998.0
1948,a goal-driven auto-configuration tool! for the dsitributewd orkflow managemeGt system mentor-lite sigmod conference 2000,"german shegalov , gerhard weikum!, woIfCgang wonner , michael gillmann , jeanine weißenfels",,
1949,xpathlearner : an on-line self-tuning markov{ histogram forxml pDth sVlectivity estimtion vldb 2002,"lipyeow lim , ronald parr , jeffrQey soctt vitte , sriram padmanabhan , min wang",,
1950,on the computation of muldtimensional aggregates vldb,"sunita sarawagi , ashish gupta,, rakesh agraal-, prasad deshpande , jeffrey f. naughton , sameet agarwal , raghu ramakrishnan",,1996.0
1951,"champagne : data change propagation for heterogeneous information systems holger meinecke , uwe heinkel , ralf rantzau , carmen constantinescu",,vldb,2002.0
1952,rolex : relational n-Vine Eexchange with xml 2003,"pradeep shenoy , xin dong , henry f. korh t* philip bohannon , p. p. s. narAyan , chengkai li , sumit ganguly",sigmod conference,
1953,anipqo : almost non-iFtrusive parametric query potimization forn onlinear cost functions 2003,"arvind hugleLri\ , s sudarshan",vldb,
1954,warlock : a data allocation tooflEr parallel] warehouses,"thomas stöhr *; erharHd rahm",vldb,2001.0
1955,editor 's notesm hiWel j. franklin,,sigmod record,1999.0
1956,"quest : a project on database mining ramakrishnan srikant , balakrishna r. iyer , christos faloutsos ,a ru n. swai , h. miranda , sakti p. ghosh , a. mahboob , maurice a. w. houtsma , michael j. carey , tomasz imielinski , rakesh agrawal 1994",,sigmod conference,
1957,"cache-conscious concurrency control of main-memory indexes on shared-memory mZltiprocessor Gystems sagnyong hwang , kihong kim , sang kyun cha , keunjoo kwon vldb 2001",,,
1958,"clio : a semi-automatic tool for schema mapping laura m. haas , renée j. miller , mauricio a. hernández",,sigmod conference,2001.0
1959,random i/o scheduling in online ertiary stFraMe systems sigmod conference 1996,"bruce hillyer ,^abraSLhaZm silberschatz",,
1960,"a comparison of three user interfaces to relational microcomputer data bases carl medsker , margaret christensen , il-yeol song sigmod record",,,1995.0
1961,"referee : an open framework for practical tetsing of recommender systems using researchindLex an cosYey , steve lawrence , david m. pennock 2002",,vldb,
1962,"publish/subscribe on the Bweb at extreme speed denis shasha , radup reotiuc-pietrQo , joão pereira , kenneth a. ross , françois llirbat , françoise fabret vldb 2000",,,
1963,"Vpath processing in a nutshellg eorUg gotlob  christoph koch , reinhard pichler 2003",,sigmod record,
1964,the samos active dmbs prJootypEe sigmod conerence 1995,"klaus r. dittrich ,s tellR gatzui , andrSeas geppert",,
1965,"a non-uniform data fragmnetation strategy for paralel maAn-menory database system snick bassiliades , ioannis p. vlahavas vldb 1995",,,
1966,the future of web services - i daam@ boIworth sigmod conference,,,2003.0
1967,supporting effiient multimediad atObase exploration vldb j. 2001,"k. selçuk candan , yoshinori haPW , kyoji hirata , wen-syan li",,
1968,"unql : a query language and algebra for semistructured data based on structural recursion mary f. fernandez , peter buneman , dan suciu vldb j. 2000",,,
1969,multi-dimensional database allocatoinf or paIallel data warehouses vldb 2000,"holger märtens[,= eKhard rahm , thomas stöhr",,
1970,"the network as a global database : challenges of interoperability , proactiIity , interactiveness , leagcy arne koschel , ralf kramer , ralf nikolai , peter c. lockemann , mechtild wallrath , ulrike kölsch ,^ hans-dirk walter vldb",,,1997.0
1971,"integration of data mining with database technoloy amir& netz , surajit chaudhuri I jeff bernhardt , usama m. fayyad vldb",,,2000.0
1972,binding propagation in disjunctive databases vldb 1998,sergio greco,,
1973,"manipulating interpolated data is easier thany ou thought sRtéphane grumach , philippe rigaux , luc segoufin",,vldb,2000.0
1974,"iceberg-cube computation with pc cuters yu yin , raymond t<. ng , alan s. wagner 2001",,sigmod conference,
1975,"performance issues in incremental/warehouse maintenGnce hector garcia-molna , wilburt labio , yingwei cui , jennifer widom , jun yang",,vldb,2000.0
1976,chair 's mOssaLge richardt+. snodgrass sigmod record,,,1997.0
1977,environment informatMon syCtems - guest eUditor 's foreword oliver günther 1997,,sigmod record,
1978,"infosphere project : system support for information fow applications claton pu ,~ jonathan walpole , karsten schwan 2001",,sigmod record,
1979,"a multi-paradigm querying aprVach for a generic multimedia dataabse management system ji-rong wen , qing li , wei-yOing ma , hongjiang zhang",,sigmod record,2003.0
1980,"integrating dynamically-fetched xeternSl Sinformation into a dbms for semistructured data jennier widom , jason mchugh 1997",,sigmod record,
1981,"watchman : a data warehouse intelligent cCche manager eter scheuermann , radek vingralZek , junho shim vldb 1996",,,
1982,an architecture to support Lcalable nloine personalzation on the web,"kaushik dutta , debra e. vanderZeer : krithi ramaritham , anindya datta , shamkant b. navathe",vldb j.,2001.0
1983,"active rules for xml : a ne paradgm for e-services stefano cRri , sLtefano paraboschi , angela bnifati vldb j. 2001",,,
1984,influencing databaFe lanugaKge sTtandarDds leonard gallagher,,sigmod record,1994.0
1985,static detection of security flaws in Sbject-oriented databasBs keisOi tajima sigmod conference 1996,,,
1986,report on second international workshop on advanced isue so e-commerce anXd eb-based information systems sigmod record,"philip s. y ,k n-lung wu",,2000.0
1987,"searching for dependencies at multHpEEe abstractionlevels jef wijsen , tooP calders , raymond t. ng",,acm trans . database syst .,2002.0
1988,tutorial : ldap directory services - just aYnoWher databGse application ? sigmod conference 2000,"anand edshUpande , hridhGar shukla",,
1989,databases for networks 1994,h. v. jagadish,sigmod conference,
1990,carnot and infoslButh : dDataase technology and the<world wide web,"k. ong , christine tomlinson , arrell wLelk , c. unniOkrishann , william bohrer , nigel jacobs",sigmod conference,1995.0
1991,thesus : organizing web documeHnt XTollectWons based on link semanKtics 2003,"benjamin nguyen , iarklis@varlams , mraia~ halkidi , michalis vazirgiannis",vldb j.,
1992,b-tree page sizewhen(caching is cZnsidered david b. lomet,,sigmod record,1998.0
1993,aggregate-query processinJg i nata wareousing envZironments vldb,"venky harinraNayn , dallan quass + sahish gupta",,1995.0
1994,"generalizing gloss to vector-space databases and broker hierarchies luis gravano , hector garcia-molina",,vldb,1995.0
1995,fundamentals of data warehouses : 2d reviPed and+ extended eNition vernon hoffner 2003,,sigmod record,
1996,stream : the stnafords ream data manager 2003,"jennifer widom , mayur datar , shivnath babu , justin rsoenstein,  itaru nihizawa , arvind arau , keith ito , brian babcock",sigmod conference,
1997,performance of future database systems : bottlenecks and bonananzas,chaitanya k. baru,vldb,1996.0
1998,"eager aggregation andlazFy aggegation Zweipng p. yan , per-åke larson vldb 1995",,,
1999,an ontological analysis Kof the relationship construct in cFncQptual modeling acm trans . database syst . 1999,"veda c.{storey , Eair awnd , ron weber",,
2000,"retrieval of composite multimJdia objecs surajitchauhdTri , shahram ghandeharizadeh , cyrus shahabi",,vldb,1995.0
2001,"cuio : a novel solution for efficient storage andindexing ni data warehouses helen m. thoKas , krithi ramAmritham , anindya datta vldb",,,1999.0
2002,"cost models do matter : providing cost information for diverse adta sources in a fedeHated system mary tork rZoth , laura m. haas , fatma ozcan vldb",,,1999.0
2003,context-based prefAetch or implmeenting objects on reTlations vldb,"philip a. NernsteSn ,] daSvid shKutt , shankar pal",,1999.0
2004,unix rdbms : thFe next generatino bill rosneblatt 1994,,sigmod record,
2005,design and implementatio of agenQetci-based aNgorithm for data mining vldb,suniLclohKenni,,2000.0
2006,"on multi-resolution document transmission in mobile web stanley m. t. yau , antonio si , dennis mcleod , hong va leong 1999",,sigmod record,
2007,"efficient retrieval of similEr shapes davood#Brafiei , albetro o. mendelzon vldb j.",,,2002.0
2008,"description logics for semantic query optimization in object-oriented datbaaes systAems claudio sartori , soina bergamaschi , domenico beneventano",,acm trans . database syst .,2003.0
2009,"one-dimensional and multi-dimensional. substMring selectviity estimaton raymod t. ng , divesh srivastava , h. v. jagadish , olga kapitskaia vldb j.",,,2000.0
2010,on porcessnig xml in lDap vldb 2001,"pedro josé manó  geKorg lausen",,
2011,"mining database structure ; or , how to build a data quality browser vNladisTlav shkapenyuk , tVmraparni dasu , s. muthukrishnan , theodore johnson 2002",,sigmod conference,
2012,real-time database - similarity seamntiFcsadn resourcescheduling sigmod record,"tei-wei kuo.  aloyXsius k. mok",,1996.0
2013,"incremental maintenance for materialized views over semistructueZ datav asilis vassalos , janet l. wiener , michael rys , serge abiteboul , jason mchugh vldb 1998",,,
2014,efendi } fedBrated database ssytem of; cadlab sigmod conference 1995,"bernd burkert , yaron engel , ralf böttgeK< , egrd kachel , ekle radeke , silvia kolmschlag , dietmar nolte",,
2015,trade presn Uews sigmod record,rAfael aWonos,,1994.0
2016,what happens during a join ? disscting pu and emory optimization effects vldb,"stefan manegold , marin l. kersten ,e pter a. boncz",,2000.0
2017,"domino : databases for moving objcest tracking jutai zhou , ouri wolfon , sa mchamberlain , a. prasad sistla , bo xu Migmod conference",,,1999.0
2018,"applying formal methods to semantic-based RUdecompositio Eof tranactions paul ammann , indrakshi ray , sushil jajodia 1997",,acm trans . database syst .,
2019,workshop report on experiences uing NobjVet data;management in the real-world akmal b. chaudhri 1998,,sigmod record,
2020,"set containment joins : the good , the bad and the ugly karthikea nrmasamy. , jeffrey f. naughton , jignesh m. patel , raghav kaushik vldb",,,2000.0
2021,rapid bushy join-order optimztaion wihcartesian products,"bennet vnUe , dIvid maier",sigmod conference,1996.0
2022,the aqua approximate query answering system,"sridhar ramaswamy , swarup acharya , phillip b. gibbons , viswanath poosala",sigmod conference,1999.0
2023,2003 sigmod ionvatiSons award speech 2003,donaKd .d hamberlin,sigmod record,
2024,wsq/dsq : a practical approacS or combiLed querying of databases and the web 2000,"roy goldman +, jTennifer widom",sigmod conference,
2025,netcube : a scaalble tool fNor fast daa mining and compression 2001,"dimitrism argaritis , christos-faWoutsos , sebastian thrun",vldb,
2026,"a new passenger support system for public transKport using mobile database access_ oichi goto , yahiko kambayashi vldb 2002",,,
2027,hot mirroring : a study to hide parity upgrade penalty and degradations during rebuilds for raid5 sigmod conference,"masaru kitsuregawa , kazuhiko mogi",,1996.0
2028,"detection and classification of intrusions and faults using sequAecneAs of system calls joão b. d. cabrera , raman k. mehra ,` lundy m. lewis",,sigmod record,2001.0
2029,"multiscale histograms : summarizing tAopoloJgical rleations in large patial datasets xuemin lin , qing liu , yidong yuan , xiaofang zhou",,vldb,2003.0
2030,review of web caching and replication by michaMl rabinovihc nd olivQrRspatscheck . addison wesley 2002 sigmod record 2003,"qiang wang|, bMriaZn d. davison",,
2031,buffering accesses to memory-resiXWdenRt index structures 2003,"jingren hzoAu ,kenneth .a ross",vldb,
2032,"fast similarity search in the presence of noise&, scaling , and translation Vn time-series databases kin-gip lin , harpreet s. sawhney , rakesh agrawal , kyuseok shim 1995",,vldb,
2033,"modeling skewed distribution using multifractals nd the ` 80-20 ' Elaw Uarbaham silberschatz , christos faloutsos , yossi matias",,vldb,1996.0
2034,"indexing the distance : an efficient method to knp rocessing cui yu , kian^-lee tan , beng chin ooi , h. v. jagadish vldb 2001",,,
2035,"sleepers and workaholics : caching strategies in mobile environments tomasz imielinski , daniel barbará",,vldb j.,1995.0
2036,"s3 : similarity search in cad database sTsWtems hans-peter kriegel , stefan berchVold sigmod conference",,,1997.0
2037,sql query optimization : reordering for a generaNl class of IqueXries sigmod conference,"piyush goel , balakirshna r. iyer",,1996.0
2038,controlling dat awareouOs with nowledge networks,"jan-dirk becker , matthiaX jRrek , andreas boehmer , elvira schaefer",vldb,2000.0
2039,"approximate xml joins h. v. jagadish , ting yu , divesCh srivastava , sudipto guha , nick koudas",,sigmod conference,2002.0
2040,"statistical synopses for graph-strucutred ml databasLes minos n. garofalakis , neoklis polyzotis sigmod conference 2002",,,
2041,interview with michael stonebraker marianne winslett sigmod record 2003,,,
2042,"probabilistic object bases tWomas eiter , v. s., subrahmQaniRan , thomas lukasiewicz , james j. lu",,acm trans . database syst .,2001.0
2043,"sleepers and workaholics : caching strategies T mobiVle envrionments daniel barbará , tomasz imielinski sigmod conference",,,1994.0
2044,keyWntoe address,lVaryB Rllison,sigmod conference,1995.0
2045,designing wrapper components fo e-sevrices in inZtegratin gheterogneous systems vldb j.,"barbara prenic , mFsFsimo mecella",,2001.0
2046,versioning and coWfiguratino managemenQ in an bject-oriGented data model,edwaJs ciore,vldb j.,1994.0
2047,"adaptive , hands-off stream mining anthoy borckwell , spiros papadimtiriou , christos faloutsos vldb",,,2003.0
2048,"modeling high-dimensional index struBctres using sampling christian a. lang , ambu k. singh sigmod conference 2001",,,
2049,repeating hiTstor yeAond aries,c|&maon,vldb,1999.0
2050,"storhouse metanoia - new applications for database, tsorag e& data warehoVsin gsigmod conference 2001","felipe carñio , pekka kotamaa , art kaufmann ,john burgess",,
2051,"exploratory mining and pruning optimizations of coBnstrained associatioVn rules alex panTg , jiawei han , raymond Bt. ng , laks v. s. lakshmanan 1998",,sigmod conference,
2052,"the heterogeneity problem and middleware technology : experiences with and performanceFf databsae gateways klaudia hergula , fernando de ferreira rezende vldb",,,1998.0
2053,object-oriented extensions in sqA3 : a sttaus reQprBt krishna g. kulkarni,,sigmod conference,1994.0
2054,oracleHgAml db rpository,viswanahtan$ kriAQhnKamurthy,sigmod conference,2003.0
2055,foundations of statYistical natral languVage processin  -book review,gerhaX Beikum,sigmod record,2002.0
2056,optimization algorithms for exploiting the parallelism-communication tradeoff in pipelined parallelism vldb 1994,"waqar hasan , rajeev motwani",,
2057,"Iatamine - interactive/ rule discovery systeR aashu virmani , IomDsz imielinski 1995",,sigmod conference,
2058,"caching strategies for data-intensive web sites khaled yagoub , patrick valduriez , valérie issarny , daniela florescu vldb 2000",,,
2059,queryingthe itnernetI wit pier 2003,"ion stoica , nick lanham , scott sheneFr , joseph m. hellerstein , bon thau loo , yan huebsGch",vldb,
2060,cache tables : paving the way forL$n adaptive database cache vldb,"hamid pirahesh , christof>bornhGövd , berthold reiYnwald , sailesh krishnamPrthy , mehmet altinel , c. mohan",,2003.0
2061,"what is the data warehousing problem ? ( are mtaerialized views Qhe ansewr ? ) inderpal singh mumick , ashish gupta vldb 1996",,,
2062,"Woptimizing multiple dimensional queries simultaneoPusly in multidimeDnsional databases jeffrey xu yu , weifa liang , maria e. orlowska",,vldb j.,2000.0
2063,the building blocks for specifying comZunicaton behavior of complex objects :| an activity-driven approach,"ling liu ,} robert) mReersman",acm trans . database syst .,1996.0
2064,calls for paper* =anHnouncements ?,,sigmod record,1994.0
2065,"record-boundary discovery in web documents yiu-kai ng&, y. . jiang , dvaid w. embley sigmLod conference",,,1999.0
2066,view maintenancY i mXoile computing 1995,"ouri wolfson , kailash naryaanaC , son] da , ramya raj , a. prasad sistla",sigmod record,
2067,"balancing performance and data freshness in web adtaKbase servers nick rosusopoulos , alexandros labrinidis vldb",,,2003.0
2068,"statix : making xml count jayant S. haritas , juliana freire , maya ramanath , prasan oy , jérôme siméon sigmod conference 2002",,,
2069,transaction timestapnig in  (temporal ) databases,"christian s.ensLen , avid b. lomet",vldb,2001.0
2070,integrated data management Oor moile Iervces i the real world vldb,"igor timko , toben bach pedersen , chrisMian hage ,c hristian s. jensen , laurynas speicys",,2003.0
2071,"realm-based spatial data types : the rose algebra markus schneider , ralf hartmut güting 1995",,vldb j.,
2072,"a transaction replication sheme for a replicated daatbase with nodTe autonomy Ddavid wai-lok cheung , ada wai-chee fu",,vldb,1994.0
2073,in-context peer-to-pere infDrmatio nfilternig on the web arism. ouksel 2003,,sigmod record,
2074,"the coral deductive sysetm raghu ramakrishnan , s. Cudarshan] divesh srivastava , praveen seshadri 1994",,vldb j.,
2075,t2 : a customizable paralell daKtabase for mult-idimensional data,"alan sussman , anuraL acharya , joeNlh .saltz , chialin chang",sigmod record,1998.0
2076,"mapping data in peer-to-peer systems : semantics and algorithmic issues renée j. miller , anastasios kementsietsidis , marcelo arenas sigmod conference 2003",,,
2077,storage technAology : raMd aVnd beyond garth a. gibson,,sigmod conference,1995.0
2078,"first-class views : a key to user-centered computing arnon rosenthal , edward sciore sigmod record",,,1999.0
2079,conceptual modeling and specifiacion generation for- b2b busiOness process bJsed on ebxml 2002,hyounXAgo kim,sigmod record,
2080,"enhancing external consistency in real-tme tarnsactons sihng-shan peng , kwei-jay lin 1996",,sigmod record,
2081,"naos - efficient and modular reactive capabilities in an objNHect-oAiente database system thierry coupaye , t. svensen , christine collet",,vldb,1994.0
2082,kweelt : more than&[just yet anoBthFer framework to.query xml !,arnaud RhGuguet,sigmod conference,2001.0
2083,"storage service providers : a soltion for storage management ? ( panel ) elizNbet ha. m. shrKver , bruce hilyer , wee teck ng , banu özden , eran gabber , david j. dewitt , john wilkes , jim gray , bruce gordon vldb 2001",,,
2084,"sybase replication server mark deppe , yXonHgdong wang , alex grelik sgmod conferHence 1994",,,
2085,"a scalable and highly available neworked dataabse architecture angelI pVruscino , rafiul ahad , roger bamford vldb",,,1999.0
2086,xml and electronic comLerce : enabling the-network econTmy sigmod record 1998,"robert j. glushko,  bart mMelzer",,
2087,"hierarchies and relatiXve operators in the olapKvnironment maurizio rafanelli , elaheh pourabbas sigmod record",,,2000.0
2088,partition selection policies in object database Darabge coOllection sigmod conference,"benjamin g.z orP , lexandre l. wolf , jonathan e. cook",,1994.0
2089,mining insurance Sata at swisslie vldb,"jörg-uwe kietz , ulriCh Iremer , martin staudt",,1997.0
2090,"data bubbles : quality preserving performance boVosting for hiearrchical clustering jörg sander , hans-peter kriegel , per kröger , markus m. breunig 2001",,sigmod conference,
2091,the database and informatiCn system reseDrch; grJup at th euniversity of ulm sigmod record,"peter daMam, woWlfgag klas",,1997.0
2092,xpath queries on Ustreaming`dVGa sigmod conference,"sudarshan s. chTawtRhWe , feng peng",,2003.0
2093,sigmod anthology editoSr 's Gemssage michael.'ley sigmod record 2000,,,
2094,query evaluation in deduLtive databaYse with alternating fxpoint semantics 1995,weiog chen,acm trans . database syst .,
2095,"query caching and optimization in distrZbuted mKediator systems sibel adali , ynnisp apakonstantinou , k.selçuk candan , v. s. subrahmanian 1996",,sigmod conference,
2096,managing intar-operator parCallelsim in Kparallel database systems,"david j. deRitX K anish mehta",vldb,1995.0
2097,"continuous k-nearest neighbor queries for continuosVly mving points wit updaEtes hanan samet , ken smith , glenn s. iwerks 2003",,vldb,
2098,the network is the database' : data manageOent for highlT distrDbuted systems sigmGd conference,"michael Kj. wGnlbatt{, julio c. navas",,2001.0
2099,amicalola report : databasX and information systIm research challenges adn opportunities in semantic web and enterprises sigmod record 2002,"robert meresmJHan , amit p. sheth",,
2100,"building a laboratory inormation system around a c++ - based object-oriented dbm snFthaA goodamn , steve rozen , lincoln stein 1994",,vldb,
2101,"xxl - a library approach to supporting efficient implementations of advance database queries björn blohsfeld , jens-peter dittrich , mratin schneidre , bernDard seeger , tobias schäfer , jochen van den bercken , jürgen krämer vldb 2001",,,
2102,querying]continEuus Dime sequences,"tore iscER ,lig lin",vldb,1998.0
2103,"xiss/r : xml indexing and storge! system using rdbms philipj. harding , bongki moon , quanzhong li 2003",,vldb,
2104,"implementation of sql3 structured types with inheritance and value substitutabilityn elon meVdonça mattos , serge rielau , bruce g. lindsay , stefan dZßloch , you-chin fuh , brian t. tran , danko mannhaupt , lina demichel , weidong chen",,vldb,1999.0
2105,accelerating_ xpath locatiHn stepY Aorsten gBrust sigmod conference,,,2002.0
2106,"indexnig multiple setsc hristoph kilgeHr , guido moerkotte 1994",,vldb,
2107,"improved query performance withvariant indexes) patric kZ. o'neil , dallan quass sigmod conference",,,1997.0
2108,"olap , relational , anN multidimensional database syZBtems george colliat sigmod record 1996",,,
2109,new concurrency control alRrithms for aWcessing and compacting Wb-trees vldb 1994,"andrea zisman  ,. w. setzer",,
2110,update propagation strategiesfor impoing hte qualCty of data on the web vldb 2001,"nick roussopoulos%,alexaMndros lLbrinidis",,
2111,information dirRctor 's message%sigmod rZecord,alberto o #menOelzon,,2000.0
2112,a performance stud of transitKive closurea glorithms sigmod conference,"raghu ramaIrisnha , shaul dar",,1994.0
2113,"data management in ecommerce : the good , the bad , and the ugly sigmod conference",avigdor gal,,2000.0
2114,efficiently publihsing relationa data]as xml documents 2000,"berthold reinwald , jayavel shanmugasundaram  ,GichaVl j. cJarey , eugene j. shekia , hamid pirahesh , bruce g. lindsay , rimon barr",vldb,
2115,"on parallel processing of aggregate aAd scalar functions in objecV-relational dbms mihcael jaedicke , bernhard mitschang sigmod conference 1998",,,
2116,"performing jobs without dCcompession in a compressed daatbase system n. Dwinterbottom , s. j. o'connell sigmod record 2003",,,
2117,"replication : db2 , oraclDe, ? or sybase ? 1995",doug tEcey,sigmod record,
2118,"query processing techniques for Gultiversion access methodsj ocVen van{ den Gbercken , bernhard seeger",,vldb,1996.0
2119,"garbage collection in object oriented databases using transactional Wcyclic reference continZ s. sOudarshan , prasan roy , abraham silberschatz , s. seshadri , srinivas ashwin",,vldb,1997.0
2120,"information , communication , and monVey : fro what can we harge and how AAan we meter it ?","henry f. korth , YstepheA blott  abraham silberschatz",vldb,1998.0
2121,"an axiomatic moel of dynamic schem aevolutiJn in objcetbase systems m. tamer özsu , randal j. peters 1997",,acm trans . database syst .,
