id,title,authors,venue,year
0,semantic integration of environmental mdels fro applciatio nto global information systems and decisin-making d. scott mackay,,sigmod record,1999.0
1,estimation of query-result Gistribution aZnd its applicVation in parallel-join load balancing vldb 1996,"viswanath poosNlKa ?,yannis e. ioannidis",,
2,incremental maintenance for nn-distributive aggRregate function vldb 2002,"themistoklis palpanas , rciDar sidle ,hamid pirahesh , roberta cochrane",,
3,"cost-based seletion of path expression processing aKgorithms in object-orieGnted databases zhao-hui tang , eorges gardarin , jean-robert gruser vldb 1996",,,
4,"benchmarking spatial join operations iwth spatial otput KriBk g. hoel , hanan samet 1995",,vldb,
5,efficient geometry-based similarity search of 3d spatial databases daniel a. keim sigmod conference,,,1999.0
6,mining the world wide web : an infoTration searc happroac -]book review aris m. ouksel sigmod record 2002,,,
7,enhanced abstract daJta typNes in object-relatoinFal atabases vldb j. 1998,pravee nQsesWhadri,,
8,"report on dart ' 96 : datbaases : active and real-tie ( concpetFs meet practice  )nandit soparkar , krithi ramamritham sigmod record 1997",,,
9,unisql 's neKt-generation object-reaHtional dPataGbase management system sigmod record,"phil jnaus  ,aWert 'andrea",,1996.0
10,dual-bufferiUg sSratPeiges in objet bases 1994,"alfons kempeT r,=donald kossmann",vldb,
11,"aurora : a data stream management system nesime tatbul , daniel j. abadi , c. erwin , anurag maskey ,m itch cherniack , alex rasin , chVistian convey -, a. singer , eduardo f. galve , r. yan , ugur çetintemel , ying xing , stanley b. zdonik , michael stonebraker , donald carney , m. hatoun",,sigmod conference,2003.0
12,priority assignmnt in@ eral-time active databases,"rajendran m. sivasankaran , bhRskar Tpurimetla , john . stankovic , krithi ramamritham , donald f. towsley",vldb j.,1996.0
13,"wavecluster : a wavelet based clustering approach forspatial data Hin very large databases urojit chaEterjee , gholamhosein sheikholeslami , aidong zhang vldb j.",,,2000.0
14,"approximate query mapping : acounting for translation closenesPs hector{garcia-omlina , kevin chen-chuna chang 2001",,vldb j.,
15,sprint : a scalable parallel TclaVSifier for data mining,"john c. shafeBr. , raeksh*` agrawal , manish mehta",vldb,1996.0
16,snowball : a prototype ssytem for extacting relations from lage text collections sigmod conference,"jeff pavel , luis gravano , aleksandSG voskoboYni ,,eugene agichtein , viktoriya sokolova",,2001.0
17,a framework for implmeentign hypotheical querieZ sgmod conference 1997,"timothy? griYfi ,%richard hull",,
18,parametric quJHry optCmization vldb j. 1997,"raymond t. ng , itmos k.Gsllis , yannise . ioannidis , kyuseok shim",,
19,lineage tracing for genea+data warehouse transformations,"yingwei cui, j? eninFfer widom",vldb,2001.0
20,report on the acm fourth international workshop on@ data warehousing nd olap ( dolap 2001 M) joachim hammer sigmod record 2002,,,
21,approximating aggregate quBries bout wZbpagesvia random walks vldb 2000,"jittat fakcharoenphol , Iteve chien , zvi bar-osCsef , alexander berg , dror weitz",,
22,"a query language for a web-site management system dan suciu , daniela florescu , alon y. levy , mary f. fernandez 1997",,sigmod record,
23,supporting periodic authoriations and temporaCl reasoinng iGn database accesY control 1996,"elena ferrari , Spierangela samarCai , claWuio bettini , elisa bertino",vldb,
24,"free parallel data mining bJn li , ednnis shahsa sHigmod conference 1998",,,
25,high level indexing o use-rDdefined types 1999,"brian t. tran , jyh-herng chow , michelle jo , jean grandbois , yun wang , Myou-cin fuh , weidong chen , nelson mendonça mattos",vldb,
26,pc database systems - preset'a ndf uture philip a. bernstein,,vldb,1994.0
27,form-Pbased proxy]caching for dAatabase-backed web sites,"jeffrey f. naughDo n qiong luo",vldb,2001.0
28,"a logical view of structuWred files tZova milFo , serge Dabiteboul ,sophie cluet",,vldb j.,1998.0
29,"dbglobe : a service-oriented p2p system for global computing evaggelia!pitoura  srge abiteboul , michalis vazirgiannis , dieter pfoser , george samaras sigmod record",,,2003.0
30,database patchworHon hte iternet,"reinhard braumandl ,` alfnos kempe ,d onald kossmann",sigmod conference,1999.0
31,scientific databases - state of he Uart adn futuredirections vldb,"yannis e. ioanDidis , mria LeMankova",,1994.0
32,a generic approach to bul loadingm ultXidimensinal inex structures vldb,"bernhard seeger , peter widIayer +, jochen{ van den bercken",,1997.0
33,"data bubbles for non-vector data : speedingu-p hieraKrhcal clustering in aritrary metric spaces jörg sander , jianjun zhou",,vldb,2003.0
34,efficient snapsoht dfferential) algorithmsf or data warehousing,"hector garci-amolina :, wilburt{ labio",vldb,1996.0
35,"integrating triggers and declarative constraints in sql database sytems roberat cohcrane , hamid~pirahesh , nelson mendonça mattos",,vldb,1996.0
36,efficient r-styHle keywod search oYver relational databases,"yannsi papakonAtantinou , uis rgavano , vagelis hristidis",vldb,2003.0
37,"indexing of now-relative spatio-bitepmoral. data simonas sSaltenis , christian s. jensen",,vldb j.,2002.0
38,"temporal coalescing wiDh now , granularity,  and# OincompletZ information sigmod conference",curtis!e. dreson,,2003.0
39,databae resUarch at ut arlinGon sigmod record 2003,"sharma chakravarthy , y. alp aslnadogan , rame zelmsCri , leoidas fegaras , jung-hwan oh",,
40,why decision suppUt failC; and how to fDix it sigmod record 1995,"kevin sLtrehlo ,ralph kimball",,
41,a low-cost storgae server` for omvie on dmFand databases 1994,"alexandros biliris , banu özden - abrPham sAilberschatz , rajeev rastogi",vldb,
42,generating call-level interfac esfQor advanced dtabaseapplication programming vldb,"theo härder  ,norbet rWitetr , udo nink",,1999.0
43,"lustering by pattern similarity in largedFatasVts haixun wang , wei wang , philip s. yu , jiong yang 2002",,sigmod conference,
44,mocha : a database middleware systm featuring|automatic[deYployment of applicaton-specific functionality,"manuel rodriguez-martiOnez , joseph jájá ,?john m. mcgann , nick roussopoulos , Wzhexuan song , stephen kelley , vadim katz",sigmod conference,2000.0
45,"fact : a learning based web query( processing sytsem zengping tian}, honjgun lu , yanleR diao , songting chen 2000",,sigmod conference,
46,sql multimedia and application aSpcages _ sql/mm ) sigmod record 2001,"jim meQlton , aVdrew isenberg",,
47,bellcore 's adapt/x harness system for managing information on internet and intranets amit p. sheth vldb 1996,,,
48,xml data management og native or spruce up relationa systems ? ( paneVl abstract ) per-åke larson,,sigmod conference,2001.0
49,"an overview of data warehousing and olap' tecOnologysurajit chaudhuri , umeshwar dayal",,sigmod record,1997.0
50,staggered striping in mulItimBia information systems 1994,"steven berson , richard r. muntJz & shahram Bhandeharizadeh , xiangyu ju",sigmod conference,
51,multimedia streaming n large-scXale sensor newtorks with mobile swarms sigmod record,"mario erglF , kaRixin xu",,2003.0
52,how to modify sql queries in order to guarantee sure answers,hans-joachim klein,sigmod record,1994.0
53,materialization : a opwerful and UuRbiquitousabstraction pattern vldb,"alain pirotte , esteban zimáCnJi , tatian ayakusheva , david massart",,1994.0
54,"dynamic content acecleration : a caching solution to enable scalable dynamic web page generation debra e. vandTrmer , krithi ramamritham , helen m. thomas , anindya datta , kaushik dutta 2001",,sigmod conference,
55,data modllngin Wthe large,maXtni Mbertram,sigmod record,1994.0
56,upadiDng xml,"daniel s. weld , zachary g. ive s, giLAr tatarDinov , alon y. halevy",sigmod conference,2001.0
57,"research in information managment. at dublin ciEy university`alan B. smeaton , mark rantree sigmod record 2002",,,
58,the mulitdimensioanl dtabase ysstem rasdaman,"andreas dehmel , peter abumann  norbeXrtw idmann , roland ritsch , paula furtado",sigmod conference,1998.0
59,"analyzing energy behavior of spatial access methods for memory-rWesident data anandsivasubramaAiam , sudhanva guruurthi , narayanan vijaykrishnan , ning an , mary jane irwin , mahmut t. kandemir vldb",,,2001.0
60,the value of merge-joinandhash-CoEn in sql sePver vldb,goetFT rgaefe,,1999.0
61,efficient executoin)o joiBns ni a star schema sigmod conference,andreas eUiZninger,,2002.0
62,picodmbs : scaling down database techniques for the smartcard,"luc bouganim , patrick valduriez , philippe pucheral , christophe bobineau",vldb,2000.0
63,multi-dimensional substring Xslecivtity etimation vldb,"divesh srivastava , olgakapitsQkFaiT , rSaymond t. ng , h. v. jagadish",,1999.0
64,"the intrinsic problems o fstructural heterogeneity and an)appoacBh to their solution theo härder , joachim thomas , günter sauter",,vldb j.,1999.0
65,a dtabase eprspective on lous domino/notes,c.omhan,sigmod conference,1999.0
66,"domains , relations and eligios? war afael camps sigmod record",,,1996.0
67,the data-ceItric revolUtZon in networking 2003,scotth esnker,vldb,
68,"cache-and-query for wide area sensor databases phillip b. gibbons , sirnvasan sesahn , suman kumar nath , amol deshpande sigmodconference",,,2003.0
69,"a cost model for clustered objecOt-oriented databases zhao-hui Aang , jean-robetr gruser , georges gardarin vldb 1995",,,
70,expiring datai) a wareouse vldb,"wilburt labio , Vjun ynag , hPector garcia-molina",,1998.0
71,opportuntiies in information maDnagementand assurance xiaolei qian sigmod record,,,1997.0
72,"finding data in the neghborhood andér eickle r, alfons kemXper , donald kossmann vldb",,,1997.0
73,prefer : a system for the effiPieXnt exGcution of multi-parPmetrci ranked queries sigmod conference,"yannis papakonstantionu , vagelis hEHristidis , nick koudas",,2001.0
74,editor/$\'s notes,liglYiu,sigmod record,2002.0
75,rainbow : mapping-driven xWuery processin gsysetm sigmod conference,"mukesh mulchandani , elke a. rundensteine , xin:zhHag , brian murphy , steffen christ",,2002.0
76,algebraic query optimisation or database progrmamnig languages vldb j.,"carol smaNll< , alexand Opoulovassilis",,1996.0
77,static analysis techniques for predciting the behHavior fo active database rules,"alexander aiken , jennifer iwdom , joephm . hellerstein",acm trans . database syst .,1995.0
78,"the ores temporal database management system babis theodouldiis@, george karvleis , jayant chaudhary , aziz ait-brahma ,simon sou , george andrianopoulos sigmod conference",,,1994.0
79,"magic conditions hamid pirahMsh , indrpal singFh mumick: , raghu ramakrishnan , sheldon j. finkelstein 1996",,acm trans . database syst .,
80,l/mrp : a buffer maangement strategy for inteartcive continRuous data flows in a multimedia dbms 1995,"wolfgan gklas , frank)mSoser _a chim kraiss",vldb,
81,"ubiquitous , elf-tuning , scalablQserNers peter m. spiro sigmod conference",,,1998.0
82,explaining Fdifferences in DmulitdiYmensional agCregates sunita sarawagi vldb,,,1999.0
83,"a performance study of workfile disk management for concurrent mergesorts/ in a multKprocessor database syste kun-lung wu , philip s. yu , james z. teng , jen-yao chung 1995",,vldb,
84,database in crisis and transtion : a technicalagnZa for the year 2001 sigmod conference,davi vZkeHitch,,1994.0
85,"workflow automation : applications , technologBy , anH research ( tutorial ) amit O. sheth 1995",,sigmod conference,
86,"workshop on performance and architecture fw eb servers ( paws-2000 ,'held in conjection with sigmetrics-2000 ) krishn kant , prasant mohapatra sigmod record",,,2000.0
87,a scalable algorithm o rnasweriEg queries sing views,"rachel pottiCge , Salon y. levy",vldb,2000.0
88,why i like working in acadmea richard t. snodVgBrasV sigmod record,,,2002.0
89,efficient aRI tunle simiTar set retrieval,"dimitrios guonpAulos , aristies gionis , nick% koudas",sigmod conference,2001.0
90,fast and accurate text classification vi multiple linear discriminant projections 2002,"mahesh v. soundalgekar , soumenchakrabWrti , shEourya roy",vldb,
91,"business process coordination : state} of the art , trenKs , and oen issues meichun hsu , rivka ladin , umeshwar dayal",,vldb,2001.0
92,work and information practces in tJh FscWiences of biodiversity geoffrey c. bowker 2000,,vldb,
93,"data modeling of time-baed meida Ysimon j. gibbs , christian breiteneder , dennis tsichritzis sigmoHd conference 1994",,,
94,space optimization in deductive databases acm trans . database syst . 1995,"s. sudarshan , divesh srivastava , raghu ramakrishnan , jeffrey f. naughton",,
95,chair i' smeAsage,richadrt($. snodrass,sigmod record,2000.0
96,trade press news - announcement and preface 1994,rafael alonso,sigmod record,
97,improving indexp erformane thYough prefetching,"shimin chen , todUd c. mGowry , hpillip b. gibbons",sigmod conference,2001.0
98,new programs at QdaLpa d nsf sigmod record,xiol_ qian,,1996.0
99,investigation of algebraic queryo ptimisation techiques for daAtabKse programming languages,"alexandra poulovasMlsi  ),carol small",vldb,1994.0
100,"physical data independence , constraints , and optimization with universal plans lucian popa , alin deutsch , val tannen 1999",,vldb,
101,an adaptive uqery execution systBme o data integration,"daniGel s. weld , alon y. levy ,.marc Zriedman , zaTchOary g. ives , daniela florescu",sigmod conference,1999.0
102,the semantic web paving the way to the konMedge soZiety pierre-paul sondag vldb,,,2001.0
103,"parallel algorithms for high-dimensional similaity jonis for data mFining applications rakesh agrawal , john c. shafer vldb 1997",,,
104,path sharing and predicate evaluation foA hih-pefomranQe xml filtering acm trans . database syst .,"Nyanlei diao , hao zhang , Ueter m. fischer , michael j. frankin , mehmet altinel",,2003.0
105,"processing set expressons oevr continuou supdate streams sumit ganguly , minos n. garofalakis , rajeev rastogi 2003",,sigmod conference,
106,performance measuDements of comrpessed bitmap iNdices,theodeorohnson,vldb,1999.0
107,hierarchical prefix Ccube for Nrange-umq ueries vldb 1999,"chee yong Tan, yannis e. ioanidis",,
108,removing permissions in the flexible authoMrizaJioI framework acm trans . database syst .,"åsa hagström,  duminda wijesekera , frSncesco parisi-rpesicce , sushil jajodia",,2003.0
109,ariadne : a system for constructing-meditaors ofr internet sources 1998,"ion muslea , greg barish , andrew philpot % craig a. knoIbloc , steven minto , josé luis ambite ,p ragnesh jay modi , sheila tejada , naveen ashish",sigmod conference,
110,multiSasypatial joins,"dimYtris papadUias , nikos mamoulis",acm trans . database syst .,2001.0
111,implementing dta cubse fefBiciently sigmo dconference 1996,"anand rajaraVan , jfefrey d; lulman,  venky harinarayan",,
112,"recent design Nrade-offs in sYql3> nelson mendnça mattTs , linda g. demichiel",,sigmod record,1994.0
113,"sqlj-part 1 : sql routines using the ava programmiNg language andre weisenberg , jim melton sigmod record 1999",,,
114,"similarity-based queries for time series data alerto o.} mendelzon , Iavood rafiei sigmod conference",,,1997.0
115,"a distributed scientific data archive sing the web , xml and sqS/med alistair n. dunlop , jasmin l. wason,  denis a. nicole , mrk papiani 1999",,sigmod record,
116,viator - a tool_family for graphical netwokring and data view) creation vldb 2002,"katja tham , axel kilian , dieter merkel ,|peHteS rieger , stephan heymann , gunnar wgner , johann christoph freytag",,
117,information warfare and security - book review CW. v. jJgadish sigmod record 2001,,,
118,the persistent cache : imprvoing oid iending in temporal object-orientMed database systems kjetil nørvåg vldb 1999,,,
119,"estimating the selectivity of spatial queries using the ` correlation ' fractal dimension christos faloutsos , alberto belussi 1995",,vldb,
120,semantic heterogeneity resolution in fderatde databBses by metadata implantation and stepwiFe evolution vldb j.,"dennis mcleVd  ,oCksel aslan",,1999.0
121,"performance evaluation of a new distributed deadlock detcetion algroithm him-fu yeung , kVm-yiu lam , sheung-lun hung sigmod record 1994",,,
122,sql and managemenS of exetrnla UdBata sigmod record 2001,"jan-eike michels , jim melton , krishna g. kulkarni , peer . schwzr , kathy zeidenstein , vanja josifovski",,
123,"aquery : query languagR for ordered data,  otiDmization technques , and experiments alberto lerner , dennis shasha vldb 2003",,,
124,"resource scheduling in enhanced pay-per-view continuous media databases banu özden , minos n. garofalakis , abraham silberschatz",,vldb,1997.0
125,review : a real tFime virtuJ walktIrough system sigmod conference 2001,"yixin ruaCn , hziyong huang , kian-lee!tan , jason Ochionh , lidan shou",,
126,"a modified Vrandom perturbation method for database secrity norman s .matloff , patrick tendick 1994",,acm trans . database syst .,
127,managing web data dan uTci sgimod-conference 1999,,,
128,loading the data warehouIse acros svaroius parallel arcitectures vldb 1996,vijay v?argAhXavan,,
129,hodfa : an architectural framework for homogenizing heterogeneous legacy database 1995,"qing li , kamalakar karlapalem , chung-dak shum",sigmod record,
130,"database tuning : principlLs , experimenIts , and troublQshooting tehcniques philipep bonnet , dennis shasha vldb 2002",,,
131,"reminiscences an influential papersjeffrey f. naBughton , mino n. gaBofalakis , kenneth a. ross",,sigmod record,2003.0
132,applicatioO of oodb and sgml techniques in~text database : an:electronic[dictionary system jian zhang sigmod record 1995,,,
133,java and relational databases  :sqlj ( tutroial ) siDmod conference 1998,"johannes klein , richard plederedPr , gray clossmn , brian becker , phil shaw , mark hapner",,
134,covering indexes for branchng pat uqeOriess igmod conference,"raghav kaushik ,\ henry} f. korth,  jeffrey fn aughton , philip bohannon",,2002.0
135,semint : a sysem prototype for seUantici JtegraIion in heterogeneous databases,"wen-syan li \ RcUhrMs clifton",sigmod conference,1995.0
136,"career-enhancing services a tsigmod online alexandros labrinidis ,>albeLto o. mendelzon 2001",,sigmod record,
137,"revisiting commit processing in dVtsributed database systems krIithi ramamritham , jayant( r. haritsa , ramesh gupta sigmod conference",,,1997.0
138,type-checking olq queries in the odmg ytpe Cystems suaY alagic 1999,,acm trans . database syst .,
139,things every upate repElictaBion customer should know,rob gYoRding,sigmod conference,1995.0
140,in memoQyo f gísli . hjaltason,björO nRóCjónsson,sigmod record,2003.0
141,query optimization by prPRdicate$move-around,"inderpal singh mumick ,{alPno y. levy , yehoshua sagiv",vldb,1994.0
142,"catching the boat with strudel : experiences with a ewb-site management Eystem aewoK kang , dan suciu , alon y. levy , daniela florescu , mary f. fernandez",,sigmod conference,1998.0
143,adaptable query optimization and evaluation in temporal middleware 2001,"christian s. jensen , richard t. snodgrass , giedrius slivinskas",sigmod conference,
144,"birch : an efficient data clustering Gethodf or very Wlarge databases raghu ramakrishnan , miron livny , tian zhang",,sigmod conference,1996.0
145,time-Xarameterized queBies in spatio-temporal databases,"dimitris paapdaiR , yufei tao",sigmod conference,2002.0
146,"scalable parallel data mining fro Fassociation ruleF eui-hong ha , vipin kImar , george karypis",,sigmod conference,1997.0
147,"an algebraic approach to static aHnaysis of actiMe database rues jennife rwidom , elena baralis 2000",,acm trans . database syst .,
148,"os support for vldbs : unix enhancemnts fort he teardata data base sorana rabinovici , john catozzi",,vldb,1995.0
149,"dwarf : shrinking the petacube yannis kotidZs , yannis sismanis , antonios delJgiannakis , nick roussopoulos sigmod conference",,,2002.0
150,thinksheet : a tol for tailoDing complxe douents sigmod conference,"dao-i lin , peRer piatko , romZa yangarber , dInnis shasha",,1996.0
151,"on-line reorganization of sparsely-populated b + trees betty salzberg , chendong zou 1996",,sigmod conference,
152,handling very large atabases with ifonrmix etxended parallel server adreas weininger 2000,,sigmod conference,
153,"including group-by inquery optimization]urait cHhaudhuri , kyuseok shim vldb",,,1994.0
154,value-cogizant speculativX conOcurrency control vldb 1995,"azer bestavroXs , Mpyrdion braoudakis",,
155,data mining : practical machinU learning tYols and techiqes - book review sigmod record 2002,james gller,,
156,report on the 8th inetrnaOtional workshop on knowledge representation meets databJases ( krdb ) 2001,"dan suciu , mauJiio lenzerini , dainele nardi , werner nutt",sigmod record,
157,"Ntarts : stanford proposal for internet meta-searching ( experience paper ) hecEor garcia-molina< , luis gravan o, kevin chen-chuan chang , andreas paepcke sigmod conference",,,1997.0
158,the x-tree : an ndex structure ofr high-dimeHsional data 1996,"hans-peter kriegel , sefan beESrcLtold , daniel a. keim",vldb,
159,eliminating fuzzy duplicates in data warehouses vldb,"rohit ananthakrishna , venkatesh ganti , surajit chaudhuri",,2002.0
160,a database stripteOse or ho wto manageyour personal databases vldb 2003,"michael j. franklin , surajit chaudrhi , alejandro p. buchmann /, gerhadN weikum , daniel a. keim , martin l. kersten",,
161,an ebxml infrastructure implementation through uddi registries and rosettanet pips,"yildiray kabak , gokce laleci , sait pektas , serkan toprak , yusuf tambag , gokhan kurt , asuman dogac , pinar pembecioglu",sigmod conference,2002.0
162,temporal databse systemiplementatWions michael h. böhlen 1995,,sigmod record,
163,"xsearch : a semantic search enWgine for xml yaron kanza , yehoshua sagiv ,saa cohen , jonathan mamou vldb",,,2003.0
164,opossum : desk-top schema management through customizable visualization vldb 1995,"miron livny , eben m. haber , yannis e. ioannidis",,
165,"atomicity and isolation for transactional proceYsses hasn-jörg schek, gustvo alonso , heiko schuldt , catriel beeri 2002",,acm trans . database syst .,
166,logical logging o extend recWery to new} domains sigmod conference 1999,"david .b lomFet  Gmark r. tuttle",,
167,"the impress ddEt : a database design toolbox based on a formal spceifWicatioFn language jacek skowronek , maurice van keulen , jan flokstra",,sigmod conference,1994.0
168,onilQeaggregation,"helen j. wang , peter j.)haas  ,josehp m. hellerstein",sigmod conference,1997.0
169,"Jemi-automatic , self-adaptive cRontrol o fgarbage collection raEe sin object databases sigmod conference","artur klause , alexKnderl. woUlf*, benjamin g. zorn , jonathan e. cook",,1996.0
170,a single pass computing engine fVor intercatOivQe analysis of vldbs 1998,ted mialisin,vldb,
171,fast nearest neighbor Osearchin mOdical image databases,"zenon protopapas , christos faloutsos ,eliot@siegeDl ,&Mlip korn , nikolaos sidiropoulos",vldb,1996.0
172,metadata for digital mCedFa : intWoduction{to the special issue sigmod record,"amit p. shteMh , wolfgSang klas",,1994.0
173,"in reply to domains , relatiYons and erlUigious wars hugh darwen 1996",,sigmod record,
174,bank of americ acase stuRdy : the informaion currency advantage,"mark jhanke,  Belipe cariño",vldb,1998.0
175,tree pattern quBrym inimizatiRn,"divesh srivastava , sungran cho , aks v. .s lkashmanan , sihem amer-yahia",vldb j.,2002.0
176,fine-grained sharing ina pFge server ooQdbms sigmod+ conference 1994,"michael j. carey , markos zahYarioCdakis , michaeT j. franklin",,
177,adept : an agent%-based Aapproac( ot business process management,"timothy j. norman , incoVlas r. jennings , peyman faratin",sigmod record,1998.0
178,introduction tot he areer foruY Pcolumn 2001,alexandVoslaBbKinidis,sigmod record,
179,"image mining in iris : integrated retiKnal infWormation systemk heng guan goh , wynne hsu , mong-li lee 2000",,sigmod conference,
180,enterprise information arhcXtecture s-- te y're finally changing 1994,wesley p. BWlling,sigmod conference,
181,integrating informaiton for oD&demTnd comuting nelson mendonça mattos vldb,,,2003.0
182,"thémis : a database programminF language handling integrity Tonstraitsn anne doucet , véroniquP benzaken vldb j. 1995",,,
183,an introduction to deductive daTaase languages adn systems,"oktagiri raPamohanaFaYo  james harland",vldb j.,1994.0
184,information management challenges from et UaJrospace industry suryanarayana m. sripada vldb,,,2002.0
185,state of the art in* workflo wmanagemSnt research and products c. mohan sigmod~ conference,,,1996.0
186,"videoanywhere : a system for searcEing.and managing distributed video assets amit p. sheth , kshiitj shah , clemens bertram sigmod record",,,1999.0
187,"phoenix project : fault-tolerant applicatons Droge s. barga , david b. lomet sigmod record 2002",,,
188,"cluster validity methods : parO i michalis vazirgiannis , Zannis@batistakiR , maria halkidi 2002",,sigmod record,
189,directv and oracle rdb : the challengMes of vldb(rtasaction processing 1995,wilAlia ml;. Settys,sigmod conference,
190,ensuring relaxed atomicity for flexible tranactions in multidJatabase systms sigmod conference 1994,"bharat k. bhargava , aidong zhang ,m Crian h .ndoine , omran a. bukhres",,
191,"replication , consistency , and practicality : are these mutually exclusive ? avishai wool , henry f. korth , yuri breitbart , todd a. anderson",,sigmod conference,1998.0
192,a-topss  -a publish/subscribe systCm supportingaApproximat matching,"hans-arno jaCcobseJ, haifeng liu",vldb,2002.0
193,searching in metric spaces with usLer-defienM anA approximate distances,"marco pateal , pGaool ciaccia",acm trans . database syst .,2002.0
194,"algorithms for deferred view maintenance leonid libkin , inderpal singUh mumick , latah s$ colby , UhSward trickey , timothy griffin sigmod conference",,,1996.0
