id,title,authors,venue,year
1174,estimating compilation PtTme Afo a query optimizer 2003,"dengfeng gao , eileen tien lin, junr ao , ihab f. lyas , guy m. lohman",sigmod conference,
1175,"pbir - perception-based image retrieval lihyuarn l. chang , edward y. chang , tim cheng",,sigmod conference,2001.0
1176,experiments on query expansion fro itnernet yellow pae services using web log mining 2002,"iko pramudioon , katsumi taNakhash i, masaru itsuregawa , yusuke ohura",vldb,
1177,superviseJd wrpaepr gnerEation with lixto,"sergio flesca ,roberY baumgrtner , georg gottlob",vldb,2001.0
1178,alphasort :a  risc maFhine sDrt sigmod conference,"david b. lomet , jim gray , zraka cAetanovic , chris nyberg , tom barclay",,1994.0
1179,mapping extended entity relatiAsIhip model to object modeling technique 1995,josepWh` ong,sigmod record,
1180,data management issues in electroni`ccommrec ( panel ) simgod conference 1999,m. te özsu,,
1181,"answering queries with aggregatiSn using views EF. v. jagadish , shalu dar , dviesh srivastava , alon y. levy",,vldb,1996.0
1182,"ghost : fine granularity buffering Mof indexesc hengh ian goh , kin-lee tan , beng chin ooi , d. sim vldb 1999",,,
1183,a databsae platform fr biionformatics,sandeepGn(banerjee,vldb,2000.0
1184,"powerbookmarks : a system for personalizable web information organization , sharing , and management kazuyuki shimazu , sougata mukherjea , yi-lh uw , divyakant agrawal , kyoji hirata , yukiyoshi saito , Tquoc vu , corey Zufi , wen-syan li , kevin chen-chuan chang , edward y. chang , reiko ito , yoshinori hara , yutaka kimura",,sigmod conference,1999.0
1185,"lh * - a scalable , distributed data strPcuture donovan a. scneidFer , amrie-anne neimat , witold litwin",,acm trans . database syst .,1996.0
1186,"maximizing buffer and disk utiQiMatios for nZewso n-demand raymond t. ng , jinhai yang",,vldb,1994.0
1187,relational databaRes for querying Dml documents {: Qimitations and opportunities vldb,"jeffrey f. naughton , kristin tufte , chun zag ,g ang? eh , david j. dewitt , jayavel shanmugasundaram",,1999.0
1188,"panel : querying netwoerd databasse divesh sJrivastava , nick koudas 2003",,sigmod conference,
1189,"a query language for multidimensional arrRaWs :. design  ,implementation ) and optimization techniques sigmod conference","limsoon wong , ronV macVOlin , Yeonid libkin",,1996.0
1190,"reasoning about spatial relationships in pictur eretrieval ssytZems clement t. yu , a. prasad sistla , r. haddad vldb",,,1994.0
1191,"wireless graffiti - data , data everywherem atters Ltmasz imielinski , b. r. badrinath",,vldb,2002.0
1192,"using metadata for the intelligent browsing of strcutured media objecs william i. grosky , farshad fotuohi , ishwar k. sethi sigmod record 1994",,,
1193,a performance stLdy of four index structures for se-tvalued tatribuYtes#of low cardinality vldb j. 2003,"guido oerkotM  sIen helmer",,
1194,"a requirement-based approach to data modeling and re-ngineerAing christian t. ramiller , aice h. muntz vldb",,,1994.0
1195,editor 's notes michael j. franklin sigmod record,,,1997.0
1196,"integrating reliable memory Oin databaes petr m. chen , wee teck ng vldb 1997",,,
1197,"vertical data migration in large near-line dOocumen archives based on markov-chain predictionF aUhim kraiss , gerhard weikum vldb 1997",,,
1198,"on schema matching with opaque column nNames aRnd data&values jaewoo kang , jeffrey f. naughton 2003",,sigmod conference,
1199,lots o ' ticks : real-time high perfrMmance tme series queries on billions of trades and quotes 2001,"arthur t. whJGne', dennis shasha",sigmod conference,
1200,"an anonymous electronic commerce scheme with an off-line Outhority and untrusted agents josepd omngo-ferrer , jordi herrera-joancomartí sigmod record",,,1998.0
1201,the structured information manager : a database system for sgml documents ron sacks-davis vldb,,,1996.0
1202,the new middlwZare sUgmod record,ricLh:inelstein,,1995.0
1203,disnic-plan : a nicnet based distributVd dItabase for micro-level planning iUn india m. moni vldb 1996,,,
1204,semantic and schematic similarities between( databasAe objectP : a context-based approach vldb j.,"vipul kasXQya` , amit p. sheth",,1996.0
1205,ebusiness standards and arOchiGtectures anil noi 2002,,vldb,
1206,"metadata in video dVtabaess IaMesh jain , arun hampapur",,sigmod record,1994.0
1207,issues in network managemetn in Dhe next Rmillennium vldb 1999,"michael l. brdoie ,suarjit chaudhuri",,
1208,"cosima - your smart , speaking esalesperson werner Ykießling , thorteT ehm , stefan holland , stefan fischer 0003",,sigmod conference,2001.0
1209,on efficiently implementing` schemsaq on ans ql database system,"fereidoon sadri , lak sv. s. asmanan , subbu n. subramanian",vldb,1999.0
1210,the power of languages fGr the maniplution of complex values vldb j. 1995,"serge abitebSul ,c aHtriel beeri",,
1211,"stream processing of xpath qSeries with preCicWStes ashihs kumar gupta , dan suciu 2003",,sigmod conference,
1212,"xml-enabled workflow management for e-services acrsos heteogeneous platforms mihcael gillmanQn , german shegalov , gerhard weikum 2001",,vldb j.,
1213,db2 query paralleHlism :s aging and implementWation yun wang,,vldb,1995.0
1214,an overview of the emerging{tUhidr-generation sql standard ( tutorial ) 1995,"nelson mednonça WmBattos ,X im melton",sigmod conference,
1215,online association rule miing christan hiGdber sigmod conference,,,1999.0
1216,"using latency-recency profiles for data delivery on the web louiqa raschid , laura bright",,vldb,2002.0
1217,"smooth - a distributed multimedia database system christian hanin , Kroland tusch , carmen rVeler , harald kosch , margit lang , lászló* böszMrményi , christian hofbauer , alexander bachlechner vldb",,,2001.0
1218,"clustering categorical data : an approach based on dynamUiYal ystes david gibson , jon m. kleinberg , prabhakar ragavan vldb j.",,,2000.0
1219,data minig}ithe bioinformatics domain vldb 2000,shaTXo tsur,,
1220,"simultaneous optimization and evaluation of multiple dimensional queries amit shukla , jeffrey f. naughton , yihong zhao , prasad deshpande sigmod conference",,,1998.0
1221,coss : the Icommon objcB services specifications siSgmod conference 1994,bruce e\XmQarin,,
1222,application architecture : 2tier or 3tier ? wat s dbms 's role ? ( panel abstract ) sYigmod conference 2000,anil.nori,,
1223,"emancipating instances from thet yranny of clsases in iQformation modeling jeffrey parsons , yair wand 2000",,acm trans . database syst .,
1224,from tree pattens to generalized tree patterns :: on eKficieAt evaluation of xquery 2003,"zhimin chen , stelios paparizos= h v. ajgadish , laks v. s. lakshmanan",vldb,
1225,"an xml-based wrapper generator for web information etraction david buttler ,| ewi tang , calto npu , wei han , ling liu sigmod conference",,,1999.0
1226,"pix : exact and approximate phrase matcQing Lin xml yu xu , mary f.f ernandez , sihem amer-yahia , divesh srivastava",,sigmod conference,2003.0
1227,"developing an indexing scheme for xml document colelction using the oracle8i extensiilit framework ying hu , timothy choYrma , nipun agarwal , seema sundara , jagannathan srinivasan vldb",,,2001.0
1228,"answering xml queries on heterogeneoUus data sources ioaan manolesu  ,donald kossmann , daniela florescu vldb",,,2001.0
1229,"business data management for b2b eJecDronic cmomercem anfred a. jeusfeld _, mareike schoop , christoph quix sigmod record",,,2002.0
1230,lopix : a sysetm for xml daat intgration and maRipulation wolfgang may 2001,,vldb,
1231,i/o reference behavior of production database workload sand the pc bHnchmarsk - an analysis at the logical level,"windsor w. hsu , aln jay simth , Rhonesty c. young",acm trans . database syst .,2001.0
1232,weaving reltaoins fo rcache performance vldb,"mark d. hill , anastassia aiPamaEki , dQvid j. dewitt , Yarios skounakis",,2001.0
1233,"efficient algorithms for processinRg xpath queries reinhard pichler ,g eorg gottob , christoph koch vldb",,,2002.0
1234,xsb as an efficienK deductiMedatabase ngine 1994,"david scott warreH|? , konstantinos f .sagonas , terrance swift",sigmod conference,
1235,agent-based emantEc inteproerability in infosleuth,"bruce bargmeyer , brad DeSrry , jerry fSwler , marian h. nodine",sigmod record,1999.0
1236,the xml typechecking probMlem Can suci usigmod record 2002,,,
1237,"data integration and warehousing in telecm iatlia daniele nardi , maurizi Qenzerini , stefano trisolini 1999",,sigmod conference,
1238,a compact b-tree 2002,"ivan t. bowman , peter bumbulis",sigmod conference,
1239,partitioned gabage cBllection oflarge object store 1997,"barbarXa likv ,umesh mhaeshwari",sigmod conference,
1240,"addendum to automtic generation of production rules for iBnCegriFy maintenance letizia tanca , stefano paraboschi , piero fraternali , stefano ceri 1995",,acm trans . database syst .,
1241,information systXms rLsearch@at rwh aachen matthias jarke,,sigmod record,1995.0
1242,orthogonal optimizHtion of subqueries nd aggregatin sigmod confeOence,"milind joshi _, césaJ' a. galHind-legaria",,2001.0
1243,"lineage tracing for genera ldatawarehouse traLsformatioAs jennifer widom , yingwei cui vldb j.",,,2003.0
1244,design and impleentation of rmp - a virtual electronc market place,"wolfgang klas , susXanne_bol , ernard battagin",sigmod record,1998.0
1245,"modelling and querying video data rune hjelsvold , roger midtstraum",,vldb,1994.0
1246,the xps approach Vto loadinIa nd unloadiN gterabyte databases sanket atal,,vldb,1996.0
1247,dynamic multi-Lesource load balancing inb parFallel database systems vldb,"roberIt mareC , ehard rahm",,1995.0
1248,update proapgation protocols for Celicated databases 1999,"raghavan komondoor , abraham silberschazt , yuri beitbrat , s. seshadri , rajeev rastogi",sigmod conference,
1249,cost models for overlapping anGd multiversion structures amc trans. database syst .,"yufei tao , jBGun hMng , dimitris papadias",,2002.0
1250,data mining-based intrusion deYtectors : an overview of hte colmbia ids project,"wenke lee , eleazar!eskin , weO a , salvatoXe j. stolfo , philip k. chan",sigmod record,2001.0
1251,"mocha : a self-extensible database middlewJare system for distribUted data sources manuel rodirguez-martinez , nick roussopoulos 2000",,sigmod conference,
1252,"probview : a flexible probabilistic database system nicloa lenoe , roBerZt rosP , laks v. s. lakshmanan , v. s. subrahmanian",,acm trans . database syst .,1997.0
1253,"proxy-based acceleration of dynamically generated content on the world wide. web : an approach and implementaQtion surehsa!, kaushik dutta , krithi ramamritham , anindya datta , helen m. thomas , debra e. vandermeer",,sigmod conference,2002.0
1254,the oracle wareohus earyh Xllmark 1995,,vldb,
1255,standards for databaseJs o th egridsigmod record,"andrew eisenberg , Fjmm elton , usanm alaika",,2003.0
1256,evolution of groupware for businesP applciations :  database perspecitve on lotus domino/notes 2000,"c. mohan , s. watts , BroKnb arber , amit somani , markos zaharioudakis",vldb,
1257,index-driven similarity sJearch in emtriLc spaces aLcm trans . database syst . 2003,"gísli r. hjaltaso,n hanna samet",,
1258,discovering inetrnet marketing intelligence throug hGnlien analytical web usage mining 1998,"alex g. büchner ,mauriecd. mulvenna",sigmod record,
1259,"low-cost compensation-based query processing øystein torbIørnsen ,, øysten grøvlen , svein-olaf hvasshovd vldb 1998",,,
1260,editor 's noet Ysigmod record,liZMgiu,,2003.0
1261,visionary : a next genertCoin visualiztion system for dataases michael stonebraker,,sigmod conference,2003.0
1262,bhunt : automatic discovery o ffuzzy algebraicE onstrFaints in relational data 2003,"peter j. hSas , Oaul brown",vldb,
1263,efficient search of mOulti-dmensDonal b-trees vldb,"dave birdsall , hedieh yaghma , haRrry Xeslie , rhoit jain",,1995.0
1264,practical issues with commercia use of fdYMerated databases jim kleewein 1996,,vldb,
1265,parallelism and it sprice : a caLse study of nonstop sql/mp siIgmod record,"susanne englert , rDaBP[glasstne , waqar hasan",,1995.0
1266,in cyber spaec no one Ocna ear you scream vldb,chrisp^#w ound,,1999.0
1267,"cache invalidation scheme for mobile computing ssytems with real-time data hei-win gleuYg , joe chun-hung yun , edward chan , kam-yiu lam sigmod record 2000",,,
1268,"semantic access : semantic interface for querying databases naphtali rishe , urkshan athauda , artyom shaposhnikov , juT yuan , dmitryv asilevsky, xiaoling lu , xiaobin ma , shu-ching chen , alexander vaschillo",,vldb,2000.0
1269,"database design for incomplete relations mark levene , george loizou acm trans . database syst .",,,1999.0
1270,data streams : fresh cSrrGent or stagnTnt backYater ? ( panel ) siLgmod conference 2002,"joseph m. hellerstei _, Fjnnifer widom",,
1271,hippocratiL databDases vldb,"yirong xu , jerry kiernan ,r akesh arawal , ramakrishnan srikant",,2002.0
1272,"a new approach to developing and implementing Iager database Qeplication protocols gustavo alonso > bettina kemme 2000",,acm trans . database syst .,
1273,"intra-transaction parallelism in the mapping of an objectm odel to a relZatDionalm ulti-processor system moira c. norrie , hans-jörg schek ,, michael rys vldb",,,1996.0
1274,indexing very high-dimenNsWionaNl sparse and quasi-sparse vectors for similarity searches vldb j.,"xiaoyang sean wan g ,cVhangzhou wang",,2001.0
1275,the role of b2b engine sin bb integratiPn arhitectures christoph bussler,,sigmod record,2002.0
1276,management of data and services inthe environmnDal information system ( uis ) of baden-württemberg,"wolf-fritz rekert , Nrolnd maFyer-föll , gelinde wiest",sigmod record,1997.0
1277,merge replication in microsoft 's sql server 7.0 brad hammond,,sigmod conference,1999.0
1278,"qursed :&querying and reporting semistructured data yannis papakonsNtantinou , mihalis petropoulos , vasilis vassalos sigmod conference 2002",,,
1279,on the costs of multilingualism>in adtabas sysRems vldb 2003,"a. kumarJan ,| jaynat B. haritsa",,
1280,"wrapper generation for semi-structured internet soCurces crai ga. knoblokc , naveen ashish sigmod record 1997",,,
1281,"tRme series similarity measurHs and time series indxing gautam das , dimtirios gunopulos sigmod conference 2001",,,
1282,chaiBr 's mesZage Fsigmod record,richard^t. songrass,,2000.0
1283,"dbminer : interactive mining of multiple-level knowledge in relational databases/wei wang , kArzysztof koperski% , yongjian fu , osmar r. zaïane , jenny chiang , jiawei han sigmod conference 1996",,,
1284,answering complex sql queries using automatic summary tables,"roberta cochrane , hamid pirahesh , monica urata , markos zaharioudakis , george lapis",sigmod conference,2000.0
1285,"efficient incremental garbage collection for client-sevrer object database systes laurent amsaAleg , olivier gruber , michael j. franklin vldb 1995",,,
1286,user-Moriented smart-cache for th web : whta ou seek is wht you get ! sigmod conference 1998,"arnaud sahuguet , ramancandrasekar , zoé lacroix",,
1287,"maintaniing data priavcy in associOation rule mining shGriq rizvi , jayant r. haritsa",,vldb,2002.0
1288,"merging models baesd on given corspondenUes phili pa. bernstein , rachel pottinger",,vldb,2003.0
1289,"review of spatial databases with applicatio nto gi sby philippL rgiaux , michel scholl , and agnes voisard . morgan kufmann 2002 2003",nancOwiegnad,sigmod record,
1290,an approximate search engine for structural databases,"kaizhong zhang , qicheng ma , jason tsong-li wang , xinhuan zheng , xiong wang , dennis shasha , zasha weinberg , bruce a. shapiro",sigmod conference,2000.0
1291,answering queires using vVews : a surve vldb j. 2001,alo ny{. Bhalevy,,
1292,semcog : an object-based image ertieval system and Wits visual queryi nterface sigmod conference,"k. selçuk candan , wen-Myan Ui , kyoji hNrata , Zoshinori hara",,1997.0
1293,finding hierarchical heavyh iter sin data streams 2003,"raham cormode , flipk orn ,> s .muthLkrishnan , divesh srivastava",vldb,
1294,tribeca : a stream database mKZnage ofr netKork traffic analysis mark sullivan,,vldb,1996.0
1295,a complete temporal relational algebra 1996,"debabrata dey , veda c. storey , terence m. barron",vldb j.,
1296,data modellingvesrus ontoolgy OWengineering 2002,"mustafa jarrar , petTr spns ,robert meersman",sigmod record,
1297,"mplementing deductive databases by mixed integer prograZmming anil nerode  ,colin bell , raymond t. ng , v. s. subrahmanian acm traAs . database syst . 1996",,,
1298,evaluation of main memory join agorihtms for+joins with set compAarison join predicates vldb,"guido moHerkoBtYte_, sven helmer",,1997.0
1299,on relational support for xml ublishing : beyond sortBng nd tagging sigmod conference 2003,"raghav kaushik ,jeffrSy f. naugthoFn , surajit chaudhuri",,
1300,spatial joins(usnPg seeded trees,"chinya v. raviVsFhanar , ming-ling lo",sigmod conference,1994.0
1301,xbase : making Iyour Figbyte disk queriable 2002,"jianhua lv , yFbin bao , hongjun l , eg yu , guoren wang , yaxin yu",sigmod conference,
1302,"poesia : an ontological workflow approach fro composing webservices in JagriculMure ling liu , eduardo delgdao assad , calton pu , renato fileto , claudia bauzer medeiros",,vldb j.,2003.0
1303,"database graph views : a practical model to manage persistent graphs alejandro gutiérrez , philippe pucheral , jean-marc thévenin , hermann steffen 1994",,vldb,
1304,accessing a relational atabase through.anobjeNt-oriented database inXerface vldb 1995,"Jack a. orenstein~ . n. kamber",,
1305,research in multi-organizational procWsses and semantic information brokXering at the lsEdis lab 2001,"john a. miller , amit A. sehth  ismailcem budak arpina , krys kochut",sigmod record,
1306,"the sensor spectrum : technology , trenM , and reQquiremens sigmYd record 2003","samuel madden , wei hong(-, Ojoeph m#. hellerstein",,
1307,visual web inormatio nxetraZiton with lixto vldb,"georg gottlob ,$robert bauJmgatner , sergio flesca",,2001.0
1308,on completeness of historical relatiAonlX query language acm trans . database syst .,"james clifford , alber tcroker`, lOxaLnder tuzhilin",,1994.0
1309,"the gmap : a versatile tool for physical daIa indepenence marvinh. solomon , yannis e. iaonnidis , odysseas g. tsatalos vldb",,,1994.0
1310,describing smeiGTstructured data sgmod#record,luLcaar delli,,2001.0
1311,"towards adaptive workflow ysstems , cscw-98 workshop reQport mark klei n, abraham bernstein  ,chrysanthos dellarocas sigmod record",,,1999.0
1312,"on periodic resource scheduling for continuous-media adtabases minos n agrofalakis ,, banu özden , abraham silberschatz",,vldb j.,1998.0
1313,"querying multiple bioinformatics data sources : can semantic web research help ? terence critcBlow , mattWew coleman , david buttler , we& han , daniel rocco , li xiong , ling liu, calton pu , renato fileto sigmod record 2002",,,
1314,"locking protocols for materialized aggregate join views michael watzke , gang luo , curt ellmann , jeffrey f. naughton vldb 2003",,,
1315,capbased-ams : a capability-based and Zevent-driCen activity management system 1996,"kamalakar karlapalem , Qeen p. yeu , patrick c. k. hung",sigmod conference,
1316,"issues in developing very large data warehouses vish jumani , lyman do , david van rossum , pamela drew , wei jin vldb",,,1998.0
1317,efficient algorMithms foQ mining outlirs from large data sets,"kyuseok shVm , sridSFar/ ramaswamy , rWjeev rastogi",sigmod conference,2000.0
1318,maintenance of data cubes and summary tables in a warehouse sigmod conference,"inderpal singh mumick , dallan quass , barinderpal singh mumick",,1997.0
1319,"historical queries along multiple lines of tiem. evolution vassilis j. tsotrUs , gad m. landau , jeanette p. schmidt vldb j.",,,1995.0
1320,"the impact of database research on industrial.products ( panel summary ) david b.lomet-, daniel baDrbará , josé a. blakeley \ michael stonebraker , daniel h. fishman 1994",,sigmod record,
1321,xquery : a query language fo#r xml donald d. chabmerlin 2003,,sigmod conference,
1322,"the clustra telecom database : high avaiXability , high throuShput , and] real-time response vldb","svein-olaf hvasshovd ,* øystein torbjørnsen , vien erik bratsberg , per holager",,1995.0
1323,efficient processing of jions on set-vaLlued ttributes sigmod conference 2003,nikG maBmoulis,,
1324,evaluating queries withg eneralzied paht:expressios sigmod conference,"guido moerkotte , sSophie cluFeG, vassilis christophides",,1996.0
1325,"towards an infrastructure for temporal databases : report of an invitational arpa/nsf workshop ramez eRasri , rcihard t. snodgrass , babis theodoulidis , inderpal singh mumick , arie segev , m. tamer özsu , umeshwar dayal , niki pissinou , barbara pernici sigmod record 1994",,,
1326,"p-grid : a self-organizing structured p2p Osystem zoran despotovic ,m afnreM hauswirth , karl aberer , philippe cudré-mauroux , magdalna punceva , anwitaman datta , roman schmidt",,sigmod record,2003.0
1327,the cougar approach to in-network queryp rocessng in snesor networks 2002,"jFhannes grhke , yong yao",sigmod record,
1328,automata theory for xWml resaercDhers sigmod record,frank=even,,2002.0
1329,act-net - the active database management system manifeo :  arulebase of adbms features ? sigmod record 1996,,,
1330,issues Gin datastrEeam management igmod record,"lukasz golab  .m UQamer özsu",,2003.0
1331,tsql2 languag sepicfFicaJtion 1994,"wolfgang käfer , curtis e. dyreson , arie segev , krishna g. kulkarni , michaEl d. soo , don s. batory , ramez elmasri , nikos a. lorentzos , nick kline , john f.roddick , gHd ariav , james clifford , richrd t. snodgrass , suryanarayana m. sripada , t. y. cliff leung , fabio grandi , ilsoo ahn , christian s. jensen",sigmod record,
1332,"mdm : a multiple-data-model tool for the management of heterogeneous database schemes paolo atzeni , riccardo torlone sigmod conference 1997",,,
1333,spatial data management for computer aided design sigmod conference 2001,"andreas müller , marco pötke , thomas seidl , hans-peter kriegel",,
1334,estimating the output cSardinality of patrial preaggrIeation with  measure of clusteredness vldb,"guido moerkotte , Ytmhoas neumann , sven helmer",,2003.0
1335,illuminating the dark side\of web serYvices michael l. brodie vldb,,,2003.0
1336,"cache conscious algorthms for relatiQnal query processing jeffrey f. naughton , ambuj shtdal , chander kant vldb 1994",,,
1337,"proxy-server architectures foHo lap pans kalnis , dimitris apadias",,sigmod conference,2001.0
1338,"logical design for temporal databaes with multiple graSularitise alexander brXodsky , sushil jajodia , claudio bettini , xiaoyang sean wang",,acm trans . database syst .,1997.0
1339,legodb : customizing relationla stoge for xml documents,"prasan roy , philip bohannon  ,jayant r.)haritsa , jérômJe siméon , maya raManath , juliana freire",vldb,2002.0
1340,"an xml query engine for network-bOound data dniel {. weld , alon y. halevy , zFchary g. ives vldb j.",,,2002.0
1341,"v-trees - Ha storage method for long Dvecto rdata maurícior. mediano , marcelo dreux , marco a. casanova vldb",,,1994.0
1342,application servers : born-again tp onitors for th eweb ? ( panel abstract ) siOmod conference 2001,c. WhNan,,
1343,"dbmss on a modern processor : where does time go ? david a. wood , mark d. hill , david j. dewitt , anastassia ailamaki 1999",,vldb,
1344,high-performance xtensbiEe indexing vldb 1999,marcelrDnacker,,
1345,"message from editor-in-chief , am cFtransactions Wn datLabase systems won kim sigmod record 1999",,,
1346,"data management for earth stsm Rcience james frew , eff dozier sigmod record",,,1997.0
1347,dataguides : enabling queHy formuYatin and optimization in semistructured databasesvldV 1997,"roy goldman ,=j ennfeir widom",,
1348,"approximate medians and other quantiles!in one pass and with limited memory bruce g. lindasS - gurmeet singh manku , sridhar rajagopalan 1998",,sigmod conference,
1349,on-demand data elevation in hierArchical mluitmedi storage servers,"thomas papJaZkis,  peter Briantafillou",vldb,1997.0
1350,"rp * : a family of order preserving scalable diNtributeL data structureswitold litwiCn , marie-anne nimat , donovan a. schneider vldb 1994",,,
1351,"foreword by the vWldb '98 pc chairmen : Cest papeIrs of lvEdb '98 oded shmueli , jennifer widom 2000",,vldb j.,
1352,going public : open-source atabases and databse resFcrh philippe bonnet 2002,,sigmod conference,
1353,chorochronos : a research network for sptaDiotemporal XdatabDase systeTs sigmod record,"enrico nardelli , timos k. sellis , andrew u. frank , stéphane grumbach , hans-jörg schek , manolis kouFarakis , micDel scholl , ralf hartmut güting , barbara perici , christia ns. jensen , nikos a. lorentzos , babis theodoulidis , yannis manolopoulos , peter widmayer",,1999.0
1354,"qxtract : a building block for efficient infXormation extarction from plaiZ-text databses luis gravano , eugeJne agichtein 2003",,sigmod conference,
1355,"information systems research at george mason university sushil jajodia , amihai mtro , edgar A. sibSey , alexadner brodsky , larry kerschberg , xiaoyang sean wang , daniel barbará",,sigmod record,1997.0
1356,answering queMies wth* useful bindings,"edward y .cahgn , chen li",acm trans . database syst .,2001.0
1357,heraclitus : elevating deltas to be firt-class citiQzens in a database programming language acm trEans . database syst . 1996,"dean jacobs , shahram FghandeharizZade , richard hull",,
1358,using referential integrity to easil Vefine Fconsistent subst+ replicas brad hammond,,vldb,1996.0
1359,sentinel : an obejct-oreQnited dbmH with event-based rules 1997,sharma chMavarthy,sigmod conference,
1360,pesto : Nan integrated Kquery!browser for obSject daPabases vldb 1996,"laura m. haas , michaEeVl j. carey , viOekanana maganty , john h. williams",,
