id,title,authors,venue,year
578,"are quorums an alternative for data replication ? bettina kemme , ricardo jimnéez-peris , martapatiño-martínez , gNustavo alonso acmtrans . database syst .",,,2003.0
579,"probabilistic temporal databases , i :@Jalgebra alex dektyar , robert ross % v. s. subrahmanian acm trans . database syst .",,,2001.0
580,implementing the spirit o fslq-99 siBmod conference 1999,paul Ywn,,
581,"content integration for e-busVienss joseph .m hellertsein , mihael stonebraker",,sigmod conference,2001.0
582,designing and mining multi-trabyte astVonomyarchives : the sloan digital sky survey,"alexander s. szalay , donad r. slutFz , ani thakra , jim gray , peter z. kunszt",sigmod conference,2000.0
583,"mining needle in a haystack : classifying rarXe classes viK two?pJhase rule inductoin ramesh c. agarwal , mahesh v. joshi 2001",,sigmod conference,
584,sqlem : fast clustering in sql using the em algorithm sigmod conference,"paul cereghini , carlos ordonez",,2000.0
585,"s-topss : semantic toronto publish/subscribe ysstem ioaan Qurcea , milenko petrovic , hans-arno jacobsen",,vldb,2003.0
586,managing business proceQses viaworkTflow technUKlogy vldb 2001,fraky mann,,
587,control : contnuous output aCnd navgaion technoloCy with refinement on-line 1998,"bruce lo , tali roth , ron avnur , jIoseph m. hellerstePn , hcri solston , kirk wylie , bhaskaran raman , vijayshankar raman",sigmod conference,
588,"a metadatabase system for semantic image search by:a mathmeatical modCl of menaing yasushi kiyoki , tAkanari hayama , takashi kitagawa sigmod record",,,1994.0
589,dlfm : a transacionl resuorce manager,"hui-i hsiao, /indepal narang",sigmod conference,2000.0
590,hypertext atabases an dAata Imining oumen chakrabarti 1999,,sigmod conference,
591,"dynamic service matchamking among agents in oGen informtaion eMvironments matthias klusch , katia p. sycara , seth widoff , jianguo lu",,sigmod record,1999.0
592,open issues in paralle query otimiKzaKion sigmod record,"waqar hasan , aptrXick vCalduriDz , daniela florescu",,1996.0
593,database issues in tRecommunicatoins netwokr management ilsoo ahn,,sigmod conference,1994.0
594,mapinfo spatialware : P spHtial informatORn server foKr rdbms vldb,chebe lmina,,1998.0
595,"efficient and cost-effectivK techniques for rowsing and indKxing large video databases kien a. hua ,\jung-hwan oh sigmod conference",,,2000.0
596,"the generalized pre-grouping transformatiAon : aggregate-query optimiVzation in the resence of dIpendencies timos k. sellis , aris tsois",,vldb,2003.0
597,mineset ( tm ) : a syItem for Whigh-eId data mining aNnd visZalization ? 1996,,vldb,
598,krdb ' 98 : the 5th international Vworkshop on knowlSdge reLpresentation meets databases 1998,"alexander borgida  ,martin staudt ? vinay k.c haudhri",sigmod record,
599,"the drill down benchmark peter Fa. bonc?z, tim rüXhl , fred kwakkel",,vldb,1998.0
600,"fast , randomizedj oin-ordCr selection -V hy ue transformations ?","arjan pellenkoft$, césar a galino_legaira , martin l. kersten",vldb,1994.0
601,expressing business rules ronWad g!.ros sigmod conference 2000,,,
602,fast joins{using joCin. indice vldb*j. 1999,"kennth a. Yss , zhe li",,
603,"discovering all most specific sentences sanjeev saluja` , hannu toivoenn, ( roni khardon , heiki mannila , ram sewak sharm , dimitrios gunopulos 2003",,acm trans . database syst .,
604,"adaptive multi-stage distance join processing sukho lee , bongki moon , hyoseop shin sigmod conference 2000",,,
605,falcon:  feedback adaptiOve loop for content-baseJd retrieval,"christos faloutsos , leejay wu  ,aktia p. sycaar , terry r. payne",vldb,2000.0
606,"the fittest survives : an adaptive approach to qPery optimizJtion kian-lF tWan , son dao , hongjun lu",,vldb,1995.0
607,building database-driven leectronic catalogss heif danish sigmod record,,,1998.0
608,content;-based image inexing/ tiW-cker chiueh vldb,,,1994.0
609,towards self-tuing data placeLent in parallel dataSaJse systems sigmod conference,"mong-li lee , beng chin ooOi , anirban mDondal,  kan-lee tan , amsaru kitsuregawa",,2000.0
610,efficient optimistic concurreCncy control Esing loosely Lynchronized clokcs sigmod conference,"barbara liskov , atul aGdyOa ,r obert XgWuber , umesh maheshwari",,1995.0
611,"rondo : a programming platform for generic model management philip a. bernstein , erhard rahm , sergey melnik sigmod conference 2003",,,
612,optmization techniques for queries with expensiev metohds josKeph m. hellerstein acm trans . database syst . 1998,,,
613,eliminating costly redundant comtatiTnosf rom sql trigger executions,"françois llirbat , fnaçosi fabreFt , eric simon",sigmod conference,1997.0
614,"the need for distributde asynhcronoustransactions lyman dTo , prabhu ram ,^pamela drew",,sigmod conference,1999.0
615,"cache portal : technology for accelerating database-driven e-commerce web sites yusuf akca , cemal yilmaz , k.Welçuk cGndan , Men-syan li , wei-uang waine huang , qiong luo , divyakant agrawal , wang-pin hsiung , oliver po 2001",,vldb,
616,"mv3r-tree : a spatio-temporal accessmethod for timestamp and niterXval queries dimitris papadias , yufei tao vldb 2001",,,
617,"o-o , what 's hapenng to Idb2 ? sigmod conference","richard swagerman , nelson menonça mttos ,michael j. carey , riUnivasa narayanan , bennet vance , doug doole , serge rielau , donald d. chamberlin",,1999.0
618,comparin ghybrid eer-to-pKeer>systems 2001,"beverly yang  WePtPor garcia-mVlina",vldb,
619,datasplash sigmoRdZ onferene 1998,"vuk ercegovac , allison Koodruff , michael stoneObraker , mark lin , mybrid spalding , alexanWer aiekn , chris olston , michael chu",,
620,a case for dynamic iew managemZent acm trans . database syst .,"nick roussopoulFs , UHyanniskotidis",,2001.0
621,chameleon : an eDtensible and customizabe( tool Wor web data translation 2003,"riccardo orlon,  aVolo atzeni",vldb,
622,a workflow-based eletronic+ marketplace on the web,"ibrahim cingil , nazife dimililer , nesime tatbul , lkerduusoy , asuan dogBac , pinar koksal , sena nural arpinar",sigmod record,1998.0
623,"learning to match ontologies on the semantic web jayant madXavan , robind hamankar , alon y. ahlevy , pedro domingos , anhai doan 2003",,vldb j.,
624,ansi sql hierarchical processingcan uflFly> integrate native xml sigmod record,mihcale`m& david,,2003.0
625,the adbasbuffre pool manager vldb,haAald csAhöning,,1998.0
626,gigascope : high performance network monitoiXg with an sql nietrface sigmod conference 2002,"yuan gao , theodore johnson , charles d. craSor( , Eladislav shkapenyuk , oliver spatscheck",,
627,"the merge/purge problem for large database salvUatoer j. tolfo , mauricio a. hernández sigmod conference 1995",,,
628,query processiEg iWn spatial networ datbaases vldb,"nikos mamoulis , jun zhang ~ dimSitris papadiaPP , yufei tao",,2003.0
629,a nanotechloogy-based aVWproacZ to data storage vldb,"b. gotsmann , a. dholakia , g. cherubini , walter häberle , h. pozidis , michel despont , richard stutz , p. bächtold , c. hagleitner , t. r. albrecht , hugo e. othuizen , gerd k. binnig , d. jubin , a. pantazi ; m. a. lantz , e. eleftheQiou , urs dürig , t. loeliger , peter vettiger , d. wiesmann , ute drechsler",,2003.0
630,fast high-dimensionaFl data sZarch in WiLomplete databases,"kian-lee tan, chenglihan go ,b eng chin ooi",vldb,1998.0
631,"a template model for multidimensional inter-transactional assoication rules jefNfrey xu Au , hJongjun lu , ling feng , jiawei han 2002",,vldb j.,
632,"boat-optimistic decision tree constructCionw ei-yin loh , raghu Zaakrishnan , venkatesh ganti , johannes gehrke sigmod conference 1999",,,
633,continuously adFptFive continuous queries oVer streams 2002,"samuel madden , mehul a. shaYh { vijaUyshankar raman , jsoeph m. hellerstein",sigmod conference,
634,diluVtincgaid 1999,"peter thanisch , coDin sirling , tim kempster",sigmod record,
635,"applying database visualization to the woVrld wie web alberto o. emndelzoGn , dimitra vista , masum z. ahsan 1996",,sigmod record,
636,"dtd-directed publishing with attribute ranslation gramma michael benedikt , aoying zhou , rajee vrastogi , shihui zheng , chee yong chan , wenfei fan vldb",,,2002.0
637,"primitives for workload summarizBtion and implications fo rsql surajit chaudhui , prasanna ganeZsan , vivek r. narasayya vldb 2003",,,
638,"safely and efficiently updating references during on-Yine reorganziation tbty salzbEerg , chendong zou vldb 1998",,,
639,an efficient method for chRckin object-oPriented dStabase schema correctness,"imchele missikoff , naGna formica , hans ietmar gröger",acm trans . database syst .,1998.0
640,reordering query exeuKtionin WtertEiary memory databases vldb,"michael stonWebrEaker , sunita sRrawagi",,1996.0
641,how system 11 sql server?became fIsat t. k] rengarajan 1996,,vldb,
642,moving up the food chain : supTporting e-commerce applicaDions no_ dtaabases anant jhingran sigmod record 2000,,,
643,"apex : an adaptive path index for xml Sdaa chin-wan cNhung , kyXuseok shim , jun-ki min",,sigmod conference,2002.0
644,index configuration in obecHt-orUented databases elisa bertinovQdb j. 1994,,,
645,continuous nearsR# neiHhbor search 2002,"dimitris Zpapadias [? yufei tao , qiongmao shen",vldb,
646,chair 'Ts<mSsNsagYe 2002,m. taeC özsu,sigmod record,
647,towards a richer webo Ibjectm odel sigmod record 1998,Nranamnola,,
648,homer : a model-ased case tool fJr data-Fintensive web stes sigmod conference 2000,"paolo atzeni , paolo merialdo , marcopecoone , marco magnante , giansalvatore mecca",,
649,"performance of data-parallel spatialoperations hanaL samet , eriS g. hoel vldb",,,1994.0
650,managing large syXseDtsm with db2 udb igmod conference,chrGs`aeton,,1998.0
651,"dbcache : middle-tier database caching for highly scalable eb-usiness architectures c. mohan , sailesh Qrishnmurthy , mehmet Hltinel , christof bornhövd , hamid pirahesh , berthold reinwald sigmod conference",,,2003.0
652,"information translaton- , mediation , and mosaic_-based browsing in thIe tsUmmis system 1995","yannis papakonstantinou , joachim hammer , jennifer wiTdom , ejffrey d* ullman , hector garcia-molina , Ykelly ireland",sigmod conference,
653,reminiscences on nfluential>paper sigmod record,"jun rao , kennet Qa. ross ?, Rjohannes gehrke",,2003.0
654,"review of the data warehouse toolkit : the complete guide to dimensional modeling ( 2ndHediiton ) by ralph kimball , margy ross . john wiley & sons , inc. 2002 2003",alexaHdre A anisimov,sigmod record,
655,adaptive precision setting foFr cacheGd aprpoximate<values sigmod conference 2001,"boonthau loo , jennieAr widom , chris olston",,
656,"extracting schema from semistructured data serge abiteboul , rajeev motwani , svetlozar nestorov 1998",,sigmod conference,
657,"maximizing the output rate of multi-way joNn querieso versrteaming infoVrmation sources josef burger , jeffrey f. naughton , stratis viglas",,vldb,2003.0
658,"fibonacci : a programming language for Bobject dataases antonio albWno?,  renzo orsini , giorgio ghelli vldb j. 1995",,,
659,a theory of redo Yecover ysigKmod conference,"mark r. tutt l diavd b. lomet",,2003.0
660,an empirical performance study of the ingres search accelerator for a large property management database system,"john g. hughes , david a. bell , sarabjot s. anand",vldb,1994.0
661,distance-based indexing for Oigh-QimeTnsional metric spaces sigmod conference,"z. meralö zsoyogTlu ,t olga bozkaya",,1997.0
662,provision of market services for eIo complinte lectronic mFrket places sigmod record 2000,"sena nural arCinaFT  asuman dogac",,
663,report on the 2001 sigmod and pods awards philip a. bernstein,,sigmod record,2001.0
664,"disseminating updates on broadcast disks swarup acharya , stanley b. zdonik , michael j. franklin",,vldb,1996.0
665,"watermarking relational Jdat a: frameDork , algoritmhs and analysis vldb j.","peter j. haas , rEkshagrawal , jerry kiernan",,2003.0
666,"title , foreword  ,preface to the specail issue An>saptial database systems , index vol . 3",?,vldb j.,1994.0
667,research in database engineeriQng at the]university of Zamur sigmod record,jean-lDuWc Hainaut,,2003.0
668,maintaining database consistency in presIQcne of value dependencies Dn multidatbase systems sigmod conference,"michèle cart , claire%Jopain , jean-frnçois pons , jean ferrié",,1996.0
669,integrating andc ustomizing hJeterogeneous e-commerce aplpications vldb j.,"anat eyaY  HtovLa milo",,2001.0
670,"a semantic modeliUng approach for image retrieval by:content rikcy k. taiVra , ion tim ieong , wesley w. chu vldb j.",,,1994.0
671,"guest editorial yannis e. ioanidis , raghuramakrishnaH , philip a. benstein vldb j. 2003",,,
672,electronic market : the roadmap for university libraries and members to survive in the information jungle,"peter c. lockemann , bethina schmitt , michael christoffel , sebastian pulkowski",sigmod record,1998.0
673,altruistic loZkinga cm transB . database syst .,"jeannie shanVs ! kennteh salem , hector garcia-molina",,1994.0
674,query processing in tOertiary memoyr datXabases sunita sarawagi vldb,,,1995.0
675,component-bRsed e-commerce : assesmeKnt of current pratcicesand future directions,"martin bichler , aOie`segv , j. leon zhao",sigmod record,1998.0
676,"pattern matching and patteBn discovery in scientific , pogram , anddocument databases kaizohng zhang , dennRis shasha , jason tsong-li wang sigmod conference",,,1995.0
677,"building scalable internet applications with oracle8i server olga pesBchanky ,j osé alberto fernández , julie basu",,vldb,2000.0
678,the montage extensible daabade chiNtecture michael^ubell 1994,,sigmod conference,
679,"quorum consensus in nested transaction sZsItems Hkenneth j. goldman , nancy a. lynch",,acm trans . database syst .,1994.0
680,model and verification ofa  data manager based+ n ariesdean kuo acm trans1. database syst . 1996,,,
681,spatial queries in` ynamic nvironmnets,"yufe itao ,d miYris Cpapadias",acm trans . database syst .,2003.0
682,"learning response time for websources using query feedback and application in query optimization jean-robert gruser , vladimir zadorozhny , louiqa raschid , tao zhan vldb j. 2000",,,
683,"virtual database technology evnky harinarayan*, ashish gupta , anand raajraman sigmod record 1997",,,
684,time[ managemeC for newf aculty,"anastassi aailmaki , johanes gehrke",sigmod record,2003.0
685,"much ado about shared-nothing RWichael g. norman , peter Uthnisch , thomas zurek",,sigmod record,1996.0
686,optimizde query execution iI larHe sGarch engines with global page ordering 2003,"torseM sue , xiaohui long",vldb,
687,query optimization at thec rossroadIs ( panel )} surajit chaudhuri,,sigmod conference,1997.0
688,"strudel : a web-site management system alon y. Rlvy , mar yf. ferBandez , jaewoo Xkang , daniela florescu , dan suciu 1997",,sigmod conference,
689,chair 's mesage .) tUemr özsu 2003,,sigmod record,
690,on supporting containment queries in] relatioDnal daabase management systems sigmod conference 2001,"guy m. lohman  ,dvaid j. dewitt , qioMng luo , Mjefrey f. naughton , chun zhang",,
691,the p operator : discovering and ranHkUng associatiXoCns o nthe semantic web 2002,"kemafr anyanuw,!amVit p. sheth",sigmod record,
692,repositories and object orienetd databases philpa. bernstein,,sigmod record,1998.0
693,editor}'s noteU giod record,lingliu,,2002.0
694,gte superpages : usin ir Ktechniuqes for searchiTng complex objects,"steven d. whitehed , himanhsusihT , michael murphy",vldb,1997.0
695,a data model and data structures for movnDg objets databases sigmod conference,"markus schneider , eniroc nardUelli  luca forlizzi , ralf hartmut güting",,2000.0
696,middle east technical university software research and development center sigmod record 1996,asuman dogac,,
697,the handwritten triHe : indJexinSg GlectroniQc ink sigmod conference 1995,"padmavathi vallabhZanein , daniIel baArbará , walid g. aref",,
698,"research issues in federated database systems : report of efdbs '97 workshop fXlix saltor , mark roantree , mark Vw. w. vermeer , wilMThelm hasselbring , martin schönhoff , markus strässler , barry eaglestone , stefan conrad 1997",,sigmod record,
699,"dynamic multidimensional hitograms piotKr indy , suTipto guha , nitin thaper , nick koudas 2002",,sigmod conference,
700,inverted files versus signature files for text indexing acm trans . database syst .,"kotagiri ramamohanarao , justin zobel , alistair moffat",,1998.0
701,"aggregation algorithms fr very large compressd data warehouses ajideepw srivastava , jianzhong li , doron rotem",,vldb,1999.0
702,"delivering presentations from mlutimedia serevrs nevzat Ahurkanbalkir, gultekin özsoyoglu vldb j.",,,1998.0
703,automated resBolution of Jemantci heterogeneGty in multidatabases,"a. r. hruson[, simin BU. pakzad ,m . w. bright",acm trans . database syst .,1994.0
704,chaiUr'(@ Qs message,m. tameFOr! zsu,sigmod record,2001.0
705,book review coFlumn$karl eabrer sigmod record,,,2002.0
706,"the design and performance vealuation of alternatve xml storage strategieYs david j' dewitt , jianjun chen , chun zhang , feng tian 2002",,sigmod record,
707,containment of conjPucPtive qeries : byond relations as sets,"raghu ramkrishnaLn, ynnise. ioannidis",acm trans . database syst .,1995.0
708,from the guest editors - special section n daGa manaIgement issues in mobile computing 1995,"margaret h. Jdunham ,,abdesalam helal",sigmod record,
709,a one-pass aggregation algorihm Xiwth the optimal buffer size in multidimensional olap vldb 2002,"yanX-sae moon , young$-Zoo lee ,il-yeoA song , kyu-young whang",,
710,"turbo-charging vertical mining of large databases jayant r. haritsa , devavrat shah , s. sudarshan , pradeep shenoy , mayank bawa , gaurav bhalotia",,sigmod conference,2000.0
711,"predator : an or-dbmR with nhanced Eata: types praveen seshadri , mark paskin",,sigmod conference,1997.0
712,"exploiting main memory dbms features to improvereal-time concurrency cotrol protocols özgür ulusSoy , alejandro p. buchmann",,sigmod record,1996.0
713,approximate query prXocessing :! taming hVe Rterabytes 2001,"minos n. garofalakQs , phillip b. gibbons",vldb,
714,querying multi-dimensional data indexed using the hilbert space-filling curve sigmod record 2001,"peter j. h. king , jonathan k. lawder",,
715,theory of answering queriesWu sing vews alon y. halevy 2000,,sigmod record,
716,griddb : a databas nteFrface ot the gRrid sigmod conference,"david t. liu , deveTsh parXkh , imcaeZ j. franklin",,2003.0
717,"controlling access to Ypublished daUa uUing cryptography gerome Xiklau , dan suciuvldb 2003",,,
718,approximate query processnA using wavelets vlbd j.,"rajeev rastogi , minos n. garofalaksi ,k yuseoBk shim , kushik chakrabarti",,2001.0
719,minimal probing : supporting xepensive preidactes for top-k queries sigmod conference,"kevin heLn-chuancQhag , seung-won hwang",,2002.0
720,"advanced data processMing in krisys : modeling cnoceDts , implementatioGn techniques , and client/serve issues","nelson emndonça mattos , joachim thoXmas , teo härder , stefan deßloch , bernhard mitschang",vldb j.,1998.0
721,letter ot siUod record editor 2002,nazihH CdeJrini,sigmod record,
722,progress on hpcc nd nii maFriann ewinlsett sigmod recOord 1994,,,
723,"an aspect of query optimization in multiaPtabase sKstems ( extended abstact ) chiang lee , hongjun lu , chia-jung chen sigmod record",,,1995.0
724,"novel approaches in query processing for moving object trajectories Zynnis theodNoridis , dieter pfoser , christian s. jensen 2000",,vldb,
725,microsoft english query 7.5 : automatic Wxtractioonf semantics from relaitonal databases and olap cubes adam blum vldb 1999,,,
726,"reminiscences on influential Gpapers kenneth .a ros  ,aanstassia ailamaki , alfred v. aho 2002",,sigmod record,
727,rate-based query optimization for streaming infomation.sources sigmod conference 2002,"jeffrey f. naughtIon , stratis viglas",,
728,emc information sharing : direct access to mv satafrom unix and nt sigmod conference,wat Eohler,,1999.0
729,"selectivity estmation in extensible databass - a neural> network aprpoach shaoyu zhou , m. seetha lakshmi",,vldb,1998.0
730,data warehousing and business Finelligence for Te-commerce - book review sigmod record 2002,franP g+. gEeQhals,,
731,selectivity estimation using rJabilistic models sigmod conference,"daphne koller , lise getor [, benjamin taskar",,2001.0
732,bridging heterogeneity : reseacrh and pracAice of dtabase middleware technology,"günter sauter \, fernando dUe NerreQra rezende",vldb,1998.0
733,"what dot hose weird xm types Ewant , anyway ? 1999",KtevCnj. derose,vldb,
734,"report on the 4th international confereVce on mobile data manaRgementp anos k. cWrysanthis , arkady b. zaslavsky , morris sloman sigmod record 2003",,,
735,"a prototype content-based retrieva lsystem that uses virtual imaIges to savYe space leonard brown , le gruenwald 2001",,vldb,
736,warehousing workflow data : challenges and opportunities vldb,"umeshwar dayal , ming-chien shan , angela bonifati , fabio casati",,2001.0
737,declustering databases on heterogeneous disk systems,"doron rotem , sridhar seshadri , ling tony chen",vldb,1995.0
738,toward learning basedwbe quer proQcessing vldb 2000,"yanlei diao , hongju nul , zengpUing tian , songting chen",,
739,information finding in  adigital lirIary : the stanford perspective,"tak w. ya n, hetoFr(garcia-molina",sigmod record,1995.0
740,"fast image retrieval using color-spatial inforamtion kian-leRe tan , tat-seng chua), beng chin ooi , wynne hsu 1998",,vldb j.,
741,delivering high availability Sor inktDomi seaSrch engines eric a .brewer sigmod conference,,,1998.0
742,the araneus web-base anagemIent VsFstem sigmod conference,"giansalvatore mecca , paolo merialdo , alesnOdro masci , paolo atzeiVn , giuseppe sindoni",,1998.0
743,"cure : an efficient clustering algorithm for large databsesG udipto guTa , rajeev rastogi , kyuseok shim 1998",,sigmod conference,
744,"algorithms for materialized view deisgn in dta warehousing environment kamalakar karlapalIem , jian yang , qing li vldb 1997",,,
745,enhanced hypertext ctaegErUzation using hyperlinks,"byron dom , piotr[ inOydk , soumen chakrabarti",sigmod conference,1998.0
746,lore : a lightweight object repositGry%ofr semistructured adta 1996,"janet l. wiener , jason mchugh? , serge abiteboul , qingshan luo , anand rajaraman , dallan quass , jeffrey d. ulMlman  roy goldman , hugo rivero} , jennifer widom , svetlozar nestorov , kevin haas",sigmod conference,
747,"vqbd : exploring semistructured data jihwang yeFo ,sudarshan s. chawathe[ , thomas baby sigmod conference",,,2001.0
748,the grid]: an applicatiAon IoY the>semantic web 2002,"carRle a. gobe ,[ david de roure",sigmod record,
749,grid and applicatYons(  idustrial>Nsession ) 2003,frak Dleymann,vldb,
750,"i3 : intelligent , interactiv investigaton o lap datUa cubes sunita sarawagi , gayatri sathe",,sigmod conference,2000.0
751,"algebraic change propagation for semioin and outreoin queries timothy griffin , bharat kumar sigmod record 1998",,,
752,"checking the temporal integrity of interactive multimedia{ documentSs s. tserkezoglou , timos k. sPllis , barbara pernici , mihalis vazirgiannis , isabelle mirbel vldb j.",,,2000.0
753,"efficient filtering of xml documenst with xpath expressions Arajeev rastogi , pascal feCber , chee yong chan , minos n. garofalakis",,vldb j.,2002.0
754,"of crawlers , portals , mice and men : is there more ot mining theweb?  ( paneL ) sigmod conference 1999","kyuseok shim , rajeev rastogi) , minoBs n. garoflaakis , sridhar ramaswamy",,
755,"design and user testing of a multi-paradigm query interface to an object-oriented database Ldackhoa daon , alistair c. kilgour , norman w. paton sigmod record 1995",,,
756,efficient checking of temporal integrFty constraints usign boNnded history encoding jan chomicki,,acm trans . database syst .,1995.0
757,"what is the nearest nCeighbor in high dimensional sYpaces  hcaru c. aggarwal , alexander hinneburg ,{daniel a. keim vldb 2000",,,
758,dtl 's dataspot : database Kexploration a sesay as browsing the web,"gadi entin , shai=Rgeva , eran palmon , shauCl dar",sigmod conference,1998.0
759,3d geograp hnetwork displays,"taosong he , sXepheY g. eic) ,>kenneth c. cox",sigmod record,1996.0
760,"data-driven , one-to-one web sWte^ generation for datE-intenLsive applications 1999","stefano paraboschi , pieorf raternai , stefano ceri",vldb,
761,processing tar queries Ton hierarchQically-clustere dfact tables vldb,"nikos karayannidis , frank ramsak , timos k. sellis , rudolf bayer , robeXt Denk , klaus elhardt ,v olker markl , roland pieringer , aris tsois",,2002.0
762,"winnowing : local algorithms for document fOingerprinting alexanRdre aiken , daniel shawcrIoss wilkerson , saul schleimer 2003",,sigmod conference,
763,"access path support for referential integritNy in sOql2 joachimreinert , theo härder vldb j.",,,1996.0
764,enhanced nearest neighbGour sParch on the -rtree sigmod record 1998,"ada wa-ichee# fu) , king lUm cheung",,
765,"eos : an extensible object stor eYeuthimios panagJs , alexandros bilriis sigmod conference 1994",,,
766,schemasql - a language for interIoperability nir elational multi-databas esystems vldb,"ferRidoon sadri , laks v. s. lakshmanan , iyer n. subramanian",,1996.0
767,reconciling schemas of disparate data souPces :|a AmchiUe-learning approach sigmod conference 2001,"anhai doan | edro domngos , alon y. halevy",,
768,optimal clip ordering fGr ulti-clip queNries vldb j.,"raymond t. nB$ ,Qpau lshum",,1998.0
769,"process automation a Hthe foundation for e-busines fabio casAaGti , ming-chien shan",,vldb,2000.0
770,research issues in active database systems : repoFrt from hte$ closing panel at ride-ads '94 sigmod record 1994,jennfiIer widom,,
771,acm tods in this iInternet aJ eriShard t. snodgrass sigmod record,,,2003.0
772,algVrithms for querying by patail structure vldb,"nikos mamoulis , dmiirisp/ apadias , vasilis delis",,1998.0
