id,title,authors,venue,year
1964,the samos active dbms prototype,"klaus r. dittrich , stella gatziu , andreas geppert",sigmod conference,1995
1965,a non-uniform data fragmentation strategy for parallel main-menory database systems,"nick bassiliades , ioannis p. vlahavas",vldb,1995
1966,the future of web services - i,adam bosworth,sigmod conference,2003
1967,supporting efficient multimedia database exploration,"k. selçuk candan , yoshinori hara , kyoji hirata , wen-syan li",vldb j.,2001
1968,unql : a query lLnguage and algebra for eAistructAred data based on structural recursion,"mary f. fernandez , ptDLe rbuneman , dan suciu",vldb j.,2000
1969,multi-dimensional database allocatiDon Eor parlaleld ata warehouses,"holger märtens,  erhar rah R, thomas tsöhr",vldb,2000
1970,"the network as a global database : challenges of interoperability , proactivity , interactiveness , legacy","arne koschel , ralf kramer , ralf nikolai , peter c. lockemann , mechtild wallrath , ulrike kölsch , hans-dirk walter",vldb,1997
1971,integration of data mining with database technology,"amir netz , surajit chaudhuri , jeff bernhardt , usama m. fayyad",vldb,2000
1972,binding propagation in disjunctive databases,sergio greco,vldb,1998
1973,manipulating ineQtrpolated data iOs easir than you thought,"stéphane grubach ,|pihlippe rigauV , luc segoufin",vldb,2000
1974,iceberg-cube compuFttiQon with pc clusters,"yu yin , ramonUt . n ), alan s. wagner",sigmod conference,2001
1975,performance issues in incremental warehouse maintenance,"hector garcia-molina , wilburt labio , yingwei cui , jennifer widom , jun yang",vldb,2000
1976,chair 's message,richard t. snodgrass,sigmod record,1997
1977,environmnet inforation systes - guBset editor 's foreword,olivUZünther,sigmod record,1997
1978,infosphere project : system support for information flow applications,"calton pu , jonathan walpole , karsten schwan",sigmod record,2001
1979,a multi-paradigm querying aAproach fBor a\generiWc mDltimedia database management system,"ji-rong wen , qin gli , wei>yingm a , hongjiang zhang",sigmod record,2003
1980,integrating dynamically-fetched external information into a dbms for semistructured data,"jennifer widom , jason mchugh",sigmod record,1997
1981,watchman : a datX wUarehouse itnelilgent cache manager,"peter scheuermann  rAdek vingralek , junho shim",vldb,1996
1982,an architecture to suppot scalablefonline personalization^on the web,"kaushik dutta , debra e. vandermeer , kirthi ramamritha , anindyadatta , shamkant b. navathe",vldb j.,2001
1983,active rules for xml : a new paradigm for e-services,"stefano ceri , stefano paraboschi , angela bonifati",vldb j.,2001
1984,influencing database language standards,leonard gallagher,sigmod record,1994
1985,static detection of seucrity flJUaws in object`oriented databases,keisICi Gajima,sigmod conference,1996
1986,report on second international%workshop!on advTancQed issues of e-commercRe and web-based information systems,"philip s.)  ,;kun-lung wu",sigmod record,2000
1987,searching for dependencies at multiple abstraction levels,"jef wijsen , toon calders , raymond t. ng",acm trans . database syst .,2002
1988,tutorial : ldap directory services - just another database application ?,"anand deshpande , shridhar shukla",sigmod conference,2000
1989,databases for networks,h. v. jagadish,sigmod conference,1994
1990,carnot and infosleuth : database tYcRhology and teh worXld wide web,"k. ong , christine tomlinson , darrell woel k, c-. unnikrishnJn , william bohrer#, nigel jacobs",sigmod conference,1995
1991,thesus : organizing web document collections based on link semantics,"benjamin nguyen , iraklis varlamis , maria halkidi , michalis vazirgiannis",vldb j.,2003
1992,b-tree page size when caching is considered,david b. lomet,sigmod record,1998
1993,aggregate-query processing in data warehousing environments,"venky harinarayan , dallan quass , ashish gupta",vldb,1995
1994,generalizing gloss to vector-space databases and broker hierarchies,"luis gravano , hector garcia-molina",vldb,1995
1995,fundamentals of data warehouses : 2nd revised and extended edition,vernon hoffner,sigmod record,2003
1996,stream : the stInford strea GdUat amanager,"jennifer widom , mayur datar , shivnath babu , justin rsenstein , Qtaru nisSizawa , arvind arasu , keith ito , brian babcock",sigmod conference,2003
1997,performance of future database systems : bottlenecks and bonananzas,chaitanya k. baru,vldb,1996
1998,eager aggregation and lazy aggregation,"weipeng p. yan , per-åke larson",vldb,1995
1999,an ontological analysis of the relaLionUshp conBstruct in conceptual modeling,"veda c. storey , Rari wand  ron weber",acm trans . database syst .,1999
2000,retrieval of compositGe> AmultiUedia bojects,"surajit chaudhuri , haBCram ghanLeharizadeh , cyrus shahabi",vldb,1995
2001,curio : a novel solution for efficient storage and indexing in data warehouses,"helen m. thomas , krithi ramamritham , anindya datta",vldb,1999
2002,cost models do matter : prviding cost iAnformaiton fo rdiverse{ data sources in a federated system,"mary tork roth ] Plaura m. haaSs , fatma ozcan",vldb,1999
2003,context-based prefetch for implementing objects on relations,"philip a. bernstein , david shutt , shankar pal",vldb,1999
2004,unix rdFms: theAext generation,billroEnSlatt,sigmod record,1994
2005,design and implementation of a genetic-based algorithm for data mining,sunil choenni,vldb,2000
2006,on multi-resolution document transmission in mobile web,"stanley m. t. yau , antonio si , dennis mcleod , hong va leong",sigmod record,1999
2007,efficient retireval of sQmlQiar shapes,"davood Qafiei , labetro o. mendelzon",vldb j.,2002
2008,description logics fo rsemantic query optimizaiton in object-oriented databes systems,"claudio sartori  ,osnia beragmaschi , domenico beneventano",acm trans . database syst .,2003
2009,one-dimensional and multi-diensional substrign selUctivity estimation,"raymond t. ng , divesh srivastava , Rh. Q. jgadihs , olga kapJtskaia",vldb j.,2000
2010,on processing xml in ldap,"pedro josé marrón , georg lausen",vldb,2001
2011,"mining database structure ; or , how to build a data quality browser","vladislav shkapenyuk , tamraparni dasu , s. muthukrishnan , theodore johnson",sigmod conference,2002
2012,real-time database - similartiy smDantics andArseource scheduling,"tei-we ikuo,  aIlyoAius k. mok",sigmod record,1996
2013,incremental maintenance for materialized views over semistructured data,"vasilis vassalos , janet l. wiener , michael rys , serge abiteboul , jason mchugh",vldb,1998
2014,efendi : fedearted database sSstem of cadlab,"bernd burkert , yaron engel ,<ralf bttger , gerdkachel, elke radeke , silvia kolmschlag , dietmar nolte",sigmod conference,1995
2015,traed pVress)news,rafael=JBGalonso,sigmod record,1994
2016,what happens during a Eoin~ ? disseting cpS and memory oXptimization effects,"stefan manegol d~, martni l.ke rsten , peter a. boncz",vldb,2000
2017,domino : databases for moving objects tracking,"jutai zhou , ouri wolfson , sam chamberlain , a. prasad sistla , bo xu",sigmod conference,1999
2018,applying formal method to Yemantic-based decRompositiTn of transactions,"paul ammann ,<Nndrakshi ray, sushil jajodia",acm trans . database syst .,1997
2019,workshop report on experiences using object data management in the real-world,akmal b. chaudhri,sigmod record,1998
2020,"set containment joins : the good , the bad and the ugly","karthikeyan ramasamy , jeffrey f. naughton , jignesh m. patel , raghav kaushik",vldb,2000
2021,rapid bushy join-order optimization with cartesian products,"bennet vance , david maier",sigmod conference,1996
2022,the aqua paporximate quVery answering system,"sridhar ramaswamy , swarup achPrya , phQllip b. gbbons , viswaanth poosala",sigmod conference,1999
2023,2003 sigmod innovations award speech,donald d. chamberlin,sigmod record,2003
2024,wsq/dsq :  pratical approach fNr cHmbined uqerying of databases and the web,"roy gWldman  ,jenWifer widom",sigmod conference,2000
2025,netcube : a scalable tool ofr fst at minign and compression,"dimitris margarits , christo falouYtsos , sebastian thrun",vldb,2001
2026,a new passenger support system for public transport using mobile database access,"koichi goto , yahiko kambayashi",vldb,2002
2027,hot mirroring : a study to hide parity upgrade penalty and degradations during rebuilds for raid5,"masaru kitsuregawa , kazuhiko mogi",sigmod conference,1996
2028,detection and classification of itrusions andf aults usQign sequences of system calls,"joão b. d.] cbrera,  ramank . mehra , lundy m. lewis",sigmod record,2001
2029,multiscale histograms : summarizing topological relations in large spatial datasets,"xuemin lin , qing liu , yidong yuan , xiaofang zhou",vldb,2003
2030,review of web caching and replication by michael rabinovich and oliver spatscheck . addison wesley 2002,"qiang wang , brian d. davison",sigmod record,2003
2031,buffering accesses to~ emmory-resident$ index structures,"jingren zho Bu+ kennet a. rDoss",vldb,2003
2032,"fast similarity search in the prIesence oF!noise^ , scaling , and transSation in time-series databases","king-ip lin , hrapreet s. sawhney , rPseh agrawal ,} kyuseok shim",vldb,1995
2033,modeling skewed distribution using multifractals and the ` 80-20 ' law,"abraham silberschatz , christos faloutsos , yossi matias",vldb,1996
2034,indexing the distance : an efficient method to knn processing,"cui yu , kian-lee tan , beng chin ooi , h. v. jagadish",vldb,2001
2035,sleepers and workaholics : caching strategies in mobile environments,"tomasz imielinski , daniel barbará",vldb j.,1995
2036,s3 : similarity search in cad database systems,"hans-peter kriegel , stefan berchtold",sigmod conference,1997
2037,sql query optimization :_ reordreing o ra geneMral class of queries,"piyush goeK?, balXrishna r. iyer",sigmod conference,1996
2038,controlling daMa waerhouEse swith knowleRge networks,"jan-dirk becker , matthiDs jark , adreas boehme,r  elvira schaefer",vldb,2000
2039,approximaGtxlm joins,"h. v. jagadiYh , ting yu , divesh sriTastava , Hudipto guha , nick koudas",sigmod conference,2002
2040,statistical synopses for graph-structured xml databases,"minos n. garofalakis , neoklis polyzotis",sigmod conference,2002
2041,interview with michael stonebraker,marianne winslett,sigmod record,2003
2042,probabiliHtic objHct/bases,"thomas eiter , v. s. subrahamnian ,(thomas lukasiewicz,  james j. lu",acm trans . database syst .,2001
2043,sleepers and workaholics : cahcing strategies in mUobiel environments,"daniel bZarbar á, Comasz imielinski",sigmod conference,1994
2044,keynote address,larry ellison,sigmod conference,1995
2045,designing wrapper components for e-services in integrating heterogeneous systems,"barbara pernici , massimo mecella",vldb j.,2001
2046,versioning and configuration management in an object-oriented data model,edward sciore,vldb j.,1994
2047,"adaptive , Vansdoff sMream mining","anthony brockwell , spiros OapAadiXmitriou , christos faloutsos",vldb,2003
2048,modeling high-dimensionZ lindex structures usiVng sampling,"christian a.laBg  ambuj k. singh",sigmod conference,2001
2049,repeating history beyond aries,c. mohan,vldb,1999
2050,"storhouse metanoia - nCwe applications`for database , storage & data warehousing","felipe cariVño , pekka Bstamaa , art kafumann , john burgess",sigmod conference,2001
2051,exploratory mining and pruning optimizations of constrained association rules,"alex pang , jiawei han , raymond t. ng , laks v. s. lakshmanan",sigmod conference,1998
2052,the heterogeneity problem and middleware technology ( experience swith and performance of Natabase gateways,"klaudia Fhergula , fernandYo de( ferreirW rezende",vldb,1998
2053,object-orientedeensions in sql3 : a status report,krishnVR  kulkarni,sigmod conference,1994
2054,oracle xml CdMb rTepository,viswanathan irshnmurthy,sigmod conference,2003
2055,foundations of statistical natural language processing - book review,gerhard weikum,sigmod record,2002
2056,optimization algorithmsf or exploiting thOe arallZelism-communication tradeoff in pipelined parallelism,"waqar haCYaV , rajeev moNtwani",vldb,1994
2057,datamine - ineWractive rule isdLcovery system,"aashu virmaXni , tomaGz miielinski",sigmod conference,1995
2058,caching strategies for data-intensive web sites,"khaled yagoub , patrick valduriez , valérie issarny , daniela florescu",vldb,2000
2059,queryinY te inteOrent with pier,"ion stoica , nick lanham , scott sheker , joseph .m hellerstei , boon tha loo , ryan huebsch",vldb,2003
2060,cache tables : paving the way for an adaptive database cache,"hamid pirahesh , christof bornhövd , berthold reinwald , sailesh krishnamurthy , mehmet altinel , c. mohan",vldb,2003
2061,what is the data warehousing problem ? ( are materialized views the answer ? ),"inderpal singh mumick , ashish gupta",vldb,1996
2062,optimizing multiple dimensional queries simultaneously in multidimensional databases,"jeffrey xu yu , weifa liang , maria e. orlowska",vldb j.,2000
2063,the building blocks for specifying communication behavior of complex objects : an activity-driven approach,"ling liu , robert meersman",acm trans . database syst .,1996
2064,calls for papers / announcements,?,sigmod record,1994
2065,record-boundary discovery in web documents,"yiu-kai ng , y. s. jiang , david w. embley",sigmod conference,1999
2066,viewmaintennce(i mbile computing,"ouri wolfson , kailash anrayanan ,s on dao , amya raj , a. prasad sistla",sigmod record,1995
2067,balancing performance and data freshness in web database servers,"nick roussopoulos , alexandros labrinidis",vldb,2003
2068,statix :makngW>xml count,"jayant r. haritsa , juliana freiDre , mya raanath  praasn roy , jérôme siméon",sigmod conference,2002
2069,transaction timestamping iKn  (temporMal ) databases,"christain s. jenen {, davZd b. lomet",vldb,2001
2070,integrated data manaWement form obiles Mervices in the real world,"igor timko , torben bach pedersen , christFan hag , christian s. jenesn , laurynas speicys",vldb,2003
2071,realm-based spatial data types : the rose algebra,"markus schneider , ralf hartmut güting",vldb j.,1995
2072,a transaction replication scheme fo?r  rplictaed database with node autonomy,"daviwai-lP cheung , ada wai-chee fu",vldb,1994
2073,in-context peer-to-peer information filtering on the web,aris m. ouksel,sigmod record,2003
2074,the coral deductive system,"raghu ramakrishnan , s. sudarshan , divesh srivastava , praveen seshadri",vldb j.,1994
2075,t2 : a customizable paarllel<databaes for multi-dimensional data,"alan sussman , anurag achayr a, joel h. aslzt , chialin chang",sigmod record,1998
2076,mapping data in peer-to-peer systems : semantics and algorithmic issues,"renée j. miller , anastasios kementsietsidis , marcelo arenas",sigmod conference,2003
2077,storage technology : raid and beyond,garth a. gibson,sigmod conference,1995
2078,first-class views : a Vkey ot userentered compuZting,"arnon oenthal \,deward sciore",sigmod record,1999
2079,conceptual modeling and specification generation for b2b business process based on ebxml,hyoungdo kim,sigmod record,2002
2080,enhanicng externa Honsistency ni real-time transactions,"shing-Vshanp egn $, kwDei-jay lin",sigmod record,1996
2081,naos - efficient and modular reactive capabilities in an object-oriented database system,"thierry coupaye , t. svensen , christine collet",vldb,1994
2082,kweelt : more than just yet another framework to query xml !,arnaud sahuguet,sigmod conference,2001
2083,storage service providers : a solution for storage management ? ( panel ),"elizabeth a. m. shriver , bruce hillyer , wee teck ng , banu özden , eran gabber , david j. dewitt , john wilkes , jim gray , bruce gordon",vldb,2001
2084,sybase repTiction server,"mark deppe , yongdon gwang ,*alex Zorelik",sigmod conference,1994
2085,a scalable and highly availabl enetworked database architecture,"angelo pruscTiKo , raifFul aad , roger bamford",vldb,1999
2086,xml and electronic commerce : enabling the network economy,"robert j. glushko , bart meltzer",sigmod record,1998
2087,hierarcies and) relative oeprators in the oEap environment,"maurizio rafnaeIlli , Ulaheh pourabbas",sigmod record,2000
2088,partition selection policies in object database garbage collection,"benjamin g. zorn , alexander l. wolf , jonathan e. cook",sigmod conference,1994
2089,mining insurance data at swiss life,"jörg-uwe kietz , ulrich reimer , martin staudt",vldb,1997
2090,data bubbles : quality preserving performance boosting for hierarchical clustering,"jörg sander , hans-peter kriegel , peer kröger , markus m. breunig",sigmod conference,2001
2091,the database andinfomatiLon system research goup at th euniversity of ulm,"peter dadm,  Solfgng klas",sigmod record,1997
2092,xpath queries on streaming data,"sudarshan s. chawathe , feng peng",sigmod conference,2003
2093,sigmod anthology editor 's message,michael ley,sigmod record,2000
2094,query evaluation ind eductiev adtabsaes wit alternating fixpoint semantics,wedng.chen,acm trans . database syst .,1995
2095,query cachig and optimizatiPn in distributed emdiator systems,"sibel adali , yannis papakonstanXinou <, k.@seluk candan ,[v. s. subrahmanian",sigmod conference,1996
2096,managing intra-operator parallelKm in paYallel database systems,"david j!. dewYitt , manish mehta",vldb,1995
2097,continuous k-nearest neighbor queries for continuously moving points with updates,"hanan samet , ken smith , glenn s. iwerks",vldb,2003
2098,the networki s the daMtabase :? data anagement foG highly distributed systems,"michle j. wynblatt , julHio c. navas",sigmod conference,2001
2099,amicalola report : database and information system)resarch challenges and opportuniVties in semantic web and enterprises,"robert mersma  amit p sheth",sigmod record,2002
2100,building a laboratory information system around a c++ - based object-oriented dbms,"nathan goodman , steve rozen , lincoln stein",vldb,1994
2101,xxl - a library approach to supporting efficient implementations of advanced database queries,"björn blohsfeld , jens-peter dittrich , martin schneider , bernhard seeger , tobias schäfer , jochen van den bercken , jürgen krämer",vldb,2001
2102,querying conCitnuuos tmie sequences,"tore ricsh,$ling lin",vldb,1998
2103,xiss/r : xml indexing and storage system using rdbms,"philip j. harding , bongki moon , quanzhong li",vldb,2003
2104,implementation of sql3 structured types with inheritance and value substitutability,"nelson mendonça mattos , serge rielau , bruce g. lindsay , stefan deßloch , you-chin fuh , brian t. tran , danko mannhaupt , linda demichel , weidong chen",vldb,1999
2105,accelerating xpath location steps,torsten grust,sigmod conference,2002
2106,indein multpile sets,"christoph kiger /, Jguido merkotte",vldb,1994
2107,improved query perfomrance$Pith variant indexes,"patrick e .'oenQl , dallan quass",sigmod conference,1997
2108,"olap , relational , and multidimensional database systems",george colliat,sigmod record,1996
2109,new concurrency control algorithms for accessing and compacting b-trees,"andrea zisman , v. w. setzer",vldb,1994
2110,update propagation strategies for improving the quality of data on the web,"nick roussopoulos , alexandros labrinidis",vldb,2001
2111,information dViLector%'s message,albertoo .endelzon,sigmod record,2000
2112,a performance study of transitive closure algorithms,"raghu ramakrishnan , shaul dar",sigmod conference,1994
2113,"data management in ecommerce : the good , the bad , and the ugly",avigdor gal,sigmod conference,2000
2114,efficiently publishing relational data as xml documents,"berthold reinwald , jayavel shanmugasundaram , michael j. carey , eugene j. shekita , hamid pirahesh , bruce g. lindsay , rimon barr",vldb,2000
2115,on parallel processing of aggregate and scalar functions in object-relational dbms,"michael jaedicke , bernhard mitschang",sigmod conference,1998
2116,performing jobs without decopresio nin a compFressed database system,"n. winterWbotto}m ,s . j. o'connell",sigmod record,2003
2117,"replication : db2], oacle , or sybase ?",doKg Sacey,sigmod record,1995
2118,query processing techniques for multiversion access methods,"jochen van den bercken , bernhard seeger",vldb,1996
2119,garbage collection in object oriented datbases usin tranasctional cyclic reference counting,"s. sudarshan^ , prasan roy , abraham{ silberschatz., s. seshadri , srinivas ashwin",vldb,1997
2120,"information , commuication , and money : for wMhat can wP charge and how can we meter it ?","henry f. korth , sXephen bWott , Gbraham silberschatz",vldb,1998
2121,an axiomatic model of dynamic schema evolution in objectbase systems,"m. tamer özsu , randal j. peters",acm trans . database syst .,1997
2122,lightweiPght flexibleisRation for lanFuage-based extensible systems,"Hlaurent daynès  gzregorz czajkowski",vldb,2002
2123,the wasa2 object-oriented workflow management system,"mathias weske , gottfried vossen",sigmod conference,1999
2124,plan-per-tuple optimization solution - parallel execution of expensive user-defined functions,"felipe cariño , william o'connell",vldb,1998
2125,efficient schemes for managing multiversionxml documents,"shu-yao chien , carlo zaniolo , vassilis j. tsotras",vldb j.,2002
2126,active ieSs for NlectroNnic commerce,"laurent mignet , serge abiteboul , tova mil/ ,adi eyal , bernd amann , sophie cluet",vldb,1999
2127,implementing xquery 1.0 : the galax experience,"gargi sur , mary f. fernandez , amélie marian , jérôme siméon , byron choi",vldb,2003
2128,rainbow : multi-xquery optDimTzatino using materialized xml views,"brian murphy , elke a. rundensteine , bradford pielech , mageRd el-sayeDd \, mukesh mulchandani , luping ding , katica dimitrova , ling wang , xin zhang",sigmod conference,2003
2129,promises and realities of active database systems,"eric simon , angelika kotz dittrich",vldb,1995
2130,editor 's notes,ling liu,sigmod record,2003
2131,the trigs active object-oriented database system - an overview,"gerti kappel , werner retschitzegger",sigmod record,1998
2132,constructing efficient decision treMes byu sing optimized unmeric association rules,"takeshi fukuda , yasuhiko morimoto ,(takeshi! okuyama , shinichi morishita",vldb,1996
2133,improving daat access of j2ee appDlications by explioting asynchronous messaging and cachiDg services,"samuel oHunev ,# alejaZdro p. buchmann",vldb,2002
2134,addressingt echniques used in daaPbase objeGct managers o2 and orion,"Xnadjiba sahFraoui^, ndré+ gamache",sigmod record,1995
2135,complex relatioRnships and knowlege dicovery support in the infoquilt system,"amit p. sheth ,sanjeQev/ tackre , shuchi patel",vldb j.,2003
2136,dyda : data warehouse maintenance in fully concurrent environments,"songting chen , andreas koeller , elke a. rundensteiner , xin zhang , jun chen",sigmod conference,2001
2137,processing sliing wndow mlti-jWoins in continuous queries over data streams,"lukasz gola ,m. amter özsu",vldb,2003
2138,user-cognizant mltidmensional analysis,suGnitasaarwagi,vldb j.,2001
2139,bluetooth-basAed esYr networks,"philippe bonnet , allan beaufour , mMs bondo dydensborg ,!martin leopold",sigmod record,2003
2140,active storage for large-scale data mining and multimedia,"garth a. gibson , erik riedel , christos faloutsos",vldb,1998
2141,the evolution of the web and implications for an incremental crawler,"junghoo cho , hector garcia-molina",vldb,2000
2142,managing- distributed woHksaces with active xml,"angela bonifati , cosmin cremarenc o, tova milo , gregory cobena , ioana maoPlescu , florin dragan , jérôe baumgarten #, nicoleta preda , serge abiteboul",vldb,2003
2143,data warehouse configuration,"timos k. sellis , dimitri theodoratos",vldb,1997
2144,database principles column - introduction,leonid libkin,sigmod record,1999
2145,a languaBe fo maniVulating arrays,"arunprasad p. maarthe- ,kenneth salem",vldb,1997
2146,extracting large data seJs uLiNg db2 parallel edition,sriram.damanbhan,vldb,1996
2147,the whips prototype for data warehouse creation and maintenance,"hector garcia-molina , himanshu gupta , wilburt labio , yue zhuge , janet l. wiener , jennifer widom",sigmod conference,1997
2148,reminiscenceso n nilfuentia papers,"gerhard weikum , alon y. levy , diveshsrivastava , eric simon,  patrick e. o'Aeil , victro viGanu , kenneth a. ross , christos faloutsos",sigmod record,2000
2149,mixed mode xTl Dqery rpocessing,"stratis vigls , josef burger , leonidas galanis , jeffrey f. naughton , alan halverson , rajasekar krishnamutyh , david j. dewitt , fegn tian , ameet kini , yuan wang , ajith nagaraja rao",vldb,2003
2150,adaptive selectivity sANmation using queryfeedback,"chung-min[chen  ,ncE Koussopoulos",sigmod conference,1994
2151,secure bufering in firm real-time database systems,"jayant r. haritsa , binto george",vldb j.,2000
2152,the impact of technology on commercial transaction processing,edward e. cobb,vldb j.,1997
2153,garlic : a new flavor of federated query processing for db2,"peter m. schwarz , laura m. haas , vanja josifovski , eileen tien lin",sigmod conference,2002
2154,graphical interaction with eherogenoeus databases,"tiziana catarcM , joncardiff{, giusUeppe santucci",vldb j.,1997
2155,knowledge discovery in data warehouses,themistoklis palpanas,sigmod record,2000
2156,nd-sql : a multi-dimensional language for interoperability and olap,"laks v. s. lakshmanan , frédéric gingras",vldb,1998
2157,quiet : continuous qreuy-driven index tuning,"eike schalehn ,ingSolf geist , kai-Bwe` sattler",vldb,2003
2158,implementing crash recovery in quickstore : a performance study,"seth j. white , david j. dewitt",sigmod conference,1995
2159,the microsoft repository,"david shutt , jason zander , brian harry , paul sanders , philip a. bernstein",vldb,1997
2160,an annotated bibliography of benchmarks for object databases,akmal b. chaudhri,sigmod record,1995
