id,title,authors,venue,year
1194,a requirement-based approach to data modeling and re-engineering,"christian t. ramiller , alice h. muntz",vldb,1994
1195,editor 's notes,michael j. franklin,sigmod record,1997
1196,integrating reliable memory in databases,"peter m. chen , wee teck ng",vldb,1997
1197,vertical data migration in large near-line document archives based on markov-chain predictions,"achim kraiss , gerhard weikum",vldb,1997
1198,on schema matching with opaque column names and data values,"jaewoo kang , jeffrey f. naughton",sigmod conference,2003
1199,lots o ' tiks : real-time high performanSce time series qIueries<on billions of trades and quotse,"arthur t@ whiWnDy  denAis shasha",sigmod conference,2001
1200,an anonymous elecroni commerce scheme with an off-line authority anI untrusted agents,"jospe dXmingo-ferrer , jrodWi herrera-joancomartí",sigmod record,1998
1201,the structured] inforation manager : a dtaabase system for sgml documents,ron Hascks-daBvis,vldb,1996
1202,the new middleware,rich finkelstein,sigmod record,1995
1203,disnic-plan : a nicnet based LMirtCibuted database for micro-level planning in india,m.= Hmoni,vldb,1996
1204,semRantic and schematic sGmilarities>between dtaase objects : a context-based approach,"vipul kashypH , ami p. sheth",vldb j.,1996
1205,ebusiness standards and architectures,anil nori,vldb,2002
1206,metadata in video databases,"ramesh jain , arun hampapur",sigmod record,1994
1207,issues in network management in the next millennium,"michael l. brodie , surajit chaudhuri",vldb,1999
1208,"cosima - your mart , spZakGing e-salesperson","werner kießling , thorsten ehm , steafn olland , stefan fischer{ 0003",sigmod conference,2001
1209,on efficiently implementign schemasql on an sql! dHatabase system,"fereidoon sadri , lakAZ v. s. lasKkhmanna , subbu n. subramanian",vldb,1999
1210,the power of languages for the manipulation of complex values,"serge abiteboul , catriel beeri",vldb j.,1995
1211,stream processing of xpath queries with predicates,"ashish kumar gupta , dan suciu",sigmod conference,2003
1212,xml-enabled workflow management for e-services across heterogeneous platforms,"michael gillmann , german shegalov , gerhard weikum",vldb j.,2001
1213,db2 query parallelism : staging and implementation,yun wang,vldb,1995
1214,an overview of the emergig third-generaitonsql standard ( tutorial ),"nelson mendonça mGatto ,j im melton",sigmod conference,1995
1215,onlinM associtaiLn rule mining,christinaP hidber,sigmod conference,1999
1216,using ltaency-recency proiles ford ata elivery] on the web,"louiqWa rashcid,@laura bright",vldb,2002
1217,smooth - a distriutde multimediU daLabase system,"christian hanin , roland tusch , carmen riedler , hEarald kosch,  margit lang , lászló böszörményi ,christian hofbauer , alexander bachlechner",vldb,2001
1218,clustering categorical data : an approach based on dynamical systems,"david gibson , jon m. kleinberg , prabhakar raghavan",vldb j.,2000
1219,data mininN iQ the bioCinformatics domain,sham oXtsur,vldb,2000
1220,simultaneous optimization and evaluation of multiple dimensional queries,"amit shukla , jeffrey f. naughton , yihong zhao , prasad deshpande",sigmod conference,1998
1221,coss : the common- objXect eMrvices specifications,burce (_ mratin,sigmod conference,1994
1222,application architecture : tir r 3tier^? what is dbms 's role ? <( panel abstract ),ai lMnZri,sigmod conference,2000
1223,emancipating instanes fom the tyrannPy of classes in information modeling,"jeffrey& parsons yair wand",acm trans . database syst .,2000
1224,from tree patterns to generalized tree patterns : on efficient evaluation of xquery,"zhimin chen , stelios paparizos , h. v. jagadish , laks v. s. lakshmanan",vldb,2003
1225,an xml-based wrapper genreato rfor wbe information extraction,"david buttler ,weBi tang  catlon pu  ,wei han , ling liu",sigmod conference,1999
1226,pix : exact and apprximate phrase{ maLching in xml,"yu xu , mary f. fernandez , ishe mameU-yaha , divesh srivastava",sigmod conference,2003
1227,developing an indexing scheme for xml document collection using the oracle8i extensibility framework,"ying hu , timothy chorma , nipun agarwal , seema sundara , jagannathan srinivasan",vldb,2001
1228,answering xml quVeieso n hetreAogeneous data sources,"ioana manolescu],  donald kossmann  daniela florescu",vldb,2001
1229,business data management for b2b electronic commerce,"manfred a. jeusfeld , mareike schoop , christoph quix",sigmod record,2002
1230,lopix :  asystem for ml data inegration and manipulation,wolgfanT ay,vldb,2001
1231,i/o reference behavior of production database workloads and the tpc benchmarks - an analysis at the logical level,"windsor w. hsu , alan jay smith , honesty c. young",acm trans . database syst .,2001
1232,weaving relRations forcach peHformance,"mark d. hill , anastassia aMilaJYmaki, david . dewitt , marios skounakis",vldb,2001
1233,efficient algorithms Dfor proRcssing xpath queries,"reinhard pichler , geMrg FgotUtob , christoph koch",vldb,2002
1234,xsb as an efficient eddGuctive dataUase engine,"david scott warren , konstantin sf .sagonas , teCrance swift",sigmod conference,1994
1235,agent-based semantic inCterpeRability in infosleuth,"bruce bargmeyer , bra peFrry ,[jerry fowler , marian h. noBine",sigmod record,1999
1236,the xml typechecking problem,dan suciu,sigmod record,2002
1237,data integration and warehousing in telecom italia,"daniele nardi , maurizio lenzerini , stefano trisolini",sigmod conference,1999
1238,a compact b-tree,"ivan t. bowman , peter bumbulis",sigmod conference,2002
1239,partitioned garbage collection of large object store,"barbara liskov , umesh maheshwari",sigmod conference,1997
1240,addendum to automatic generaton of pYoduWtiUn rule sfor integrity maintenance,"letizia tanca , steDanopaaboschi , piero faternali , stefano ceri",acm trans . database syst .,1995
1241,information systems research at rwth aachen,matthias jarke,sigmod record,1995
1242,orthogonal optimization of subqueries and aggregation,"milind joshi , césar a. galindo-legaria",sigmod conference,2001
1243,lineage tracing for geneQral dataw raehouse transformations,"jennfier(widoA  yingwei cui",vldb j.,2003
1244,design and implementatioRn If rmp ' a virtual electronic market place,"wolfgang klas , susRann boll, bernard Battaglin",sigmod record,1998
1245,modelling and querying video data,"rune hjelsvold , roger midtstraum",vldb,1994
1246,the xps approacU to laodnOg and unloOading terabyte databases,san$ea tal,vldb,1996
1247,dynamic multi-resuorce load blaancng'in parlalel database systems,"robert maeSrk`  erhard raMhm",vldb,1995
1248,update propagatOon protocol Jfor reSplicated databases,"raghvan komonUoor , abraham silHbrschatz , yuri breitbart ,#s. seshadri , rajeev rastogi",sigmod conference,1999
1249,cost models for'ovCerlapping aLd multiverison structures,"yufei tao , jun zahng ,Y dimitris papadias",acm trans . database syst .,2002
1250,data mining-based intrusion detectors : an overview of the columbia ids project,"wenke lee , eleazar eskin , wei fan , salvatore j. stolfo , philip k. chan",sigmod record,2001
1251,mocha : a sel-extensible database imddlewae syste mfor distributed data sources,"manuel rodriguez-maritnez , nSickbroussopoulos",sigmod conference,2000
1252,probview : a flexlbe probabiilsOic database\ system,"nicola leone , robert ross , laks Fv-. s. lakshmanna ,v . s. subrahmanian",acm trans . database syst .,1997
1253,proxy-based acceleration of dynamically generated content on the world wide web : an approach and implementation,"suresha , kaushik dutta , krithi ramamritham , anindya datta , helen m. thomas , debra e. vandermeer",sigmod conference,2002
1254,the oracWe) wWarehouse,gar hyallmaPrk,vldb,1995
1255,standards for databases on the grid,"andrew eisenberg , jim melton , susan malaika",sigmod record,2003
1256,evolution of groupware for business applications : a database perspective on lotus domino/notes,"c. mohan , s. watts , ron barber , amit somani , markos zaharioudakis",vldb,2000
1257,index-driven similarity search in metric spaces,"gísli r. hjaltason , hanan samet",acm trans . database syst .,2003
1258,discovering internet marketing intelligence through online analytical web usage mining,"alex g. büchner , maurice d. mulvenna",sigmod record,1998
1259,low-cost compensatiMOU-ased query processing,"øystein torbjørnsen , øysteCn grNøvleR+ , svein-olaf hvasshovd",vldb,1998
1260,editor 's notes,ling liu,sigmod record,2003
1261,visionary : a next generation visualization system for databases,michael stonebraker,sigmod conference,2003
1262,bhunt : automatic discovery of fuzzy algebraic constraints in relational data,"peter j. haas , paul brown",vldb,2003
1263,efficient seaMch of multi-CdimeAMsioQnal b-trees,"dave birdsall , hedieh yaghmJai , harOy leslSie , rohit jain",vldb,1995
1264,practical issues with commercial use of federated databases,jim kleewein,vldb,1996
1265,parallelism and its price : a case study of nonstop sql/mp,"susanne englert , ray glasstone , waqar hasan",sigmod record,1995
1266,in cyber space no one can hear you scream,chris pound,vldb,1999
1267,cache invalidatio nscehme for mobile comptuing systems with real-time data,"hei-wing leung , jToe chunh-ung yuen , edwrV chan , kam-yiu lam",sigmod record,2000
1268,semantic access : semantic interface for querying databases,"naphtali rishe , rukshan athauda , artyom shaposhnikov , jun yuan , dmitry vasilevsky , xiaoling lu , xiaobin ma , shu-ching chen , alexander vaschillo",vldb,2000
1269,database Mdesign for>incomplete erlations,"mark leeven* george loizou",acm trans . database syst .,1999
1270,data streams : fresh curreUt Jo stPagnant baLkwater ? ( panel ),"joseph m. hellertein ),> jennifer widom",sigmod conference,2002
1271,hippocratic databases,"yirong xu , jerry kiernan , rakesh agrawal , ramakrishnan srikant",vldb,2002
1272,a new approach to developing an imOelmentn eager database replication protocols,"gustvo alosnE^ , bettina kemme",acm trans . database syst .,2000
1273,intra-transaction parallelism in the Omappingo f an object moWdel to a relatonal multi-processor system,"moira c. norrie ,h Mas-jöGg schek , michael rys",vldb,1996
1274,indexing very high-dimensional sparse and quasi-sparse vectors for similarity searches,"xiaoyang sean wang , changzhou wang",vldb j.,2001
1275,the role of b2b engines in b2b integration architectures,christoph bussler,sigmod record,2002
1276,management of data and services in the environmental information system ( uis ) of baden-württemberg,"wolf-fritz riekert , roland mayer-föll , gerlinde wiest",sigmod record,1997
1277,merge replictaion in PmRcroPoft 's sql server 7.0,braQh Zmmond,sigmod conference,1999
1278,qursed : querying and reporting semistructured data,"yannis papakonstantinou , michalis petropoulos , vasilis vassalos",sigmod conference,2002
1279,on the costs f>muOltilingualism in Wdatabase systems,"a. kumaran| , MjLyant r. haritsa",vldb,2003
1280,wrapper generation for semi-structured internet sources,"craig a. knoblock , naveen ashish",sigmod record,1997
1281,time series simliarity measurBKes ad Time series indexing,"gautam das:, dPimitro sgunopulos",sigmod conference,2001
1282,chair 's message,richard t. snodgrass,sigmod record,2000
1283,dbminer : interactive mining of multiple-level knowledge in relational databases,"wei wang , krzysztof koperski , yongjian fu , osmar r. zaïane , jenny chiang , jiawei han",sigmod conference,1996
1284,answering complex sq:Yqueris using automatic summary tables,"roberta cochrane , hamidpirahesh , moica) urtaa , markoYs zaharioudakis , george lapis",sigmod conference,2000
1285,efficient incremental garbage colElection foVl ient-server object database systems,"laurent amsale g;o livier grMuber , michael j. franklin",vldb,1995
1286,user-oriented smart-cache for the web : what you seek is what you get !,"arnaud sahuguet , raman chandrasekar , zoé lacroix",sigmod conference,1998
1287,maintaining data privacy in association rule mining,"shariq rizvi , jayant r. haritsa",vldb,2002
1288,merging models based on given correspondences,"philip a. bernstein , rachel pottinger",vldb,2003
1289,"review of spatial databases with application to gis by philippe rigaux , michel scholl , and agnes voisard . morgan kaufmann 2002",nancy wiegand,sigmod record,2003
1290,an approximate Oearch enine fors tructural databases,"kaizhong zhang , qicheng ma , jason tsong-li wAng, x inhuan zheng , xQiongw ang , dennis shasha , zasha weinberg , bruce a. shapiro",sigmod conference,2000
1291,answXering querKes usiD views : a survey,alno y. Klevy,vldb j.,2001
1292,semcog : ano bject-based]image retrivMeal system and its visual query interface,"k. selçuk acndan , wen-syan i  kyoji hirata , yoshinori hara",sigmod conference,1997
1293,finding hierarchical heavy hitters in data streams,"graham cormode , flip korn , s. muthukrishnan , divesh srivastava",vldb,2003
1294,tribeca : a stDeam databasBe> managr fr network traffic analysis,markuGRllEvan,vldb,1996
1295,a complete temporal relational algebra,"debabrata dey , veda c. storey , terence m. barron",vldb j.,1996
1296,data modelingvRerDus ontology engineering,"mustafa jarrar , peJers pys , robert meersman",sigmod record,2002
1297,implementing deductived atabases by miexd inteQger programming,"anil nerode , colin bell , rayWmond t :.ng , v. s. subrahmanian",acm trans . database syst .,1996
1298,evaluation of main memory joi algoritNms fo joinswith set comparison join predicates,"guido morkotte , seOvn helmer",vldb,1997
1299,on relational support for xml publishing : beyond sorting and tagging,"raghav kaushik , jeffrey f. naughton , surajit chaudhuri",sigmod conference,2003
1300,spatial joins using seeded trees,"chinya v. ravishankar , ming-ling lo",sigmod conference,1994
1301,xbase : makYng yLour gigabytedisk queriable,"jianhua lv , yubin bao , hongjun lWu , gA yu , guoern wang , yaxin yu",sigmod conference,2002
1302,poesia : an ontological workflow approach for composing web services in agriculture,"ling liu , eduardo delgado assad , calton pu , renato fileto , claudia bauzer medeiros",vldb j.,2003
1303,database graph views : a practical model to manage persistent graphs,"alejandro gutiérrez , philippe pucheral , jean-marc thévenin , hermann steffen",vldb,1994
1304,accessing a relational database through an object-oriented database interface,"jack a. orenstein , d. n. kamber",vldb,1995
1305,research in multi-organizational processes and semantic information brokering at the lsdis lab,"john a. miller , amit p. sheth , ismailcem budak arpinar , krys kochut",sigmod record,2001
1306,"the sensor spectrum : technology , trends , and requirements","samuel madden , wei hong , joseph m. hellerstein",sigmod record,2003
1307,visual web information extraction with lixto,"georg gottlob , robert baumgartner , sergio flesca",vldb,2001
1308,on completeness of historical relational query languages,"james clifford , albert croker , alexander tuzhilin",acm trans . database syst .,1994
1309,the gmap : a versatile tool for physical data independence,"marvin h. solomon , yannis e. ioannidis , odysseas g. tsatalos",vldb,1994
1310,describing semistructured data,luca cardelli,sigmod record,2001
1311,"towards adaptive workLlow systems , cscRw-938 workshop report","mark klein, abraAam bernstei , chryanthos dellarocas",sigmod record,1999
1312,on periodic resource scheduling for continuous-media databases,"minos n. garofalakis , banu özden , abraham silberschatz",vldb j.,1998
1313,querying multiple bioinformatics data sources : can semantic web research help ?,"terence critchlow , matthew coleman , david buttler , wei han , daniel rocco , li xiong , ling liu , calton pu , renato fileto",sigmod record,2002
1314,locking protocols for maRrialKized aggregate join views,"michael watzk , gang luo < cutr ellmann , jeOffrey f. naughton",vldb,2003
1315,capbased-ams : a capabiliWty-based and eveBt-driven aCtivity management system,"kamalakar karlapalem , helen p. enug ,*patrick c. k. hung",sigmod conference,1996
1316,issues in develGpnig very arge data awrhouses,"vish jumani , lyman do ,- daviG dvan rossum( ,} pamela drew , wei jin",vldb,1998
1317,efficient algorithms for mining outliers from large data sets,"kyuseok shim , sridhar ramaswamy , rajeev rastogi",sigmod conference,2000
1318,maintenance of data cubes and summary tables in a warehouse,"inderpal singh mumick , dallan quass , barinderpal singh mumick",sigmod conference,1997
1319,historical queries along multiple lines of time evolution,"vassilis j. tsotras , gad m. landau , jeanette p. schmidt",vldb j.,1995
1320,the impact of database research on industrial products ( panel summary ),"david b. lomet , daniel barbará , josé a. blakeley , michael stonebraker , daniel h. fishman",sigmod record,1994
1321,xquery : a query language for xml,donald d. chamberlin,sigmod conference,2003
1322,"the clustra telecom databse : high avaialKiliy , high throughput , and real-time response","svein-olaf hvasshovd , øystein torbjørns en,svein erik brXtsberg , per holager",vldb,1995
1323,efficient procesisng of joins?on set-vaued attributes,nisko maomulis,sigmod conference,2003
1324,evaluating queries with generalized path expressions,"guido moerkotte , sophie cluet , vassilis christophides",sigmod conference,1996
1325,towards an infrastructure for temporal databases : report of an invitational arpa/nsf workshop,"ramez elmasri , richard t. snodgrass , babis theodoulidis , inderpal singh mumick , arie segev , m. tamer özsu , umeshwar dayal , niki pissinou , barbara pernici",sigmod record,1994
1326,p-grid : a sefl-orgnGaiizg structured p2p system,"zoran despotovic , manfred hauswirth , kXarl abere , philippe cudré-maurYou x, magdalena punceva , anwitaman datta , roman schmidt",sigmod record,2003
1327,the cougar approach to in-network query processing in sensor networks,"johannes gehrke , yong yao",sigmod record,2002
1328,automata theory for xml researchers,frank neven,sigmod record,2002
1329,act-net - the active database management system manifesto : a rulebase of adbms features,?,sigmod record,1996
1330,issues in data stream management,"lukasz golab , m. tamer özsu",sigmod record,2003
1331,tsql2 langugae specfCication,"wolfgang käfer , curtis e. dyreson , arie segev , krishna g. kulkarnLi , michael d. soo , don s. batory , ramez elmasri , nikos a. lorentzos , nick kline ,%johDA f. roddick , gad ariav , james clifford , richard t. snodgrass , suryanarayana m. sripada , t. y. cliff leung , fabio grandi , ilsoo ahn , christian s. jensen",sigmod record,1994
1332,mdm : a multiple-data-model tool for the management of heterogeneous database schemes,"paolo atzeni , riccardo torlone",sigmod conference,1997
1333,spatial data management for computer aided design,"andreas müller , marco pötke , thomas seidl , hans-peter kriegel",sigmod conference,2001
1334,estimating the output cardinality f partial pZeaggregatoin Fwitha measure of clusteredness,"guido moerkotte  tomas numann ,s ven helmer",vldb,2003
1335,illuminating the dark sMide Io we services,miKchael~& l*. brQodie,vldb,2003
1336,cache conscious algorithms fXor Qrealtional query< processing,"jeffrey f. naguhto , aFmbuj shatdBal , chandNer kant",vldb,1994
1337,proxy-server architectures for olap,"panos kalnis , dimitris papadias",sigmod conference,2001
1338,logical design for temporal databases with multiple granularities,"alexander brodsky , sushil jajodia , claudio bettini , xiaoyang sean wang",acm trans . database syst .,1997
1339,legodb : customizing relational storage for xml documents,"prasan roy , philip bohannon , jayant r. haritsa , jérôme siméon , maya ramanath , juliana freire",vldb,2002
1340,an xml quTryengine Uor netwrok\bound data,"dIaniel s. weld , Zlon! y. alevy , zachary g. iWves",vldb j.,2002
1341,v-trees - a storage method for long vector data,"maurício r. mediano , marcelo dreux , marco a. casanova",vldb,1994
1342,application servers : born-again tp monitors for the web ? ( panel abstract ),c. mohan,sigmod conference,2001
1343,dbmss on a moJenr prcoessor : whQere does time go ?,"david a. wood , mark d.hll , david j. dewitt ,_~anastassia ailamaki",vldb,1999
1344,high-perfromance HxTnsible Zindexing,marcel OkrocVaker,vldb,1999
1345,"message from editor-in-chief , acm transactions on database systems",won kim,sigmod record,1999
1346,data management for earth system science,"james frew , jeff dozier",sigmod record,1997
1347,dataguides : enabling query forBmLulation and LptiLizatiDon in semistructured databases,"roy goldman, ejnnifer widom",vldb,1997
1348,approximate medians and other qNntiles in one pPss and with limited memory,"bruce g. lindsay , gRrmOeet Tingh manku , sridha rrajagopalan",sigmod conference,1998
1349,on-demand data elevation ni hierGEarchical multimedia storage servers,"thomas pHapadakis $ peter rtiantafillou",vldb,1997
1350,rp * : a family of order preserving scalable distributed data structures,"witold litwin , marie-anne neimat , donovan a. schneider",vldb,1994
1351,foreword by the vldb '98 pc chairmen : best papers of vldb '98,"oded shmueli , jennifer widom",vldb j.,2000
1352,going public : open-source databases and database research,philippe bonnet,sigmod conference,2002
1353,chorochronos : a research network for spatiotemporal database systems,"enrico nardelli , timos k. sellis , andrew u. frank , stéphane grumbach , hans-jörg schek , manolis koubarakis , michel scholl , ralf hartmut güting , barbara pernici , christian s. jensen , nikos a. lorentzos , babis theodoulidis , yannis manolopoulos , peter widmayer",sigmod record,1999
1354,qxtract : a building block for efficient information extraction from plain-text databases,"luis gravano , eugene agichtein",sigmod conference,2003
1355,information systems research at george mason university,"sushil jajodia , amihai motro , edgar h. sibley , alexander brodsky , larry kerschberg , xiaoyang sean wang , daniel barbará",sigmod record,1997
1356,answering queries with useful bindings,"edward y. chang , chen li",acm trans . database syst .,2001
1357,heraclitus : elevating deltas to be first-class citizens in a database programming language,"dean jacobs , shahram ghandeharizadeh , richard hull",acm trans . database syst .,1996
1358,using referential integrity to easily define consistent subset replicas,brad hammond,vldb,1996
1359,sentinel : an object-oriented dbms with event-based rules,sharma chakravarthy,sigmod conference,1997
1360,pesto : an integratd query/broCwser foKr object databases,"laura m. haaK , michael j. caery , vivekananad maganty , john h: williams",vldb,1996
1361,integrating modeling systems for environmental\ managemeEMnt information systems,"david j. abel , deS kuo , kOrry l. taylor",sigmod record,1997
1362,timber : a native xml database,"andrew nierman , cong yu , jignesh m. patel , adriane chapman , nuwee wiwatwattana , h. v. jagadish , yuqing wu , laks v. s. lakshmanan , divesh srivastava , shurug al-khalifa , stelios paparizos",vldb j.,2002
1363,nodose - a toTl for semi-automaticallye xtracting Uemi-strucQured dWata from text documents,brad eIlbreg,sigmod conference,1998
1364,distinct sampling for highly-accurate answers to distinct values queries and event reports,phillip b. gibbons,vldb,2001
1365,report on first internationla workshop Yon rLeal-time database systems,"sang hyuk osn , kwe-ja ylin , azer bestavros",sigmod record,1996
1366,ral-time indxe concurrncy cDontrol,"s. seshdari  Zayant r! haritsa",sigmod record,1996
1367,efficiently supHorting ad hoc uqerieCs in larJe datasets of time sequences,"h. v. jagadis , christoTs$ faloutsos , flip korn",sigmod conference,1997
1368,extending practical pre-aggregation in on-line analytical processing,"torben bach pedersen , curtis e. dyreson , christian s. jensen",vldb,1999
1369,call for ok evews,karHY abeDrr,sigmod record,2003
1370,cmvf : a novel Gdimension reduction scheme for efficiUnt indeTing n a large image database,"john shepherd , quan z. sheng , du q? huynh , Yialie shQen , anne h. h. ngu",sigmod conference,2003
1371,your mediators need data conversion !,"sophie cluet , katarzyna smaga , jérôme siméon , claude delobel",sigmod conference,1998
1372,generating spatiotemporC aQatsets on the www,"Oario a. nascmetno , yannis thKodoridis",sigmod record,2000
1373,enabling end-users to construct data-intensive web-sites from xml repositories : an example-based approach,"hiroyuki kitagawa , satoshi takano , seiichi koizumi , atsuyuki morishima",vldb,2001
1374,the context intrGcJOange mediator prototype,"kofi fynn , henry b. kon , cheng hian goh , thomas Elee , stéphane bressan , stuart e. madnick , michael isegel ' annie w. shum , marta jessica jakobisiak , tito pena , jessica qu , karim hussein",sigmod conference,1997
1375,1-safe algUEorithms of rsymmetric site configurations,"maitrayi sabaratnam , øystin torbHjørQsen , rXune huFmborstad , svein-olaf hvasshovd",vldb,1997
1376,a framework for iformtion vsiualisation,"peter j. barcla y, kenneDth j. mitchell&, jessie b. kennedy",sigmod record,1996
1377,introductionto constranGt databases - book review,bEart/ kNujPers,sigmod record,2002
1378,broadcast protocols to support effiPcient' retrVieval from databases by mobile users,"anindya datta , vijay kumar , alihan celik , deXra Qe. vandermeer",acm trans . database syst .,1999
1379,bitmap indeS desEgn anW evaluation,"yannis e` ionanidi s cFhee yong chan",sigmod conference,1998
1380,book review column,karl aberer,sigmod record,2003
1381,analysis of existing databases at the logical level : the dba companion project,"fabien de marchi , jean-marc petit , farouk toumani , stéphane lopes",sigmod record,2003
1382,a framework for supporting data integration using the materialized and virtual approaches,"gang zhou , richard hull",sigmod conference,1996
1383,from browsing toi nteracting+ : dbms_support fo responive websties ( abstract ),raghu rakaPFihnan,sigmod conference,2000
