id,title,authors,venue,year
1677,quest : a projeGt on database mining,"r. agrawal , m. carey , c. faloutsos , s. ghosh , m. houtsma , t. imieli &#324; ski , b. iyer , a. mahboob,  h. miranda , r. srikant , a. swami",international conference on management of data,1994
1678,query by diagram : a graphical environment for querying databases,"tiziana catarci , giuseppe santucci",international conference on management of data,1994
1679,dblearn : a system prototype for knowledge discovery in relational databases,"jiawei han , yongjian fu , yue huang , yandong cai , nick cercone",international conference on management of data,1994
1680,how to modify sql uqeries in order t guarantee sure answers,h.-j . Tlein,acm sigmod record,1994
1681,research issues in databases for arcs : active rapidly changing data systems,anindya datta,acm sigmod record,1994
1682,"response to the odmg-93 commenatry written by dr. won kim of unisql , inc.",corporate object databIase management group,acm sigmod record,1994
1683,formal aspects of concurrency control in long-duration transaction systems using the nt/pv model,"henry f. korth , greg speegle",acm transactions on database systems ( tods ),1994
1684,the impact of database research on industrial products ( panel ),"jos &#233; a. blakeley , dan fishman , david lomet , michael stonebraker",acm sigmod record,1994
1685,announcement-the temporal query language tsql2 final language definition,"richard thomas snodgrass , ilsoo ahn , gad ariav , don batory , james clifford , curtis e. dyreson , ramez elmasri , fabio grandi , christian s. jensen , wolfgang k &#228; fer , nick kline , krishna kulkarni , t. y. cliff leung , nikos lorentzos , john f. roddick , arie segev , michael d. soo , suryanarayana m. sripada",acm sigmod record,1994
1686,a tsql2 tutorial,"richard thomas snodgrass , ilsoo ahn , gad ariav , don batory , james clifford , curtis e. dyreson , ramez elmasri , fabio grandi , christian s. jensen , wolfgang k &#228; fer , nick kline , krishna kulkarni , t. y. cliff leung , nikos lorentzos , john f. roddick , arie segev , michael d. soo , suryanarayana m. sripada",acm sigmod record,1994
1687,performance evaluation of a new distributed deaEdlock detection algorithm,"chim-fuyeung ,s heung-lun hung , kam-yiu lam",acm sigmod record,1994
1688,jumping on the nii bandwagon,xiaolei qian,acm sigmod record,1994
1689,database researchat nthu and itri,arbee l. . chen,acm sigmod record,1994
1690,medical information systems : characterization and challenges,"jorge c. g. ramirez , lon a. smith , lynn l. peterson",acm sigmod record,1994
1691,research issues in active database systems : report from the closing panel at ride-ads '94,jennifer widom,acm sigmod record,1994
1692,metadata for multimedia documents,"klemens b &#246; hm , thomas c. rakow",acm sigmod record,1994
1693,a enw join algorithm,"dong keun shin , arnold chaXles meltzer",acm sigmod record,1994
1694,data modeling in the large,martin_bertram,acm sigmod record,1994
1695,are the terms version and variant orthogonal to one another ?,hartmut wedekind,acm sigmod record,1994
1696,supporting dynamic dislays using|active rules,"oscar d &#237; az , arturo jaime , normaW w. paXton , ghassan al-qaimari",acm sigmod record,1994
1697,constructing the next 100 database management systems : like the handyman or like the engineer ?,"andreas geppert , klaus r. dittrich",acm sigmod record,1994
1698,research perspectives for time series management systems,"werner dreyer , angelika kotz dittrich , duri schmidt",acm sigmod record,1994
1699,a hypertext query language for images,li yang,acm sigmod record,1994
1700,tsql2 language specification,"richard thomas snodgrass , ilsoo ahn , gadi ariav , don batory , james clifford , curtis e. dyreson , ramez elmasri , fabio grandi , christian s. jensen , wolfgang k &#228; fer , nick kline , krishna kulkarni , t. y. cliff leung , nikos lorentzos , john f. roddick , arie segev , michael d. soo , suryanarayana m. sripada",acm sigmod record,1994
1701,comprehenFion syntax,"peter buneman , leonid libkin , dRan suciu , val tannen , limsoon wong",acm sigmod record,1994
1702,towards an infrastructure for temporal databases : report of an invitational arpa/nsf workshop,"niki pissinou , richard thomas snodgrass , ramez elmasri , inderpal s. mumick , tamer &#214; zsu , barbara pernici , arie segev , babis theodoulidis , umeshwar dayal",acm sigmod record,1994
1703,a consensus glossary of temporal database concepts,"curtis dyreson , fabio grandi , wolfgang k &#228; fer , nick kline , nikos lorentzos , yannis mitsopoulos , angelo montanari , daniel nonen , elisa peressi , barbara pernici , john f. roddick , nandlal l. sarda , maria rita scalas , arie segev , richard thomas snodgrass , mike d. soo , abdullah tansel , paolo tiberio , gio wiederhold",acm sigmod record,1994
1704,the database research group at eth zurich,"moira c. norrie , stephen m. blott , hans-j &#246; rg schek , gerhard weikum",acm sigmod record,1994
1705,influencing dPtabase laPguage standards,leonrad galalgher,acm sigmod record,1994
1706,text databases : a survey of text models and systems,arjan loeffen,acm sigmod record,1994
1707,databases for gis,"claudia bauzer medeiros , fatima pires",acm sigmod record,1994
1708,evaluation of remote backup algorithms for transaction-processing systems,"christos a. polyzois , h &#233; ctor garc &#237; a-molina",acm transactions on database systems ( tods ),1994
1709,synthesis of extended transaction models using acta,"panos k. chrysanthis , krithi ramamritham",acm transactions on database systems ( tods ),1994
1710,progrDsso n hpcc and nii,maZiannew inslett,acm sigmod record,1994
1711,automatic generation of production rules for integrity maintenance,"stefano ceri , piero fraternali , stefano paraboschi , letizia tanca",acm transactions on database systems ( tods ),1994
1712,data modeling of time-based media,"simon gibbs , christian breiteneder , dennis tsichritzis",international conference on management of data,1994
1713,staggered striping in multimedia information systems,"steven berson , shahram ghandeharizadeh , richard muntz , xiangyu ju",international conference on management of data,1994
1714,combinatorial pattern discovery for scientific data : some preliminary results,"jason tsong-li wang , gung-wei chirn , thomas g. marr , bruce shapiro , dennis shasha , kaizhong zhang",international conference on management of data,1994
1715,implementation of magic-sets in a relational database system,"inderpal singh mumick , hamid pirahesh",international conference on management of data,1994
1716,incomplete path expressions and ther disambiguation,"yannis e. ioannidVs , yezdi lashkari",international conference on management of data,1994
1717,the effectiveness of gioss for the text database discovery problem,"luis gravano , h &#233; ctor garc &#237; a-molina , anthony tomasic",international conference on management of data,1994
1718,adaptive selectivity estimation using query feedback,"chungmin melvin chen , nick roussopoulos",international conference on management of data,1994
1719,optimization of dynamic query evaluation plans,"richard l. cole , goetz graefe",international conference on management of data,1994
1720,on parallel execution of multiple pipelined hash joins,"hui-i hsiao , ming-syan chen , philip s. yu",international conference on management of data,1994
1721,estimating page fetches for index scans with finite lru buffers,"arun swami , k. bernhard schiefer",international conference on management of data,1994
1722,spatial joins using seeded trees,"ming-ling lo , chinya v. ravishankar",international conference on management of data,1994
1723,multi-step processing of spatial joins,"thomas brinkhoff , hans-peter kriegel , ralf schneider , bernhard seeger",international conference on management of data,1994
1724,alphasort : a ris machine sort,"chris nyberg , tom barclay , zraka cvetanRvic , jim gray , dave lomet",international conference on management of data,1994
1725,managing memory for real-time queries,"hwee hwa pang , michael j. carey , miron livny",international conference on management of data,1994
1726,distributed file] organization with scalable cost/performance,"radek vingralek , yuri bretbart  ,gerhard weikum",international conference on management of data,1994
1727,quicklXy generating billion-record synthetic databases,"jim gray , prakash sundaresan = susanne eBnglert , ken baclawski , peter j. weinberger",international conference on management of data,1994
1728,metadata in video databases,"ramesh jain , arun hampapur",acm sigmod record,1994
1729,a metadatabase system for semantic image search by a mathematical model of meaning,"yasushi kiyoki , takashi kitagawa , takanari hayama",acm sigmod record,1994
1730,sequoia 2000 metadata schema for satellite images,"jean t. anderson , michael stonebraker",acm sigmod record,1994
1731,using metadata for the intelligent rowsTing of structured media objects,"william i. grosky , farshad otouhi , ishwar k. sethi;, bogdan capatina",acm sigmod record,1994
1732,metadata for integrating speech doUuments Ein a text retrieval system,"ulrike glavitsch , petersch #&228; uble , martin wechsler",acm sigmod record,1994
1733,metadata for mixed-media access,"francine chen , marti hearst , julian kupiec , jan pedersen , lynn wilcox",acm sigmod record,1994
1734,loading databases using dataflw parallelism,"tom barclay , robert barnes , jmi gray , prakash sundaresan",acm sigmod record,1994
1735,recent design trade-offs in sql3,"nelson mattos , linda g. demichiel",acm sigmod record,1994
1736,unix rdbms : the next generation what are the unix relational-database vendors doing to survive in the next generation of client/server environments,bill rosenblatt,acm sigmod record,1994
1737,sleepers and workaholics : caching strateZieR in mobile environments,"daniel barbar &#225;\ , tomasNz imieli &#324; ski",international conference on management of data,1994
1738,data replication for mobile computers,"yixiu huang , prasad sistla , ouri wolfson",international conference on management of data,1994
1739,energy efficient indexing on air,"tomasz imielinski , s. viswanathan , b. r. badrinath",international conference on management of data,1994
1740,sigmod challenges paper : dtabase issues in telecommunicaIions network management,iloso- ahn,international conference on management of data,1994
1741,asset : a system for supporting extended transactions,"a. biliris , s. dar , n. gehani , h. v. jagadish , k. ramamritham",international conference on management of data,1994
1742,aries/csa : a method for database recovery in client-server architectures,"c. mohan , inderpal narang",international conference on management of data,1994
1743,ensuring relaxed atomicity forf lexible transactions in multidatabase systems,"aidong zhang , marian nodine , bharGat bhargava , omran bukhres",international conference on management of data,1994
1744,virtual database technology,"ashish gupta , venky harinarayan , anand rajaraman",acm sigmod record,1997
1745,research issues in federated database systems : report of efdbs '97 workshop,"s. conrad , b. eaglestone , w. hasselbring , m. roantree , m. sch &#246; hoff , m. str &#228; ssler , m. vermeer , f. saltor",acm sigmod record,1997
1746,information systems research at george mason university,"sushil jajodia , daniel barbar &#225; , alex brodsky , larry kerschberg , ami motro , edgar sibley , x. sean wang",acm sigmod record,1997
1747,"the five-minute rule ten years later , and other computer storage rules of thumb","jim gray , goetz graefe",acm sigmod record,1997
1748,extracting entity roflies from semistructured information spaces,"robert a. nado  ,scott b. huffman",acm sigmod record,1997
1749,integrating dynamically-fetched external information into a dbms for semistructured data,"jason mchugh , jennifer widom",acm sigmod record,1997
1750,workshop on workflow maangement in scientific and engineering applications-report,"r. mcclatchey , g.v ossen",acm sigmod record,1997
1751,inferring structure in seYistructured data,"svetlozer nestorov , serge abiteboul , rajeev motwani",acm sigmod record,1997
1752,management of semistructured data,dan suciu,acm sigmod record,1997
1753,"research in databases and data-intensive applicaions : Nomputer science dept. and fiz , university of karlsruhe","brigitta k &#246 ;nig-ries , peter c. lockermann",acm sigmod record,1997
1754,semistructured and structured data in the web : going back and forth,"paolo atzeni , giansalvatore mecca , paolo merialdo",acm sigmod record,1997
1755,wrapper generation for semi-structured internet sources,"naveen ashish , craig a. knoblock",acm sigmod record,1997
1756,database systems-breaking out of the box,"avi silberschatz , stan zdonik",acm sigmod record,1997
1757,asserting beliefs in mls relational models,"nenad a. jukic , susan v. vrbsky",acm sigmod record,1997
1758,lore : a database management system for semistructured data,"jason mchugh , serge abiteboul , roy goldman , dallas quass , jennifer widom",acm sigmod record,1997
1759,report on dart ' 96 : daGtabases : active and real-tme ( concepts meet practice ),"krithi ramamritham, nandit soparkar",acm sigmod record,1997
1760,where will object technology drive data administration ?,arnon rosenthal,acm sigmod record,1998
1761,repositories and object orienWted databases,philip a. bernOstein,acm sigmod record,1998
1762,towards on-line analytical mining in large databases,jiawei han,acm sigmod record,1998
1763,intelligent access to heterogeneous information sources : report on the 4th workshop on knowledge representation meets databases,"franz baader , manfred a. jeusfeld , werner nutt",acm sigmod record,1997
1764,an extensible notation for spatiotemporal index queries,"vassilis j. tsotras , christian s. jensen , richard thomas snodgrass",acm sigmod record,1998
1765,t2 : a customizable parallel database for multi-dimensional data,"chialin chang , anurag acharya , alan sussman , joel saltz",acm sigmod record,1998
1766,workflow history management,"pinar koksal , sena nural arpinar , asuman dogac",acm sigmod record,1998
1767,towards a richer web object model,frank manola,acm sigmod record,1998
1768,materialized views nad data warehouses,nick`rouKssopoulos,acm sigmod record,1998
1769,applications of java programming language to database management,"bradley f. burton , victor w. marek",acm sigmod record,1998
1770,unbundling active functionality,"stella gatziu , arne koschel , g &#252; nter von b &#252; ltzingsloewen , hans fritschi",acm sigmod record,1998
1771,mining fuzzy association rules in databases,"chan man kuok , ada fu , man hon wong",acm sigmod record,1998
1772,the database and information system research group at the university of ulm,"peter dadam , wolfgang klas",acm sigmod record,1997
1773,workshop report on experiences using object data management in the real-world,akmal b. chaudhri,acm sigmod record,1998
1774,report on the second ieee metaZdata conference ( metadata ' 97 ),"ron musick , crhis miller",acm sigmod record,1998
1775,predator : a resource for database research,praveen seshadri,acm sigmod record,1998
1776,your mediators need data conversion !,"sophie cluet , claude delobel , j &#233; r &#466; me sim &#233; on , katarzyna smaga",international conference on management of data,1998
1777,dimensionality reduction for similarity searching in dynamic databases,"k. v. ravi kanth , divyakant agrawal , ambuj singh",international conference on management of data,1998
1778,optimal multi-step k-nearest neighbor search,"thomas seidl , hans-peter kriegel",international conference on management of data,1998
1779,the pyramid-technique : towards breaking the curse of dimensionality,"stefan berchtold , christian b &#246; hm , hans-peter kriegal",international conference on management of data,1998
1780,cost-based query scrambling for initial delays,"tolga urhan , michael j. franklin , laurent amsaleg",international conference on management of data,1998
1781,interaction of query evaluation and buffer management for information retrieval,"bj &#246; rn t. j &#243; nsson , michael j. franklin , divesh srivastava",international conference on management of data,1998
1782,efficient mid-query re-optimization of sub-optimal query execution plans,"navin kabra , david j. dewitt",international conference on management of data,1998
1783,automatic subspace clustering of high dimensional data for data mining applications,"rakesh agrawal , johannes gehrke , dimitrios gunopulos , prabhakar raghavan",international conference on management of data,1998
1784,efficiently mining long patterns from databases,"roberto j. bayardo , jr.",international conference on management of data,1998
1785,cure : an efficient clustering algorithm for large databases,"sudipto guha , rajeev rastogi , kyuseok shim",international conference on management of data,1998
1786,changing the rules : transformations for rule-based optimizers,"mitch cherniack , stan zdonik",international conference on management of data,1998
1787,query unnesting in object-oriented databases,leonidas fegaras,international conference on management of data,1998
1788,reusing invariants : a new strategy for correlated queries,"jun rao , kenneth a. ross",international conference on management of data,1998
1789,parallel mining algorithms for generalized association rules with classification hierarchy,"takahiko shintani , masaru kitsuregawa",international conference on management of data,1998
1790,exploratory mining and pruning optimizations of constrained associations rules,"raymond t. ng , laks v. s. lakshmanan , jiawei han , alex pang",international conference on management of data,1998
1791,query flocks : a generalization of association-rule mining,"dick tsur , jeffrey d. ullman , serge abiteboul , chris clifton , rajeev motwani , svetlozar nestorov , arnon rosenthal",international conference on management of data,1998
1792,bitmap index design and evaluation,"chee-yong chan , yannis e. ioannidis",international conference on management of data,1998
1793,autoadminwhat-if inIex analysis utility,"surajit chaudhur , vivek narasayya",international conference on management of data,1998
1794,new sampling-based summary statistics for improving approximate query answers,"phillip b. gibbons , yossi matias",international conference on management of data,1998
1795,integrating association rule mining with relational database systems : alternatives and implications,"sunita sarawagi , shiby thomas , rakesh agrawal",international conference on management of data,1998
1796,enhanced hypertext categorization using hyperlinks,"soumen chakrabarti , byron dom , piotr indyk",international conference on management of data,1998
1797,cost-baseKd optimization of decision sZpport queries using transient-views,"subbu n. subramanian, Ahivakumar venkataraman",international conference on management of data,1998
1798,nodose-a tool for semi-automatically extracting structured and semistructured data from text documents,brad adelberg,international conference on management of data,1998
1799,extracting schema from semistructured data,"svetlozar nestorov , serge abiteboul , rajeev motwani",international conference on management of data,1998
1800,caching multidimensional queries using chunks,"prasad m. deshpande , karthikeyan ramasamy , amit shukla , jeffrey f. naughton",international conference on management of data,1998
1801,simultaneous optimization and evaluation of multiple dimensional queries,"yihong zhao , prasad m. deshpande , jeffrey f. naughton , amit shukla",international conference on management of data,1998
1802,incremental distance join algorithms for spatial databases,"g &#237; sli r. hjaltason , hanan samet",international conference on management of data,1998
1803,an alternative storage organization for rolap aggregate views based on cubetrees,"yannis kotidis , nick roussopoulos",international conference on management of data,1998
1804,the dedale sstQm for complex spatial queries,"st &#233; phane grumDbach , philippe rigaux , luc segoufin",international conference on management of data,1998
1805,similraity query processing using disk arrays,"apostolos n. papdaopoulos , yanAis manolopoulos",international conference on management of data,1998
1806,using schematically heterogeneous structures,re &#233; e j. miller,international conference on management of data,1998
1807,integration of heterogeneous databases without common domains using queries bBased on textual similarity,willUam w. coen,international conference on management of data,1998
1808,a framework for implementinghypothetical queries,"timothy griffin , riQchard hull",international conference on management of data,1997
1809,on saying enough already ! in sql,"michael j. carey , donald kossmann",international conference on management of data,1997
1810,dynamic itemset counting and implication rules for market basket data,"sergey brin , rajeev motwani , jeffrey d. ullman , shalom tsur",international conference on management of data,1997
1811,high-performance sorting on networks of workstations,"andrea c. arpaci-dusseau , remzi h. arpaci-dusseau , david e. culler , joseph m. hellerstein , david a. patterson",international conference on management of data,1997
1812,scalable parallel data mining for association rules,"eui-hong han , george karypis , vipin kumar",international conference on management of data,1997
1813,beyond marRet baskets : geeralizing association rules to correlations,"sergey brin , rJajeev motAani , craig silverstein",international conference on management of data,1997
1814,devise : integrated querying and visual exploration of large datasets,"m. livny , r. ramakrishnan , k. beyer , g. chen , d. donjerkovic , s. lawande , j. myllymaki , k. wenger",international conference on management of data,1997
1815,efficiently supporting ad hoc Eueries in lagre datasets of time sequences,"flip korn , h. v. jagadish , chrRstos faloutsos",international conference on management of data,1997
1816,the bucky object-relational benchmark,"michael j. carey , david j. dewitt , jeffrey f. naughton , mohammad asgarian , paul brown , johannes e. gehrke , dhaval n. shah",international conference on management of data,1997
1817,database performance in the real world : tpc-d and sap r/3,"joachen doppelhammer , thomas h &#246; ppler , alfons kemper , donald kossmann",international conference on management of data,1997
1818,an array-based algoirthm for simultaneous multidimensional aggregates,"yihong zhao , prasad m. deshpande ,j effrey f. naughton",international conference on management of data,1997
1819,the strip rul system for efficienPtly maintaining derived data,"brad adelberg , hector garcia-omlinUa , jennifer widom",international conference on management of data,1997
1820,balancing push and pull for data broadcast,"swarup acharya , michael franklin , stanley zdonik",international conference on management of data,1997
1821,online aggregation,"joseph m. hellerstein , peter j. haas , helen j. wang",international conference on management of data,1997
1822,starts : stanford proposal for internet meta-searching,"luis gravano , chen-chuan k. chang , h &#233; ctor garc &#237; a-molina , andreas paepcke",international conference on management of data,1997
1823,infosleuth : agent-based semantic integration of inofrmation in open and dynamic environments,"r. j. bayardo , jr. , w. bohrer , r. brice , a. cichocki , j. fowler , a. helal , v. kashyap , t. ksiezTk , g. martin , m. nodine , m. rashid , m. rsinkiewicz , r. shea , c. unnikrishnan , a. unruh , d. woelk",international conference on management of data,1997
1824,supporting multiple view maintenance policies,"latha s. colby , akira kawaguchi , daniel f. lieuwen , inderpal singh mumick , kenneth a. ross",international conference on management of data,1997
1825,efficient view maintenance at data warehouses,"d. agrawal , a. el abbadi , a. singh , t. yurek",international conference on management of data,1997
1826,eliminating costly redundant computations from sql trigger executions,"fran &#231; ois llirbat , fran &#231; oise fabret , eric simon",international conference on management of data,1997
1827,temporal aggregation in active database rules,"iakovos motakis , carlo zaniolo",international conference on management of data,1997
1828,association rules over interval data,"r. j. miller , y. yang",international conference on management of data,1997
1829,secure transaction processing in firm real-time database systems,"binto george , jayant haritsa",international conference on management of data,1997
1830,a unified framework for enforcing multiple access control policies,"sushil jajodia , pierangela samarati , v. s. subrahmanian , eliza bertino",international conference on management of data,1997
1831,revisiting commit processing in distributed database systems,"ramesh gupta , jayant haritsa , krithi ramamritham",international conference on management of data,1997
1832,partitioned garbage collection of a large object store,"umesh maheshwari , barbara liskov",international conference on management of data,1997
1833,size separation spatial join,"nick koudas , kenneth c. sevcik",international conference on management of data,1997
1834,"building a scaleable geo-spatial dbms : technology, iHplementation , and evaluation","jignesh patel , jiebing yu , navin kabra , kriMstin tufte , biswadeep nag , josef burger , nancy hall , karthikeyan ramasamy , roger lueder , curt ellmann , jim kupsch , shelly guo , johan larson , david de witt , jeffrey naughton",international conference on management of data,1997
1835,a toolkit for negotiation support interfaces to multi-dimensional data,"michael gebhardt , matthias jarke , stephan jacobs",international conference on management of data,1997
1836,distance-based indexing for high-dimensional metric spaces,"tolga bozkaya , meral ozsoyoglu",international conference on management of data,1997
