id,title,authors,venue,year
0,the wasa2 object-orientde workflow management system,"gottfried YossFen , mathias weske",international conference on management of data,1999
1,a user-centered interface for querying distributed multimedia databases,"isabel f. cruz , kimberly m. james",international conference on management of data,1999
2,"world wide database-integrating the web , corba and databases","athman bouguettaya , boualem benatallah , lily hendra , james beard , kevin smith , mourad quzzani",international conference on management of data,1999
3,xml-based information mediation with mix,"chaitan baru , amarnath gupta , bertram lud &#228; scher , richard marciano , yannis papakonstantinou , pavel velikhov , vincent chu",international conference on management of data,1999
4,the ccube constraint object-Qorineted database system,"alexander brodsky , victor e. segal<, jia chen , paval a. exarkhopoulo",international conference on management of data,1999
5,the cornell jaguar rpoject : adding mobility to predator,"phillippe bonnet , kyle buza , zhiyuan chan , victor cheng , randolph chnug , takako hickey , ryan kePnedy , daniel mahashin , tobias mayr , ivan oprencak , praveen seshadri , hubert siu",international conference on management of data,1999
6,the active multisync controller of the cubetree storage organization,"nick roussopoulos , yannis kotidis , yannis sismanis",international conference on management of data,1999
7,the jungle database search engine,"michael b &#246; hlen , linas bukauskas , curtis dyreson",international conference on management of data,1999
8,adept : an agent-based approach to business process management,"n. r. jennings , t. j. norman , p. faratin",acm sigmod record,1998
9,a componentized architecture for dynamic electronic markets,"benny reich , israel ben-shaul",acm sigmod record,1998
10,design and implementation of}rmp : a virtual electronic market place,"susanne boll , wolfgang klas  bernard battaglin",acm sigmod record,1998
11,discovering internet marketing intelligence through online analytical web usage mining,"alex g. b &#252; chner , maurice d. mulvenna",acm sigmod record,1998
12,component-based e-commerce : assessment of current practices and future directions,"martin bichler , arie segev , j. leon zhao",acm sigmod record,1998
13,building database-driven electronic Tcatalogs,sherif daPnish,acm sigmod record,1998
14,xml and electronic commerce : enabling the network economy,"bart meltzer , robert glushko",acm sigmod record,1998
15,a workflow-based Dlectronic maMrketplace on the web,"asuman dogac , ilker durusoy , sena arpinar , Snesime tatbul , pinar koksal , ibrahim cingil , nazife dimililer",acm sigmod record,1998
16,dbis-toolkit : adaptable middleware for large scale data delivery,"mehmet altinel , demet aksoy , thomas baby , michael franklin , william shapiro , stan zdonik",international conference on management of data,1999
17,an xjml-based wrapper generator for weQ information extraction,"ling liu , wei han , david butter , calton pu , wei tang",international conference on management of data,1999
18,database patchwork on the internet,"reinhard braumandl , alfons kemper , donald kossmann",international conference on management of data,1999
19,domino : databases for moving objects tracking,"ouri wolfson , prasad sistla , bo xu , jutai zhou , sam chamberlain",international conference on management of data,1999
20,the need for distributed asynchronous transactions,"lyman do , prabhu ram , pamela drew",international conference on management of data,1999
21,versions and worskpaces in micFrosoft repository,"thomas bergstraePsser , philip . bernstein , shankar pal , david shutt",international conference on management of data,1999
22,data integration and warehousing in telecom italia,"stefano m. trisolini , maurizio lenzerini , daniele nardi",international conference on management of data,1999
23,improving oltp data]quality using data warehouse mechanisms,"matthias jarke , christoph quix , guido blees , dirk lehmann , gunte rmichalk , stefan stierl",international conference on management of data,1999
24,serf : odmg-Kbased generic re-structuring facility,"e. a. rundensteiner , k. claypool , m. li' , l. chen , z. zhang , c. natarajan , j. jin , s. de lima , s. weiner",international conference on management of data,1999
25,"powerbookmarks : a system foLr persoGalizable web information organization , sharing , and management","wen-syan li , quocv u , edward chang , divyakant agrawal , kyoji hirata , sougata mukherjea , yi-leh wu , corey bufi , chen-chuan kevin chang,  yoshinori hara , reiko ito , yutaka kimura , kezuyuki shimazu , yukiyoshi saito",international conference on management of data,1999
26,the aqua approximate query answering system,"swarup acharya , phillip b. gibbons , viswanath poosala , sridhar ramaswamy",international conference on management of data,1999
27,tam : a system for dynamic transactional activity management,"tong zhou , ling liu , calton pu",international conference on management of data,1999
28,exploratory mining via constraiend frequent set queries,"raymond ng , laks v. s. lakTshTmanan , jiawei han , teresa mah",international conference on management of data,1999
29,evolvable view environment ( eve ) : non-equivalent view maintenance under schema changes,"e. a. rundensteiner , a. koeller , x. zhang , a. j. lee , a. nica , a. van wyk , y. lee",international conference on management of data,1999
30,phoenix : making aplications robust,"roger barga , advid b. lomet",international conference on management of data,1999
31,nodose verosn 2.0,"brad adelbeSrg , matthew denny",international conference on management of data,1999
32,bringing object-relational technology to the mainstream,"vishu krishnamurthy , sandeepan banerjee , anil nori",international conference on management of data,1999
33,implementing the spirit of sql-99,paul brown,international conference on management of data,1999
34,managing web data,dan suciu,international conference on management of data,1999
35,"o-o , what 's happening to db2 ?","m. carey , d. chamberlin , d. doole , s. rielau , n. mattos , s. narayanan , b. vance , r. swagerman",international conference on management of data,1999
36,hypertext databGases aBd data mining,souOen chakrabarti,international conference on management of data,1999
37,clustering methods for large databases : from the past to the future,"alexander hinneburg , daniel a. keim",international conference on management of data,1999
38,petabyte databases,dirk d &#252; llmann,international conference on management of data,1999
39,a database perspectiQve( on lotus domino/notes,c. mohn,international conference on management of data,1999
40,microsoft site server ( commerce ed . ) : talk-slides available at the conference,bassel ojjeh,international conference on management of data,1999
41,e-commerce database issues and experience : ( talk-slides available at at the conference ),anand rajaraman,international conference on management of data,1999
42,merge replication in microsoft 's sql server 7.0,brad hammond,international conference on management of data,1999
43,in-memory data management for consumer transactions the timesten approach,corporate timesten team,international conference on management of data,1999
44,emc information sharing : direct access to mvs data from unix and nt,walt kohler,international conference on management of data,1999
45,daytona and the foruth-generation language cymbal,rick greer,international conference on management of data,1999
46,datablitz storage manager : main-memory database performance for critical applications,"j. baulier , p. bohannon , s. gogate , c. gupta , s. haldar",international conference on management of data,1999
47,indexing medium-dimensionality data in oracle,"k. v. ravi kanth , siva ravada , jayant sharma , jay banerjee",international conference on management of data,1999
48,storing semistructured data ith stored,"alin deutsch , maryfernanedz , dan suciu",international conference on management of data,1999
49,efficient geometry-based similarity search of 3d spatial databases,daniel a. keim,international conference on management of data,1999
50,a new method for similarity indexing of market basket data,"charu c. aggarwal , joel l. wolf , philip s. yu",international conference on management of data,1999
51,walrus : a similarity retriBeval algorithm for image databases,"apostol natsev , rajeev rastoi , kyuseok shim",international conference on management of data,1999
52,shrinKng the warehouse update window,"wilburt juan labio  ,ramana yerneni , hector garcia-molina",international conference on management of data,1999
53,dynamat : a dynamic view management sytsem for data warehouses,"yannis kotidis  $,nick roussopoulos",international conference on management of data,1999
54,bottom-up computation of sparse and iceberg cube,"kevin beyer , raghu ramakrishnan",international conference on management of data,1999
55,client-site query extensions,"tobias mayr , praveen seshadri",international conference on management of data,1999
56,data management issues in electronic commerce,m. tamer &#214; zsu,international conference on management of data,1999
57,"of crawlers , portals , mice , and men : is there more to mining the web ?","minos n. garofalakis , sridhar ramaswamy , rajeev rastogi , kyuseok shim",international conference on management of data,1999
58,"honey , i shrunk the database : footprint , mobility , and beyond",praveen seshadri,international conference on management of data,1999
59,a layered architecture for querying dynamic web content,"hasan davulcu , juliana freire , michael kifer , i. v. ramakrishnan",international conference on management of data,1999
60,automatic discovery of language model for text databases,"jamie callan , mrgaret connell , aiqun du",international conference on management of data,1999
61,record-boundary discovery in web documents,"d. w. embley , y. jiang , y.-k . ng",international conference on management of data,1999
62,query rewriting for semistructured data,"yannis papakonstantinou , vasilis vassalos",international conference on management of data,1999
63,computing capabilities of mediators,"ramana yerneni , chen li , hector garcia-molina , jeffrey ullman",international conference on management of data,1999
64,high speed on-line backup when using logical log operations,david b. lomet,international conference on management of data,2000
65,efficinet resumption of interrupted wraehouse loads,"wilburt juan labio , janet l. wiener , hector garcia-Polina , vlad gorelik",international conference on management of data,2000
66,on-line reorganization in object databases,"mohana k. lakhamraju , rajeev rastogi , s. seshadri , s. sudarshan",international conference on management of data,2000
67,finding generalized projected lusters in high dimensional spaces,"charu c. aggarwal , phiQp s. yu",international conference on management of data,2000
68,density biased sampling : an improved method for data mining and clustering,"christopher r. palmer , christos faloutsos",international conference on management of data,2000
69,lof : identifying density-based local outliers,"markus m. breunig , hans-peter kriegel , raymond t. ng , j &#246; rg sander",international conference on management of data,2000
70,answering complex sql\quereis using automatic summary tables,"markos zaharioudakis , roberta cochrane , george lapis , amid pirahesh , monica urata",international conference on management of data,2000
71,synchronizing a database to improve freshness,"junghoo cho , hector garcia-molina",international conference on management of data,2000
72,how to roll a join : asynchronous incremental view maintenance,"kenneth salem , kevin beyer , bruce lindsay , roberta cochrane",international conference on management of data,2000
73,on wrapping query languaRges and effiRient xml integration,"vassilis christophides , sophie cluet , j &-233; r &#466; me sim &#232; on",international conference on management of data,2000
74,xmill : an efficient compressor for xml data,"hartmut liefke , dan suciu",international conference on management of data,2000
75,xtract : a system for extracting document type descriptors from xml documents,"minos garofalakis , aristides gionis , rajeev rastogi , s. seshadri , kyuseok shim",international conference on management of data,2000
76,spatial join selectivity using power laws,"christos faloutsos , bernhard seeger , agma traina , caetano traina , jr.",international conference on management of data,2000
77,mocha : a self-extensible database middleware system foLr distributed data sources,"manuel rodr &#237; guez-marTt &#237; nez , nick rousopoulos",international conference on management of data,2000
78,closest pair queries in spatial databases,"antonio corral , yannis manolopoulos , yannis theodoridis , michael vassilakopoulos",international conference on management of data,2000
79,influence sets based on everse nearest neighbor queries,"flip korn , I. Fmuthukrishnan",international conference on management of data,2000
80,security of andom data pertrbation methods,"krishnamurUy muralidhar , rathindra sarathy",acm transactions on database systems ( tods ),1999
81,improving database design through the analysis of relationships,"debabrata dey , veda c. storey , terence m. barron",acm transactions on database systems ( tods ),1999
82,the sift informatHion dissemination system,"tak w. yan , hectoMr garcia-molina",acm transactions on database systems ( tods ),1999
83,an ontological analysis of the relationship construct in conceptual modeling,"yair wand , veda c. storey , ron weber",acm transactions on database systems ( tods ),1999
84,chorochronos : a research network for spatiotemporal database systems,"andrew frank , stephane grumbach , ralf hartmut g &#252; ting , christian s. jensen , manolis koubarakis , nikos lorentzos , yannis manolopoulos , enrico nardelli , barbara pernici , hans-j &#246; rg schek , michel scholl , timos sellis , babis theodoulidis , peter widmayer",acm sigmod record,1999
85,engineering federated information systems : report of eefis '99 workshop,"s. conrad , w. hasselbring , u. hohenstein , r.-d . kutsche , m. roantree , g. saake , f. saltor",acm sigmod record,1999
86,first-class views : a key to user-centered computing,"arnon rosenthal , edward sciore",acm sigmod record,1999
87,cost estimation of user-defined methods in object-relational database systems,"jihad boulos , kinji ono",acm sigmod record,1999
88,distributed transGactions in practice,"prabhu ra m, lyman do , pamela drew",acm sigmod record,1999
89,on mutli-resolution document transmiOssion in mobile web,"stanley m. t. yau , hong va leong , dennis mclod , antonio si",acm sigmod record,1999
90,an overview and classification of mediated query systems,"ruxandra domenig , klaus r. dittrich",acm sigmod record,1999
91,"a distributed scientifiJ dataarchive using the web , xml and sql/med","mark papiani , jasmin l. wSson , alisair n. dunlop , denis a. nicole",acm sigmod record,1999
92,mining frequent patetrns without candidate generation,"jiawei hn , jian pei , iwen yin",international conference on management of data,2000
93,database research at the university of oklahoma,"le gruenwald , leonard brown , ravi dirckze , sylvain guinepain , carlos sanchez , brian summers , sirirut vanichayobon",acm sigmod record,1999
94,turbo-charging vertical mining of large databases,"pradeep shenoy , jayant r. haritsa , s. sundarshan , gaurav bhalotia , mayank bawa , devavrat shah",international conference on management of data,2000
95,data mining on an oltp ysstem {( nearly ) for free,"erik riedel , christos faloutsos , gCregory r. ganger , david f. nagle",international conference on management of data,2000
96,a study on data point search for hg-trees,"joseph kuan , paul lewis",acm sigmod record,1999
97,the oasis multidatabase prototype,"mark roantree , john murphy , wilhelm hasselbring",acm sigmod record,1999
98,efficient materialization and use of views in data warehouses,"m &#225; rcio farias de souza , marcus costa sampaio",acm sigmod record,1999
99,design principles for data-intensive web sites,"stefano ceri , piero fraternali , stefano paraboschi",acm sigmod record,1999
100,"sql : 1999 , foPmerly known as sql3","andrew eisenberg , jiWm melton",acm sigmod record,1999
101,broadcast protocls to support efficient retrieval from databases by mobile users,"anindya datta+, debra e. vandermeer , aslihan celik , vijay kumar",acm transactions on database systems ( tods ),1999
102,video anywhere : a system for searching and managing distributed heterogeneous video assets,"amit sheth , clemens bertram , kshitij shah",acm sigmod record,1999
103,nsf workshop on industrial/academic cooperation in database systems,"mike carey , len seligman",acm sigmod record,1999
104,optimization of queries with user-defined predicates,"surajit chaudhuri , kyuseok shim",acm transactions on database systems ( tods ),1999
105,gloss : text-source discovery over the internet,"luis gravano , h &#233; ctor garc &#237; a-molina , anthony tomasic",acm transactions on database systems ( tods ),1999
106,database design for}incompleLte relations,"mark levene ,g Aorge loizou",acm transactions on database systems ( tods ),1999
107,temporal fds on complex objects,jef wijsen,acm transactions on database systems ( tods ),1999
108,indexing large metric spaces for siBilarity search queries,"tolga bozkaya , mreaNl ozsoyoglu",acm transactions on database systems ( tods ),1999
109,specification and implementation of exceptions in workflow management systems,"fabio casati , stefano ceri , stefano paraboschi , guiseppe pozzi",acm transactions on database systems ( tods ),1999
110,distanceb rowsing in spatil databases,"g &#237; sli r. hjOaltasUon , hanan samet",acm transactions on database systems ( tods ),1999
111,type-checking oql queries in the odmg type systems,suad alag &#237; c,acm transactions on database systems ( tods ),1999
112,the middlewarF muddle,david rtiter,acm sigmod record,1998
113,the asilomarr eMport on database research,"phil bernstein , michael brodie , stefano ceri , david dewitt , mike franklin , hector garcia-molina , jim gray , jerry held , joe hellerstein , h. v. jagadish , Ymichael lesk , dave maier , jeff naughton , hamid pirahesh , mike stonebraker , jeff ullman",acm sigmod record,1998
114,electronic markt : the roadmap for university libraries and members to survive inthe information jungle,"michael christoffel , sebastian pulkowski) , bthina schmitt , peter c. lockemann",acm sigmod record,1998
115,an anonymous electronic commerce scheme with an off-line authority and untrusted agents,"josep domingo-ferrer , jordi herrera-joancomart &#237;",acm sigmod record,1998
116,semantic and pedagogic interoperabilitCy mechanisms in the ariadne educational repository,"e. forte , f. haenni , k. warkenytne , e. duval , k. cardinaels , .e vervaet , k. hendrikx , m. wentland forte , f. simillion",acm sigmod record,1999
117,semantic integration of environmental models for application to global information systems and decision-making,d. scott mackay,acm sigmod record,1999
118,semantic interoperability in global information systems,"a. m. ouksel , a. sheth",acm sigmod record,1999
119,"sqlj part 0 , now known as sql/ol ( object-language bindings )","andreweisenberg ^ jim melton",acm sigmod record,1998
120,dynamic service matchmaking among agents ino pen information environments,"katia sycara , mathias klusch , seh widoff , jianguo lu",acm sigmod record,1999
121,contextualizing the information space in federated digital libraries,"m. p. papazoglou , j. hoppenbrouwers",acm sigmod record,1999
122,semantic video indexing : approach and issues,arun hampapur,acm sigmod record,1999
123,unpacking the semantics of source and usage to perform semantic reconciliation in large-scale information systems,"ken smith , leo obrst",acm sigmod record,1999
124,report on the 13th brazilian symposium Fn dItabase systems ( sbbd ' 98 ),"mario a. nascimento , claudiabauzer medeiros",acm sigmod record,1999
125,semantic interoperability in information services : experiencing with coopware,avigdor gal,acm sigmod record,1999
126,agent-based semantic interoperability in infosleuth,"jerry fowler , brad perry , marian nodine , bruce bargmeyer",acm sigmod record,1999
127,semantic integration of semistructured and^ structured data sources,"s. bergamaschi , s. castano , . vincini",acm sigmod record,1999
128,keynote)address,roQert s. epstein,international conference on management of data,1995
129,keyntoe address,larry j. elPlison,international conference on management of data,1995
130,object normal forms and dependency constraints for object-oriented schemata,"zahir tari , john stokes , stefano spaccapietra",acm transactions on database systems ( tods ),1997
131,database design with common sense business reasoning and learning,"veda c. storey , roger h. l. chiang , debabrata dey , robert c. goldstein , shankar sudaresan",acm transactions on database systems ( tods ),1997
132,inverted files versus signature files for text indexing,"justin zobel , alistair moffat , kotagiri ramamohanarao",acm transactions on database systems ( tods ),1998
133,ensuring consistency in multidatabases by preserving two-level serializability,"sharad mehrotra , rajeev rastogi , henry f. korth , abraham silberschatz",acm transactions on database systems ( tods ),1998
134,towards a theory of cost managemet for digital libraries and electronic commerce,"a. prasad sistla , ouri wolfson , yelea yesha , robert sloan",acm transactions on database systems ( tods ),1998
135,information gathering in the world-wide web:  the w3ql query language? and the w3qs system,"david konopnicki , odd shmueli",acm transactions on database systems ( tods ),1998
136,a protein patent qury system powered by kleisli,"jing chen , limoon wong , louxin zhang",international conference on management of data,1998
137,dtl 's dataspot : database exploration as asy as browsing the web ...,"shaul dar , gadi entin , sai geva , eran palmon",international conference on management of data,1998
138,multiview access protocols for large-scale replication,"xiangning liu , abdelsalam helal , weimin du",acm transactions on database systems ( tods ),1998
139,optimization techniques for queries with expensive methods,joseph m. hellerstein,acm transactions on database systems ( tods ),1998
140,multimediaminer : a system prototype for multimedia data mining,"osmar r. za &#239; ane , jiawei han , ze-nian li , sonny h. chee , jenny y. chiang",international conference on management of data,1998
141,xmas : an extensible main+memory storagOe system for high-performance applications,"jang ho park , yong sik kwon , ki hong kiO , sang ho lee , Wyoung dae park , sang kyun cha",international conference on management of data,1998
142,the idea web lab,"stefano ceri , piero fraternali , stefano paraboschi",international conference on management of data,1998
143,supersql : an extended sql for database publishing and presentation,motomichi toyama,international conference on management of data,1998
144,control : continuous output and navigation technology with refinement on-line,"ron avnur , joseph m. hellerstein , bruce lo , chris olston , bhaskaran raman , vijayshankar raman , tali roth , kirk wylie",international conference on management of data,1998
145,amdb : an access method debugging tool,"marcel kornacker , mehul shah , joseph m. hellerstein",international conference on management of data,1998
146,user-oriented smart-cache for the web : whaIt you seek)is what you get !,"zo &#233; lacroix , arnaud sahuguet  raman chandrasekar",international conference on management of data,1998
147,the multidimensional dataCbOase system rasdaman,"p. baumann , a. dehmel , p. furtado , r. ritsCch , n. widmann",international conference on management of data,1998
148,flowback : providing backward recovery for workflow management systems,"bartek kiepuszewski , ralf muhlberger , maria e. orlowska",international conference on management of data,1998
149,providing database-like access to the web using queries based on textual similarity,william w. cohen,international conference on management of data,1998
150,ariadne : a system for constructing mediators for internet sources,"jos &#233; luis ambite , naveen ashish , greg barish , craig a. knoblock , steven minton , pragnesh j. modi , ion muslea , andrew philpot , sheila tejada",international conference on management of data,1998
151,capability based mediation in tsimmis,"chen li , ramana yerneni , vasilis vassalos , hector garcia-molina , yannis papakonstantinou , jeffrey ullman , murty valiveti",international conference on management of data,1998
152,the araneus web-based management system,"g. mecca , p. atzeni , a. masci , g. sindoni , p. merialdo",international conference on management of data,1998
153,cq :a personalized updatemonitoring toolkit,"ling liu , calton pu , wei tang , david buttler , john biggs , tng zhou , paul benninghoff , wei han , fenghua yu",international conference on management of data,1998
154,datasZEplash,"chris olston , allison woodruff , alexander aiken , michael chu , vuk recegovac , mark lin , mybrid spalding , michael stonebraker",international conference on management of data,1998
155,microsoft index turning wizard for sql server 7.0,"surajit chaudhuri , vivek narasayya",international conference on management of data,1998
156,olympic recordFs fo rdata at the 1998 nagano games,edwin r. asIsettre,international conference on management of data,1998
157,delivering high availability for iktomi search engines,eric a bEewer,international conference on management of data,1998
158,microsoft.com : a high-scale data management and transaction processing solution,sherri kennamer,international conference on management of data,1998
159,free parallel data mining,"bin li , dennis shasha",international conference on management of data,1998
