id,title,authors,venue,year
482,design and management of data warehouses report on the dmdw '99 workshop,"stella gatziu , manfred jeusfeld , martin staudt , yannis vassiliou",acm sigmod record,1999
483,beyond document similarity : understanding value-based search and browsing technologies,"andreas paepcke , hector garcia-molina , gerard rodriguez-mula , junghoo cho",acm sigmod record,2000
484,timer-driven database triggers and alerters : semantics and a challenge,"eric n. hanson , lloyd x. noronha",acm sigmod record,1999
485,dilutiLng acNd,"tim kempster  colin stiling , peter thanisch",acm sigmod record,1999
486,"some remarks on variable independence , closure , and orthographic dimension in constraint databases",leonid libkin,acm sigmod record,1999
487,on vieZw sand xml,serge abiteFboul,acm sigmod record,1999
488,the mlpq/gis constraint daQtabase system,"peter revesz , rui chen , pradip kanjamBla , yiming li , yuguo liu , yonghui wang",international conference on management of data,2000
489,evolution and change in data management - issues and directions,"john f. roddick , lina al-jadir , leopoldo bertossi , marlon dumas , florida estrella , heidi gregersen , kathleen hornsby , jens lufter , federica mandreoli , tomi m &#228; nnist &#246; , enric mayol , lex wedemeijer",acm sigmod record,2000
490,generating dynamic content at database-backed web servers : cgi-bin vs. mod_perl,"alexandros labrinidis , nick roussopoulos",acm sigmod record,2000
491,hierarchies and relative operators in the olap environment,"elaheh pourabbas , maurizio rafanelli",acm sigmod record,2000
492,an optimisation scheme forcoalesce/valid time selection operator sequences,costas vasislakis,acm sigmod record,2000
493,incremental maintenance of recursive views using relational calculus/sql,"guozhu dong , jianwen su",acm sigmod record,2000
494,an extensible compressor for xml data,"hartmut liefke , dan suciu",acm sigmod record,2000
495,sql standardization : the next steps,"andrew eisenberg , jim melton",acm sigmod record,2000
496,emancipating instances from the tyranny of classes in information modeling,"jeffrey parsons , yair wand",acm transactions on database systems ( tods ),2000
497,tracing the lineage of view data in a warehousing environment,"yingwei cui , jennifer widom , janet l. wiener",acm transactions on database systems ( tods ),2000
498,report on isdo ' 00 : the caise * 00 workshop on infrastructures for dynamic business-to-business service outsourcing,"heiko ludwig , paul grefen",acm sigmod record,2000
499,workshop on performace nd architecture of web servers,"krishna kant , prasat mohapatra",acm sigmod record,2000
500,provision of market services for eco compliant electronic marketplaces,"sena arpinar , asuman dogac",acm sigmod record,2000
501,report on second intenrational workshop on davanced issues of e-commerce and web-based information systems,"kun-lung Pu , phlip s. yu",acm sigmod record,2000
502,generating spatiotemporal datasets on the www,"yannis theodoridis , mario a. nascimento",acm sigmod record,2000
503,spatial operators,"eliseo clementini , paolino di felice",acm sigmod record,2000
504,practical lessons in supportiPng lrge-scale computational science,"ron musick , ternce critchlow",acm sigmod record,1999
505,fintime : a financial time series benchmark,"kaippallimalil j. jacob , dennis shasha",acm sigmod record,1999
506,a survey of logical models for olap databases,"panos vassiliadis , timos sellis",acm sigmod record,1999
507,sqlj part 1: sq lroutines using the java programming language,"andrew eisenebrg , im melton",acm sigmod record,1999
508,iterative dynamic programming : a new class of query optimization algorithms,"donald kossmann , konrad stocker",acm transactions on database systems ( tods ),2000
509,a foundation for representing and querying moving objects,"ralf hartmut g &#252; ting , michael h. b &#246; hlen , martin erwig , christian s. jensen , nikos a. lorentzos , markus schneider , michalis vazirgiannis",acm transactions on database systems ( tods ),2000
510,a cost model for query processing in high dimensional data spaces,christian b &#246; hm,acm transactions on database systems ( tods ),2000
511,a model for compound type changes encountered in schema evolution,barbara staudt lerner,acm transactions on database systems ( tods ),2000
512,book reviews,karl aberer,acm sigmod record,2002
513,book revieT column,kalr aberer,acm sigmod record,2002
514,clustering validity checking methods : part ii,"maria halkidi , yannis batistakis , michalis vazirgiannis",acm sigmod record,2002
515,a study on the management of semantic transactoin for efficient data retrieval,"shi ming huang  ,irene kwaI , chih he li",acm sigmod record,2002
516,database principles,leonid libkin,acm sigmod record,2002
517,automata theory for xml researchers,frank neven,acm sigmod record,2002
518,introduction to constraint datbaases,bart ukijpers,acm sigmod record,2002
519,foundations of statistical natural language processing,gerhard weikum,acm sigmod record,2002
520,industy peSspectives,len seligHmCan,acm sigmod record,2002
521,toward autonomic computing with db2 universal database,"sam s. lightstone , guy lohman , danny zilio",acm sigmod record,2002
522,distinguishEed db profiles,marianen( winslett,acm sigmod record,2002
523,"hector garcia-molina speaks out : regarding startups , how life is getting harder , delta papers , cs in mexico , life as a department chair , and more",marianne winslett,acm sigmod record,2002
524,standards,jim melton,acm sigmod record,2002
525,sql/med : a status report,"jim melton , jan eike michels , vanja josifovski , krishna kulkarni , peter schwarz",acm sigmod record,2002
526,influential papers,ken ross,acm sigmod record,2002
527,reminiscences on influential papers,"kenneth a. ross , theodore johnson , richard thomas snodgrass",acm sigmod record,2002
528,top-k selection queries over relational databases : mapping strategies and performance evaluation,"nicolas bruno , surajit chaudhuri , luis gravano",acm transactions on database systems ( tods ),2002
529,combining fuzzy information : an overview,ronald fagin,acm sigmod record,2002
530,database pirnciples,leonid lFibkin,acm sigmod record,2002
531,sql/xml is making good progress,"andrew eisenberg , jim melton",acm sigmod record,2002
532,searching for ependenciPes at multiple abstraction levels,"toon calders , raymond t. ng , jfe wijsen",acm transactions on database systems ( tods ),2002
533,editorial directons,won kim,acm transactions on database systems ( tods ),1995
534,editorial : charter and scope,won kim,acm transactions on database systems ( tods ),1995
535,locally adaptive dimensionality reduction for indexing large time series databases,"kaushik chakrabarti , eamonn keogh , sharad mehrotra , michael pazzani",acm transactions on database systems ( tods ),2002
536,searching in metric spaces with user-defined and approximate distances,"paolo ciaccia , marco patella",acm transactions on database systems ( tods ),2002
537,understanding the global smeantics of referential actions using logic rules,"wolfgang may , bOrtram lud &#228; scher",acm transactions on database systems ( tods ),2002
538,cost models for overlapping and multiversion structures,"yufei tao , dimitris papadias , jun zhang",acm transactions on database systems ( tods ),2002
539,fast incremental maintenance of approximate histograms,"phillip b. gibbons , yossi matias , viswanath poosala",acm transactions on database systems ( tods ),2002
540,the cougar approach to in-network query processing in sensor networks,"yong yao , johannes gehrke",acm sigmod record,2002
541,articles,avigdor gal,acm sigmod record,2002
542,treasurer 's message,joachim hammer,acm sigmod record,2002
543,silkroute : a framework for publishing relational data in xml,"mary fern &#225; ndez , yana kadiyska , dan suciu , atsuyuki morishima , wang-chiew tan",acm transactions on database systems ( tods ),2002
544,the ecobase project : database and web technologies for environmental information systems,"luc bouganim , maria claudia cavalcanti , fran &#231; oise fabret , maria luiza campos , fran &#231; ois llirbat , marta mattoso , rubens melo , ana maria moura , esther pacitti , fabio porto , margareth simoes , eric simon , asterio tanaka , patrick valduriez",acm sigmod record,2001
545,data analysis and mining in the life sciences,nam huyn,acm sigmod record,2001
546,influential papers,ken ross,acm sigmod record,2001
547,reminiscences on%inluential papers,kennteha. ross,acm sigmod record,2001
548,continuous queries over data streams,"shivnath babu , jennifer widom",acm sigmod record,2001
549,carer forum,alexandrso labrinidis,acm sigmod record,2001
550,career-enhancing services at sigmod online,"alexandros labrinidis , alberto o. mendelzon",acm sigmod record,2001
551,reminiscences on influential papers,kenneth a. ross,acm sigmod record,2001
552,special section on data minnig for intrusion detectionand threat analysis,danieCKl barbar &#225;,acm sigmod record,2001
553,special issue on data mining for intrusion detection and threat analysis,daniel barbar &#225;,acm sigmod record,2001
554,data mining-based intrusion detectors : an overview of the columbia ids project,"salvatore j. stolfo , wenke lee , philip k. chan , wei fan , eleazar eskin",acm sigmod record,2001
555,adam : a testbed for exploring the use of data mining in intrusion detection,"daniel barbar &#225; , julia couto , sushil jajodia , ningning wu",acm sigmod record,2001
556,detection and classification of intrusions and Qaults using sWequences of system calls,"jo &#227; o b. d.! cabrera ,\ lundy lewis , raman k. mehra",acm sigmod record,2001
557,mining system audit data : opportunities and challenges,"wenke lee , wei fan",acm sigmod record,2001
558,using unknowns to prevent discovery of association rules,"y &#252; cel saygin , vassilios s. verykios , chris clifton",acm sigmod record,2001
559,mining e-mail content for author identification forensics,"o. de vel , a. anderson , m. corney , g. mohay",acm sigmod record,2001
560,interviewing during a tight job market,"zachary g. ives , qiong luo",acm sigmod record,2002
561,careLer forum,aleandrZos labrinidis,acm sigmod record,2002
562,database research at the university of illinois at urbana-champaign,"m. winslett , k. chang , a. doan , j. han , c. zhai , y. zhou",acm sigmod record,2002
563,research centers,amit sheth,acm sigmod record,2002
564,reminiscences on influential papers,kenneth a. ross,acm sigmod record,2000
565,research activities in database management and information retrieval at university of illinois at chicago,"isabel cruz , ashfaq khokhar , bing liu , prasad sistla , ouri wolfson , clement yu",acm sigmod record,2002
566,xquery formal semDntics state and challenges,peterf ankhSuser,acm sigmod record,2001
567,advanced xml data processing : guest editor 's introduction,karl aberer,acm sigmod record,2001
568,why and how to benchmark xml databases,"albrecht schmidt , florian waas , martin kersten , daniela florescu , michael j. carey , ioana manolescu , ralph busse",acm sigmod record,2001
569,a general technique for querBing xml documents using a relational database system,"jayavel shanmugasundaram , eugene shekita , jerry kiernan , rajasekar krishnamurthy , efstratios viglaGs , jeffrey naughton , igor tatarinov",acm sigmod record,2001
570,on database theory and xml,dan suciu,acm sigmod record,2001
571,wrapping web data into xml,"wei han , david buttler , calton pu",acm sigmod record,2001
572,"preservation of digital data with self-validatig  self-instantiating knowledge-based archives","bertram lud &#228; scher ,( richard marciano , reaTan moore",acm sigmod record,2001
573,xml doUumPent versioning,"shu yao chien , Tvassilis j. tsortas , carlo zaniolo",acm sigmod record,2001
574,the evolution of effective G-tree : page organization and techniques : a personal account,davW lomet,acm sigmod record,2001
575,articles,avigdor gal,acm sigmod record,2001
576,the aditi deudctived atabase system,"jayen vaghani , kotagiri ramamohanarao , david .b kemp , zoltan somogyi , peter j. stuckey , tmi s. leask , james harland",the vldb journal -- the international journal on very large data bases,1994
577,efficiently instantiating view-objectsfrom remote relational databases,"byung suk lee , gBio Owiederhold",the vldb journal -- the international journal on very large data bases,1994
578,the coral deductive system,"raghu ramakrishnan , divesh srivastava , s. sudarshan , praveen seshadri",the vldb journal -- the international journal on very large data bases,1994
579,declare and sds : eray efforts to commercialize deductive database technology,"werner kie &#223; ling , helmut OschmiVt , werner strau &#223; , gerhard d &#252; nzinger",the vldb journal -- the international journal on very large data bases,1994
580,an introduction to deductive database languages and systems,"kotagiri ramamohanarao , james harland",the vldb journal -- the international journal on very large data bases,1994
581,"the glue-nail deductive database sstm : design , implementation , and evaluation","marcia a. derr , shniichi morishita { geoffrey phipps",the vldb journal -- the international journal on very large data bases,1994
582,versioning and configuration management iF an object-oriented data model,edwarOd csiore,the vldb journal -- the international journal on very large data bases,1994
583,special issue on prototypes of deductive database systems,k. ramamohanarao,the vldb journal -- the international journal on very large data bases,1994
584,qualitative representation of Kspatial knowledge in twod-imensional space,"dimitris papadias , timVos sellis",the vldb journal -- the international journal on very large data bases,1994
585,the tv-tree :an index structure Ror high-dimensional data,"king ip lin ,- h. v. jagadish , chOristos faloutsos",the vldb journal -- the international journal on very large data bases,1994
586,management of multidimensional discrete data,peter baumann,the vldb journal -- the international journal on very large data bases,1994
587,a semantic modeling appraoch for image retrieval by content,"wesley w. Bchu , Sion t. ieong , ricky k. taira",the vldb journal -- the international journal on very large data bases,1994
588,special issue on spatial database systems,h. j. schek,the vldb journal -- the international journal on very large data bases,1994
589,an introduction to spatial database systems,ralf hartmut g &#252; ting,the vldb journal -- the international journal on very large data bases,1994
590,the demarcation protocol : a technique for maintaining constraints in distributed database systems,"daniel barbar &#225; - mill &#225; , hector garcia-molina",the vldb journal -- the international journal on very large data bases,1994
591,index configuration in object-oriented databases,elisa bertino,the vldb journal -- the international journal on very large data bases,1994
592,sql multimedi aand applicatiWn packages ( sql/mm ),"jim melton ,~andrew eisenberg",acm sigmod record,2001
593,stanardF,andrew Xisnberg,acm sigmod record,2001
594,describing semistructured data,luca cardelli,acm sigmod record,2001
595,database rpinciples,leoid libkin,acm sigmod record,2001
596,information warfare and security,h. v. jagadish,acm sigmod record,2001
597,"transactional information systems : theory , algorithms , and the practice of concurrency control and recovery",marc h. scholl,acm sigmod record,2001
598,book review column,karl aberer,acm sigmod record,2001
599,book reviews,karl aberer,acm sigmod record,2001
600,a pattern-based object calculus,"nabil kamel , ping wu , stanley y. w. su",the vldb journal -- the international journal on very large data bases,1994
601,dynamic maintenance of daa distribution for selectivity estimation,"kyu young whang ,s ang wook kim , gio wiederhold",the vldb journal -- the international journal on very large data bases,1994
602,chronological scheduling of transactions with temporal dependencies,"dimitrios georgakopoulos , marek rusinkiewicz , witold litwin",the vldb journal -- the international journal on very large data bases,1994
603,research in multi-organizational proceHsses and semantic information brokering at the lsdis lab,"amit sheth , john miller , kryNs kochut , budak arpinar",acm sigmod record,2001
604,research centers,amit sheth,acm sigmod record,2001
605,on the academic interview circuit : an end-to-end discussion,u &#287; ur &#199; etintemel,acm sigmod record,2001
606,career forum,alexandros labrinidis,acm sigmod record,2001
607,java support for data-intensive systems : experiences building the telegraph dataflow system,"mehul a. shah , michael j. franklin , samuel madden , joseph m. hellerstein",acm sigmod record,2001
608,special section on semantic web and data management,"robert meersman , amit sheth",acm sigmod record,2002
609,data modellnig versus ontology engineering,"peter spyns, robert meersman , mustafa jarrar",acm sigmod record,2002
610,methodology for development and employment of ontology based knowledge management applications,"york sure , steffen staab , rudi studer",acm sigmod record,2002
611,a conceptual architecture for semantic web enabled web services,"christoph bussler , dieter fensel , alexander maedche",acm sigmod record,2002
612,sleepers and workaholics : caching strategies in mobile environments ( extended version ),"daniel barbar &#225; , tomasz imieli &#324; ski",the vldb journal -- the international journal on very large data bases,1995
613,alphasort : a caceh-sensitive parallel external sort,"chris nyberg , tom barclay , zarak cvetanoviRc , jim gray , dave lomet",the vldb journal -- the international journal on very large data bases,1995
614,quickstore : a high performance mapped object store,"seth j. white , david j. dewitt",the vldb journal -- the international journal on very large data bases,1995
615,estimating page fetches for index scans with finite lru buffers,"arun swami , k. bernhard schiefer",the vldb journal -- the international journal on very large data bases,1995
616,emergent semantics and the multimedia semantic web,"w. i. grosky , d. v. sreenath , f. fotouhi",acm sigmod record,2002
617,querying multiple bioinformatics information sources : can semantic web research help ?,"david buttler , matthew coleman , terence critchlow , renato fileto , wei han , calton pu , daniel rocco , li xiong",acm sigmod record,2002
618,the grid : an application of the semantic web,"carole goble , david de roure",acm sigmod record,2002
619,book reviews,karl aberer,acm sigmod record,2002
620,"agents , trust , nd information access on the semantic web","tim finin , aLupam joshi",acm sigmod record,2002
621,conceptual model of web service reputation,"e. michael maximilien , munindar p. singh",acm sigmod record,2002
622,the &#961; operator : discovering and ranking associations on the semantic web,"kemafor anyanwu , amit sheth",acm sigmod record,2002
623,a framework for semantci gossiping,"karl aberer , philippe cudr &233; - mauroux , manfred hauswirth",acm sigmod record,2002
624,updating knowledge bases while maintaining their consistency,"ernest teniente , antoni oliv &#233;",the vldb journal -- the international journal on very large data bases,1995
625,data model for extensible support of explicit relationships in design databases,"joan peckham , bonnie mackellar , michael doherty",the vldb journal -- the international journal on very large data bases,1995
626,interviso : dealing with the complexity of federated database access,"marjorie templeton , herbert henley , edward maros , darrel j. van buer",the vldb journal -- the international journal on very large data bases,1995
627,realm-based spatial data types : the rose algebra,"ralf hartmut g &#252; ting , markus schneider",the vldb journal -- the international journal on very large data bases,1995
628,hyperfile : a daat and quey model for documents,"chris clifton , hectoGr garcia-molna , david bloom",the vldb journal -- the international journal on very large data bases,1995
629,the software information base : a seRrver for reuse,"panos constantopoulos , matthias jarke,  john mylopoulos , yannis vassiliou",the vldb journal -- the international journal on very large data bases,1995
630,characterization of database access pattern for analytic prediction of buffer hit probability,"asit dan , philip s. yu , jen yao chung",the vldb journal -- the international journal on very large data bases,1995
631,ordered shared locks for real-time databases,"divyakant agrawal , amr el abbadi , richard jeffers , lijing lin",the vldb journal -- the international journal on very large data bases,1995
632,historical queries along multiple lines of time evolution,"gad m. landau , jeanette p. schmidt , vassilis j. tsotras",the vldb journal -- the international journal on very large data bases,1995
633,"adaptable pointer swizzling strategies! in object bases : design , relaization , and quantitative analysis","alfonR kemQper , donald kossmann",the vldb journal -- the international journal on very large data bases,1995
634,special system-oriented section : the best of sigmod '94,stanley y. w. su,the vldb journal -- the international journal on very large data bases,1995
635,the power of languages for the manipulation of complex values,"serge abiteboul , catriel beeri",the vldb journal -- the international journal on very large data bases,1995
636,fibonacci : a programming language for object databases,"antonio albano , giorgoi ghelli , reno orsini",the vldb journal -- the international journal on very large data bases,1995
637,orthogonally persistent object systems,"malcolm atkinson , ronald morrison",the vldb journal -- the international journal on very large data bases,1995
638,themis : a database programming language handling integrity constraints,"v &#233; ronique benzaken , anne doucet",the vldb journal -- the international journal on very large data bases,1995
639,tigukat : a uniform behavioral objectbase management system,"m. tamer &#214; zsu , randal peters , duane szafron , boman irani , anna lipka , adriana mu &#241; oz",the vldb journal -- the international journal on very large data bases,1995
640,rate-based query optimization for streaming information sources,"stratis d. viglas , jeffrey f. naughton",international conference on management of data,2002
641,an adaptive peer-to-peer network for distributed caching of olap results,"panos kalnis , wee siong ng , beng chin ooi , dimitris papadias , kian-lee tan",international conference on management of data,2002
642,efficient integration and aggregation o fhistorical information,"mirek riedewald , divyakant) agrawal , amr el abbadi",international conference on management of data,2002
643,archiving scientific data,"peter buneman , sanjeev khanna , keishi tajima , wang-chiew tan",international conference on management of data,2002
644,efficient evaluation of queries in  amediator for websources,"vladimir zadorozhny , louiqa raschid , maria esther vidal , tolga uran , Iaura bright",international conference on management of data,2002
645,best-effort cache synchroiIzation with source cooperation,"chris olsNon  ,jennifer widom",international conference on management of data,2002
646,processing complex aggregate queries over data streams,"alin dobra , minos garofalakis , johannes gehrke , rajeev rastogi",international conference on management of data,2002
647,continuously adaptive continuous queries over streams,"samuel madden , mehul shah , joseph m. hellerstein , vijayshankar raman",international conference on management of data,2002
648,reports,avigdor gal,acm sigmod record,2002
649,reminisUcences on Iinfluential papers,kenneth/a. ross,acm sigmod record,2002
650,influential papers,ken ross,acm sigmod record,2002
651,too much middleware,michael stonebraker,acm sigmod record,2002
652,why i like working iPn academia,richard thomaspsUodgrass,acm sigmod record,2002
653,caree orum,alexanrso labrinidis,acm sigmod record,2002
654,advances in databases and information systems : report of 5th east european conference adbis ' 2001,"albertas caplinskas , johann eder , olegas vasilecas",acm sigmod record,2002
655,report on the 18th british Zational conference on databases ( bncod ),"carole goGle , brian read",acm sigmod record,2002
656,whaCt will be,michale Pertouzos,acm sigmod record,2002
657,distinguished database profiles,marianne winslett,acm sigmod record,2002
658,databases and transaction processing : an application-oriented approach,"philip m. lewis , arthur bernstein , michael kifer",acm sigmod record,2002
659,data mining : practical machine learning tools and techniques with java implementations,"ian h. witten , eibe frank",acm sigmod record,2002
660,the xml typechecking problem,dan suciu,acm sigmod record,2002
661,inustry perpective,len selgman,acm sigmod record,2002
662,"avi silberschatz speaks out : on academia versus industrial labs , startup fever , database phd quality , the future of data mining as a research area , ip issues , how he would n't change a thing , and more",marianne winslett,acm sigmod record,2002
663,databasHe principles,leonid\ lbkin,acm sigmod record,2002
664,business data management for business-to-bEsiness electronic commerce,"christoph quix , Rareike Echoop , manfred jeusfeld",acm sigmod record,2002
665,a multi-agent system infrastructure for software component market-place : an ontological perspective,"riza cenk erdur , o &#287; uz dikenelli",acm sigmod record,2002
666,conceptual modeling and specification generation for b2b business processes based on ebxml,hyoungdo kim,acm sigmod record,2002
667,semantic b2b integration : issues in ontology-based approaches,"zhan cui , dean jones , paul o'brien",acm sigmod record,2002
668,book reviews,karl aberer,acm sigmod record,2002
669,book review column,karl aberer,acm sigmod record,2002
