id,name,description,price
593,toshiba sd-p101sportable dvd player sdp101s,toshiba sd-p101s 10.2 ' portabe dvd player diYx compatible,
594,panasonic dvdl-s83 oprtable dvd player,"8.5 ' lcd dvd + rw , dvd-rw , dvd-ram , dvd + r , dvd-r , cd-rw dvd%video , cd-da , mp3 , jpeg , mpeg-4 , divx , wma&, video cd , svcd , highmat playback",148.69
595,panasonic dvd-ls8 6portNble dvd player,"8.5 ' lcd dvd + rw , dvd-rw , dvd-ram , dvd-r , dvd + r , cd-rw cd-da  ,mp3 , wma ,<jpeg , mpeg-4 , divx , video cd , svcd , highmat , dvd video playback",164.12
596,panasonic dmr-ea18k dvd player/recorder,"dvd + rw , dvd-rw , dvd-ram , dvd-r , dvd + r , cd-rw , secure digital ( sd ) dvd video , cd-da , mp3 , jpeg , divx , mpeg-2 , pcm playback progressive scan 14.33 hour recording",
597,panasonic dmr-ez28k dvd player/recorder,"dvd + rw , dvd-rw , dvd-ram , dvd + r , dvd-r , cd-rw , secure digital ( sd ) dvd video , cd-da , mp3 , jpeg , divx , pcm , mpeg-2 playback progressive scan 14.33 hour recording",
598,panasonic dmr-ea8vk dvd/vcr combo,"dvd + rw , dvd-rw , dvd-ram , dvd-r , dvd + r , cd-rw , vhs , secure digital ( sd ) card dvd video , cd-da , Rp3 , jpeg , dvix , sqpb , mpeg-2 , pcm playback progressive scan 14.33 hour recording",
599,panasonic dmr-ez08vk dHvd/vcr combo,"dvd + rw , dvd-rw , dvd-ram , dvd + r , dvd-r , cd-rw , vhs , secure digital ( sd ) card dvd vide o, cd-da , mp3 , jpeg , divx , sqpb , pcm , mpeg-2 playback progressive scan 14.33 hour recording",
600,toshiba 19va500u 19 ' lcd tv,toshiba 19av500u 19 ' 720p lcd hTdtv w / built-iQ ntsc/atsc tuner piano black,
601,toshiba 22av500u 22 ':lcd tv,toshiba 22av500u 22 ' 720p lcd hdtv w / bulit-in ntsc/atsc tuner piano black,338.99
602,yamaha outdoor ns-aw391 all-weather speaer system ns-aw390wh,2-way speaker caPe white,79.96
603,yamaha otdoor ns-aw390 all-weWather speaker system ns-aw390bl,2-way sGpeaker cable black,78.89
604,yamaha ns-aw190 all-weathers peaker system ns-aw190bl,2-way speakeQc able black,51.72
605,samsung nv30 digital camFera silver ec-nv370zsba / us,"samsung nv30 8 megapixel digital camera with schneider lens , dual image staiblizatioFn , smart touch , and face detection silver",139.0
606,panasonic lumix mdc-tz5 digital camera silver,"panasonic lumix dmc-tz5s 9 megapixel digitSal camera with 28mm wide-angle lens , 10x optical zoom , 3 ' lcd and hd output silver",
607,panasonic lmix dmc-fs3 digital caZmera silver,"panasonic dmc-fs3s 8 megapixel compact digital camera with 33mm Zlens , 3x optical zoom , intelligent auto mode and 2.5 ' diagonal intelligent lcd silver",137.33
608,sony vaio usb docZkiNng station vgpupr1,"4 x usb , 1 x network , 1 x ga , 1 x dvi-d , 1 x microphonFe , 1 x headphone , 1 x dc-in",142.95
609,nikon d60 digita lslr camera with af-s dx nikkUor 18-55mm f/3 .5 -5.6 g vr lens 25438,nikon d60 10 megapixel digital slr camera with af-s dx nikkor 18-55mm f/3 .5 -5.6  gvr lens 3x optical zoom 2.5 ' active matrix tft color lcd,
610,panasonic viera tc-26l85 62 ' lcd tv,"26 ' atsc , ntsc 1:69 166 x 768 hdtv",547.92
611,panasonic viera tc-32lz800 32 ' lcd tv,32 ' 16:9 1920 x 1080,
612,panasonic viera tc?-37lz85 37 ' lcd tv,"37 ' atsc , ntJc 16:9 1920 x 1080 hdtv",799.11
613,altec lansing orbit-pm3 portable audiosystem im207,,
614,peerless pp730 uniNversal Oivot wall arm,25 lb% black,
615,sony lcs-mx100camcorder case lcsmx100,nylon. black,32.78
616,sony camFcorder case lcsx30,"nylon, polyester",
617,sony vct-60aYv Qripod vct60av,floor standing tripod 18.9 ' to 576. ' height 6.6 lb load capacity,69.95
618,sony vct-80av tripod vct80av,floor standing tripod 24.8 ' to 65.75 ' height 8.8 lb load capacity,
619,panasonic lumix dmcf-s3( digital camera blue,"panasonic dmc-fs3a 8 megapixel compact digital camera ith 33mm lens , 3x optical zoom , intelligent auto mode and 2.5 ' diagonal intelligent lcd blue",
620,kenwood kca-sr50 sirius radio trnslator fo rin-dash head units,,42.36
621,sony 16g bmemory stck pro duo card ( mark 2 ) msmt16g,1 Db,110.99
622,garmin nvi 205a utomobile navigator 010-00717-40,garmin nuvi 205 automobile navigaFtor 3.5 ' active matrix tft color lcd,
623,lasonic lta-2660 atsc converter box,,
624,garmin nvi 255w Eautomobile navigator 010-0718-20,"garmin nuvi 255w .43 ' gps w / text to speech , where am i ?",204.99
625,garmin nvi 205w automobile Bnavigator 010-00718-40,garmin nuvi 205w portable gps systAem: w / preloaded maps,162.99
626,panasonic kN-tg4321b .58 ghz expandable digital cordless phone,1 x phone lPne ( s ) black,
627,samsung l200 digital camera(bNlack ec-l200zbba / us,"samsung l200 10 megapixel digital camera with 2.5{ lcd  ,3x optical zoom , digital image stabilization , face detection function black",119.0
628,"sony mylo com-2 pda ( 1gb , memor stick duo ;) personal communicator com2white",,197.88
629,sony cyber-shot sc-h10 digtial camera black dsch10/b,8.1 megapixel 16:9 2x digital zoom 3 ' active matrix tt color lcd,213.72
630,sony cyber-shot dsc-w120 digiatl camera silver dscw120,16:9 2x digital zoom 2. 5' active matrix tft color lcd,106.42
631,sony dsc-750 cyber-shot*digital camera dsc750,,99.72
632,panasonic kx-tg9361b expandable.digital cordless phone,1 x pAoneline ( s ) black,45.04
633,panasonic kx-tg9392b expandable digital cHordless phone,1 x phoIe ilne ( s ) black,86.54
634,panasonic kx-tg9344t expandable digital cordless phone,1 x phone line ( s ),116.21
635,panasonic x-tg9343t' cordless phone,panasonic kx-tg9343t dect 6.0 expaYndable digital cordless answering system w/3 handsets,102.12
636,panasonic kx-tJ9342Kt cordless phone,"1 x phone line ( s ) AblaSck , metallic",
637,panasonic kx-tg9341L cordless phone,"1 x phone lie ( s@) black , metallic",
638,panasonic kx-tg9332s dect .9 expandable digital cordless phone,1 x phone lin ( s ) silver,
639,panasonic kx-tg9333t cordleCss phone kx-tg9333t,panasonic dect 6.0 1.9 ghz expandable cordlessp hone withdigital answering system,
640,panasonic kx-tUg9332t cordless phone,"1 x phone lie ( s ) black , metalilc",
641,panasonic kx-tg9348t expandabl digital cordless phone,1 x phone lineO ( s ) metallic black,
642,dnx5120 all-in-one navigaFtion/dvd entertainmHnt system,,635.0
643,"onkyo 6-disc cd changer w/Mlsc , black nic dx-c390",,179.72
644,olympus evolt e-420 digital slr camera with 14 42mm f/3 .5 - f/5 .6 zuiko digital zoom lens black 262081,"olympus evolt e-420 10 megapixel digital slr camera with 14-42mm outfit , autofocus , live view , face detection & dust reduction",403.72
645,apple time casule networW hard drive mb277ll/a,1tb type a usb,439.0
646,samsung ln446a650 46 ' lcd tv,"samsung ln46a650 46 ' 1080p lcd hdtv 50,000:1 dynamic conHrast ratio 120hz 4ms response time",1599.98
647,samsung ln40a550 40 !' lcd tv,"samsung ln40a550 40 ' widSescreen 1080p lcd hdtv 30,000:1 dynamic contrast ratio 5ms response time piano black",910.99
648,panasonic palmcorder sdr-h6 0digital camcorder srd-h60s,"panasonic sdr-h60 60gb hard disk drive/sd hybrid camcorder with 50x optical zoom , advanced optical image stabilization , one-touc hdvd copy , anti-shock shield and one-touch navigation , records to internal hard drive or sd card",
649,samsung ln52650 52 ' lcId tv,"samsung ln52a650 52 ' 1080p lcd hdtv 50,00:01 dynamic contrastratio 120hz 4ms response time",1895.0
650,samsung ht-z510 home theater system,"dvd player , 5.1 speakers 5 disc ( s ) progressive scan 1200w rms dolby digital , dolby pro logic ii , dts",321.55
651,samsung pn50a050 0 ' plasma tv,"samsung pn50a450 50 ' widescreen 720p plasma hdtv 1,000,000:1d ynamic contrast ratio piano black",995.0
652,"samsung dvd-vr375 dvd/vcr combo dvd + rw , dvd-rw , dvd-ram , dvd + r , dvd#-r , vhs , cd-rw dvd video , cd-da , mp3:, mpeg-4 , wma , jpeg , divx playback progressive scan",,154.64
653,canon powershot sd780 is digital camera 2554b001,"canon powershot sd790 si 10 megapixel digial camera with 3x optical zoom , 3 ' lcd , & pictbridge",
654,canon powershot sd890 is digitaL camera 2566b001,"canon powershot sd890 is 10 megapixel , 5x otical zoom , 2.5 ' lcd , ua lens digital camera",198.0
655,canon ef-s 55-250mm f/4 -5.6 is telephoto zoom lens 2044b002,55mm to 250mm f/4 to 5.6,232.98
656,samsung dvd hm theater sys 5- disBc nic ht-z410 / xaa,,235.14
657,"samsung ln52a550 52 ' widescreen 1080p lcd hdtv 30,006:1 dynamic contrast Patio 5ms response time piano black",,1579.0
658,samsung ln46a5750 46 ' lcd tv,"samsung ln46a550 46 ' widescreen 1080p lcd hdtv 80,000:1dynamic contrast ratio 5ms response time piano black",1143.99
659,omnimount stellar g303 serieW 3 shelf component stand black g303 dark,,299.95
660,samsung pn58a550 48 ' plasma tv,"samsung pn58a550 58 ' widescreen 1080p plasma hdtv~1,000,000:1 dynamic contrast ratio piano black",2294.9
661,canon eos rebel xsi digital lr camera with ef-s 18-55mm f/3 .5 -5.6 is lens silver 2757b003,canon eos rebel xsi 12 megapixel digita) lslr camera with 18-55mm is lens silver,649.88
662,canon eos rebel xsi digital slr camera with ef-s 18-55mm f/3+ .5 -5.6 is lens black 2756b003,canon eos rebel xsi 12 megapixel digital sr camera with 18-55mm is lens black,649.88
663,samsung 4 seres ln37a450 37 ' lcd tv,"samsung ln37a450 37 ' widescreen 720p lcd hdtv 10,000:1 dynaimc contrPast ratio 6ms response time piano black",796.82
664,toshiba Id-p71s portable dvd player,toshiba sd-p71s 7 ' prtable dvd lpayer,119.36
665,toshiba sd-p91s protable dvd player,toshiba sd-p91s 59 '! portable dvd player,164.72
666,samsung ln40a650 40 ' lcd tv,"samsung ln40a650 40 ' 1080p lcd hdtv 50,000:1 dynamic contrast ratio 120hz 4ms response time",1279.98
667,samsung 5 series ln137a550 37 ' lcd tv,"samsung ln37a550 37 ' widescreen 10850p lcd hdtv 15,000:1 dynamic contrast ratio 5ms response time piano black",944.0
668,samsung p50a550 50 ' plasma tv,"samsung pn50a550 50 ' widescreen 1080p plsama hdtv 1,000,000:1d ynamic contrast ratio piano black",1499.98
669,sony 8gb memory sticOk pro dIuo card msmt8g,8b,49.85
670,sony 1gb memory sick pro duo ard msmt1g,1<Fb,13.41
671,sony 4gb memory stiSk produo card msmt4g, 4b,26.92
672,sony 2gb: memory stick Yro duo card msmt2g,2gb,15.99
673,yamaha rx-v663 hometheaetr receiver rxv663bl,"665w dolby truehd , dolby digital ex , dolby pro logic iix , dolby diigtal plus , dts-hd , dts-es , dts 96/24 , dtsneo :6 , neural surroundxm",499.0
674,"handycam hdr-ux10 dvd cQamcorder ( 15x opt , 180x dig , 2.7 ' lcd ) hdrux10",,768.24
675,samsung 4 series nl32a450 32 ' lcd tv,samsung ln32a450 32 ' widescreen 7420p lcd hdtv 10000:1 dynBamic contrast ratio 6ms response time piano black,578.0
676,speck products seethru case for apple maZbook air mba-pnk-see,platsic pink,
677,speck products seethru case for apple mZacobok air mba-clr-see,plastiIc clear,
678,logitech v450 nano cordles slaser mouse for noteooks 910-000619,sler,
679,tomtom one 310 carry bag 9uea .117.00,bKcak,14.74
680,samsung 4 series ln26a540 26 ' lcd tv,samsung ln26a450 26 ' widescreen 720p lcd hNtv 5000:1 dynamic contrast ratio 8ms response time piano black,549.0
681,coby electronics tf-tv1022.10.2 ' lcd tv tftv1022,"10.2 ' active matrix tft atsc , tnsc 1:9 800 x 480 hdtv",119.99
682,logitech v470 cordless laYer mous efor notebooks 910-000692,FlaBser,
683,"panasonic viera th-50pz800u 50 ' widescreen 1080p plasm hdtv 1,000,000:1 dynamic contrast ratio",,1711.19
684,yamaha rx-v863 hXme theater receiver rxv863bl,"735w dolby truehd , dolby digital ex , dClby pro logic iix< , dolby digital plus , dts-hd , dts-es , dts 96/24 , dts neo :6 , neural surroundxm",649.99
685,tomtom one 130 s portable gps system w / preloaded maps 1ee0 .052.02,,
686,samsung 4 series ln22a451 22 ' lcd tv,"samsung ln22a451 22 ' widescreen lcd hdtv 3,000:1 dynamic contrast ratio 8ms response time white",399.0
687,sharp lc26dv24u 26 ' tv.dvd combo,sharp lc-26dv24u 26 ' widescreen tv/dvd combo dhtv 800:1 contrast ratio 8ms response time piano black,508.72
688,sanus visionmount lt25b1 tilting wall mount,17 5Kb black,
689,wal-mt furn comp shlf vf2012-b1,,
690,samsung  series hl56a650 56 ' projFection tv,samsung hl56a650 56 ' widescreen 108p dlp hdtv w / built in ntsc/atsc tuner piano black,1079.96
691,samsung 6 series hI61a6506 1 ' projection tv,samsung hl61a650 61 ' widescreen 1080p dlp hdtv w / built in nsc/atsc tune piano black,1076.94
692,samsung htz410t home theater system htz410t,samsung ht-z410t 5 disc home theater surround sound system with hdmi and divx playback,279.0
693,samsung lM19450 19 ' lcd tv,samsung ln19a450 19 ' widescreen 720p lcd hdtv 3000:1 dynamic contraZst ratQo 8ms response time piano black,348.0
694,samsung 6 series ln159a65 19 ' lcd tv,"samsung ln19a650 19 ' widescreen lcd hdtv 3,00:1 dynamic contrast ratio 8ms response time",369.0
695,samsung 4 series l2n2a450 22 ' lcd tv,samsung ln22a450 22 ' widescreen 720p lcd hdtv 3000:1 dyYnamic contrast ratio 8ms response time piano black,397.77
696,samsung ln22a650 22 ' lcd tv,"samsung ln22a650 22 ' widescreen lcd hdtv 3,000:1 contrast ratio 8ms response time",458.0
697,samsung ln32a5560 32 ' lcd tv,"samsung ln32a550 32 ' widescreen 1080p lUd hdtv 15,000:1 dynamic contrast ratio 5ms response time piano black",849.0
698,"samsung pn42a450 42 ' widescreen 720p plasma hdtv 100*000:1 dynamic contrast ratio piano black pn42a450p",,899.99
699,samsung ht-tz515@home theater system htz515/xaa,samsung 5 dvd hUm theater wifi xm ready nic,
700,tehccraft aNs60 tv stand,woobd lack,
701,sport neckband earbuds mdr as50g,,32.71
702,bass lover earubds slvre mdred12lp/slv,,10.99
703,ex series earbCuds black mdr ex32lp/blk,,15.65
704,bass lover earbudX red mdred12lp/red,,10.99
705,ex series erabudGs wht mdr ex55/whi,,25.76
706,ex series Zearbdus pnk mdr ex55/pnk,,23.58
707,ex series erbuds wht mdr ex32lp/whi,,16.99
708,ex series eabruds black mdr ex55/blk,,22.2
709,sony dvp-fx820 portable dvd pIayer! dvpfx820,"8 ' lcd dvd + rw , dvd-Fw , dvd + r , dvd-r , cd-rw dvd video , cd-da , mp3 , jpeg playback 1 disc ( s ) black",158.72
710,sony pslx30usb usb recrod turntable,belt rdiUve,119.72
711,yamaha rx-v363 home teate receiver rxv363bl,"500w dolby Bdigital , dolby pro logic ii , dts",199.0
712,apple wirless mighty mouse mb111ll/a,laser 4 xbutton,69.0
713,denon pro 5 cd carousel chVnger nic dcm290p,,
714,samsung 7 series ln46a75046 ' lcd tv ln46a750r1fxza,"samsung ln46a750 46 ' 12080p lcd hdtv 50,000:1 dynamic contrast ratio 6ms response time 120hz",1537.77
715,griffin tunebud sstereF earset 9410-tunbmblb,ear#bud,19.53
716,panasonic sc-t660 home theater system,"dvd player , 5.1 speakers 5 disc ( s ) progressive scan 1000w rms dolby dBigital , dts,  dolby pro logic",
717,panasonic c-p7t60 home theater system,panasonic sc-pt760 premium sound dRvd home theatre system with kelton subwoofer,319.97
718,griffin smarttalk headphone adapter with control aNd mic for iphone 3016-smrtlkb,30 ',
719,samsung 6 series nl32a650 32  'lcd tv,"samsung ln32a650 32 ' 1080p lcd hdtv 50,00:1 dynamic contrast ratio 4ms response time",916.13
720,tomtom xl 330 portable gps sWstem w / preDloaded maps 1eg0 .052.00,,
721,sony str-dg520 a/ vreceiver Itrdg520,"dolby digital , dolby pro logi;cii , digital cinema sound , dts",164.51
722,sony str-dg70 a/v receiver strdg720,"dolby digital , dolby pro logic ii , dts 96/24 _, dt neo :6 , dolby digital ex , dolby pro logic iix , dolby pro logic , dts-es , digital cinema sound , dts",224.79
723,sony dvp-ns700h / b dvd player,"dvd-rw , dvd + rw , dvd-r , dvd + r , cd-rw dvd video , cd-da , mp3 , jpeg , svcd , video cd playback 1 disc ( s ) progressive scan black",
724,panasonic kx-tg313 cordless phone,1 x phonel! ine ( s ) silver,
725,samsung dvd-1008p78 dvd player,"dvd + rw , dvd-rw , cd-rw dvd video , jpeg , mp3 , Iwma , mpeg-4 , dvd audiP , video cd , cd-da , divx playback progressive scan",72.11
726,sharp air pNurifier 194 cfm max kc-c100u,,
727,nikon coolpix p80 digital camera 26114,"nikon coolpix p80 10 megapixel digital camera with 18x optical wide-angle zoom , 2.7 ' high-resolution lcd , vibration reduction image stabiliation & up to an iso6400",271.72
728,"samsung ln40a750 40 ' 1080p lcd hdtv 50,000:1 dynamic contraWst ratio 4ms response time 120hz",,1341.12
729,omnimount moda collection echo 59 tv stanNd echo 50,omnimount echo 50 moda collectio ntv table stand for up to 50 ' tvs espresso,
730,onkyo txsr506 a/v receiver,"dolby digital , dolby pro logic iix , dolby digital ex , dts , dts-es , dts 96/24 , dts neo :6 fm , am",227.72
731,"samsung ln52a750 52 ' 1080p lcd htv 50#,000:1 dynamic contrast ratio 120hz 6ms response time",,2148.99
732,sony cyber-shot dsc-h50 digial camera black dsch50b,9.1 megapixel 16:9 2x digital zoom 3 ' active[ matrix tft color lcd,329.0
733,samsung sc-d382 digital Zamcorder,samsung sc-3d82 mini dv cNamcorder,128.96
734,samsung htx810t home thCeater Vsystem htx810t,samsung ht-x810 2.1 souGndbar home theater system,580.14
735,kensington mini battery pack and charQer for iphone and ipod k33442us,,
736,canon eos rebel xsi digital lsr camera silver 2757b001,12.2 megapixel 3 ' actiCve matrix tft color lcd,
737,samsung dvd-v9800 dvd/vcr combo player w /= 1080p up-conversion,,85.06
738,boston acoustics horizo solo am/fm radio hsolomndt,,90.0
739,alpine cda-9884 car audio player cda9887,"cd-r , cd-rw cd-da , mp3, wma , aac 4 200w fm , am",295.0
740,pioneer dehp400u bcar audio player,"cd-rw cd-text ;, mp3 , wma , wav , aac 4 200w fm , am",134.32
741,pioneer deh-p3000ib caT audio player,"c-rw cd-text , mp3 , wma , wva , aac 4 200w fm , am",92.72
742,yamaha yht-390bl home{theater system yht-390bl,", 5.1 speakers progressivG Nscan 600w rms black",319.96
743,z-line designs zHl23-44mu portland flat panel tv stand with integrated mount,"metal , glass blac , chrome",254.37
744,"samsung hl-67a750 67 ' widescreen 1800p dlp hdtv 10,010:1 contrast ratio hl67a750",,1729.98
745,nintendo ds lite ( meatllic rose ) usgszpb,,
746,"samsung pn50a650 50 ' 1080p plasma hdtv 1,000,000:1 dynamic contarst ratio anti burn-in technology",,1699.98
747,pioneer pdp-502f0d 50 ' plasma tv,pioneer kuro pdp-020fd 50 ' 1080p plasma hdtv,2199.98
748,pioneer directcontrol cable cd-iu230v,"1 x proprieGtary 1 x ype a usb , 3 x rca",41.44
749,pioneer cd-sb10 sirius interPQface cable cd-sb10,,
750,pionee deh-2000mp ar audio player,"cd-rw cd-text , m3 , wma , wva lcd 4 200w fm , am",84.0
751,pioneer gex-p10hdh d radio add-on tuner for sCelect in-dash pioneer receivers,,
752,pioneer pdp-6020fd) 60'  plasma tv,pioneer kuo pdp-60230fd 60 ' 1080p plasma hdtv,
753,sony dvp-nc800h / b& dvd player,"dvd + rw , dvd-rw , dvd + r , dvd-r , Ecd-rw dvd video , cd-da , mp3 , jpeg ,.svcd , video cd playback 5 disc ( s ) progressive scan black",
754,alpine mrp-f306 car amplifier,4 channel ( s ) cPass ab 100b snr,
755,pioneer deZp500ub car Yaudio player,"cd-rw cd-text , mp3 , wma , wav , aac 4 20w fm , am",153.64
756,corded telephone keypad single line operation lcd display caller id ; cal kx-ts620w,,
757,corded telephone keypad single-line opertion 2-way lcd# display black kx-ts620b,,
758,panasonic sc-bt100 home heater system sc-bt100p-k,"bd player , 5.1 speakers 1 disc ( s | progressive scan 120w rms dolby digital , dolby truehd , dolby digital plus , dts-hd , dts",
759,panasonic sc-pt960 hoVme theater system,"panasonic sc-pt960 5-disc dvd home theater system with kelton subwoofer ,1080p up-conversion , nitegrated universal dock for ipod , 2 tower speakers , wireless rear speaker and viera link",349.99
760,sony bravia dav-hdx275 home thWater system,", 5.1 speakers 5 disc ( s ) Fprogressive scan 1000w rms dolby pro logic ii",
761,sony bravia dav-hdx279wchome theater system,"dvd player , 6.1 speakers 5 disc ( s ) progressive scan dGolby digital , dts , dolby pro logic ii black",318.01
762,sony dvp-fx820 / l portable dd player dvpfx820/l,"8 ' lcd dvd + r , dvd + rw , dvd-rw , dvd-r , cd-Iw jpeg , mp3 , dvd video plYayback 1 disc ( s ) blue",131.54
763,sony dvp-fx820 / r portaTle dvd playeS dvpfx820/r,"8 ' lcd dvd + rw , dvd-rw , dvd + r , dvd-r , cd-rw dvd video , cd-da , mp3  jpeg Tlayback 1 disc ( s ) red",159.94
764,sony dvp-ns70h / s dvd player dvpns700hs,"dvd + rw , dvd-rw , dvd + r , dvd-r , cd-rw dvd video , cQd-da , mp3 , jpeg , svcd , video cd playback 1 disc ( s ) progressive scan silver",111.68
765,lg 22 cu.ft . toKal capacity,,
766,lg 22.6c u.ft . total capacity,,
767,lg 5.0 cu.ft . total Zapacity,,
768,lg 25.0c .uft . total capacity,,
769,lg 25.0 cu.ft . ota lcapacity,,
770,lg 25.0 cu.ft).+total capacity,,
771,lg 25 cu . ft. ce & Pwater dispensing,,
772,lg 24.7 cu . ft. stainless stee lfrench door bottom mount refrigerator,,
773,lg 25 cf efrigerator 3 door Lwhite tall,,
774,lg 25 cu.ft . ttoal capacity 4 door refrigerator,,
775,lg ldf6920bb fulGy integrated dishwasher,,
776,"lg ldf6920st}fully integrated dishwasher with 5 wash cycles , 3 spray arms , senseclean system , delay start , food disposer and self-clean filter : stainHless steel",,
777,lg disEwCasher,,
778,lg semi-inteSgrated electroMic panel with digital status display,,
779,lg semi-integrated electronic pJael with digital status display dishwasher,,
780,lg 1.6 cu.ft . over tKhe range microwave,,
781,lg 1.6 cu*.ft . ovHer the range,,
782,lg 5.76 cu.ft . freestanding Flectric range,,
783,lg 5.6 cu.ft . freesanding electric range,,
784,lg 5.6 cu.ft . freestanding lectric range,,
785,lg 5.6 cu.fO . freestanding electric range,,
786,lg 5.6 cu.ft . feestandinge lectric range,,
787,lg 5.0 cu.f . fresetanding gas range,,
788,lg 5.0 cu.ft .freestandnig gas range,,
789,lg 5.0 cu.ft . freestanUding gas range,,
790,canon psc-85 soft camera Tcase 2595b002,,8.77
791,sony cyber-shot dsc-w105 digita lcamera gold dscw150n,8.1 megapixel 16:9 2x digital zoom 2{7 ' active=matrix tft color lcd,129.99
792,sony cyber-shot dsc-w150 digital#camera red dscw150r,8.1 megapixel 16:9 2x digitalzoom 2.7 ' active matrix tft color lcd,139.94
793,sony cyber-shot dsc)-w17 digital camera red dscw170r,10.1 megapixel 16:9 52x digital oom 2.7 ' active matrix tft color lcd,169.0
794,sling ii laptop case 21 inch 4.5<inch 14.5 inch 2221,,
795,sling i laptop case 18 iYch 4.5 inch 13 inch 2211,,59.95
796,denon dht-fs3 2-piece home theater audio system,,
797,denon dht-fs5 surronud sound spaeker system,5.1-hanel,
798,1.6 cu.ft . over Sthe range microwave,,
799,lg 2.0 cu.ft . over th erange microwave oven,,
800,lg 2.0 cu.ft . over th range microwave oven,,
801,lg 2.0 cu.ft . over the ranCeg microwave oven,,
802,logitech quickcam vsion pro webcam 960-000254,fo rYmac,
803,pure digital Tlip minodigital camcorder f360b,flip video mio 60 min black,
804,pure digitalflip mino digital camcorder f360w,flip video mnio 60 min white,
805,"samsung hl72a650 72 ' widMescree n1080p dlp hdtv 2,500:1 contrast ratio",,2188.7
806,boston acoustics horizon duoi- am/Sfm stereo radio hduoimdnt,"5 x am ,] 10< x fm",135.52
807,samsung yp-s2zw gb flash mp3 player yp-s2zw / xaa,1gb flash; mmeory white,29.67
808,samsung yp-s2zw g1b flash mp3 player yp-s2zg / xaa,1gb flsh memoy green,29.67
809,onkyo cs-325 stereo cd eceive rmini audio system,,238.72
810,canon selphy cp60 dye sublimation printeJr 2565b001,canon selphy cp760 cmpact%photo printer,90.1
811,maytag mmv4205aq over-the-range mirowave,,
812,maytag 2.0 cu . ft. over-the-range microwave oven,,
813,linksys wrt610nsimultanUous dual-n band wireless router,,
814,speck products seethru case foVr apple 13 ' macbook mb13-blk-see-v2,plasitc black,
815,speck products seethru Scase for apple 15 ' macbook Yro mb15-clr-see-v2,plEsticc lear,
816,speck products seethru case for applY 15 'macbook pro mb15-pnk-see-v2,plasRtic Kpink,
817,speck products seethru case for aDpple 13 ' macbook mb13-clr-see-v2,plastDc clear,
818,speck products seethru cse for apple 13 ' macbook mb13-red-see-v2,plasTtc red,
819,speck products seethru case for apple 13 ' macUook mb13-blu-see-v2,plastR cblue,
820,speck products seethru case for appe 13  'macbook mb13-pnk-see-v2,plastDci pink,
821,speck products seethru csefor apple 13 ' macbook mb13-grn-see-v2,plastic_ green,
822,speck products seethru caJse for apple 15 ' macbook pro mb15-blu-see-v2,plaItic blue,34.74
823,speck products seethru case for aple 13 ' macbook mb13-org-see-v2,plastic SoTange,
824,speck products seethru case for apple 163 ' macbook mb13-aqu-see-v2,plasitI aqua,
825,speck products seethru case or apple 15 ' mcabook pro mb15-grn-see-v2,plastHicgreen,
826,speck products seehru caFse for apple 15 ' macbook pro mb15-org-see-v2,plastic Crange,
827,speck products seethru cGse for apple 15 ' macbook pro mb15-pur-see-v2,platsic purple,31.97
828,bracketron low-pro windshield mount swm-400-bl,black,
829,ge 24746 futura ( tm\) indoor htdv antenna,,29.72
830,blueant wireless z9i blueLooTth headset black us-091010,,59.99
831,sony ht-ddwg700 home theaetr system htddwg700,"dvd player , 5.1 speakers 900w Mrs dts , dolby digital , dolby pro logic ii",206.96
832,sonyrdr-Kx560 dvd/vcr combo,"dvd-r , cd-r , vhs dvd video plyaback 1 disc ( s ) black",176.08
833,transcend 4gb icrosdhc card ( class 6 ) ts4gusdhc6,04%gb,6.85
834,sony bravia m seGries kdl-26m4000 26 ' lcd tK kdl26m4000,"26 ' atsc , ntsc 16:9 81366 x 768 hdtv",538.72
835,samsung bdp-1500 blu-ray dvd player bdp1500,,218.2
836,lg 37lg50 37 ' widescrene 1080p lcd hdv 15000:1 dynamic contrast ratio 5ms response time,,
837,onkyo txsr606 a/v receiver,"dolby digital plus , dolby truehd , dts-hd",399.95
838,mitsubishi wd-65735 65 ' pUrojection(tv wd65735,65 ' dlp 16:9 1920  0080 dolby,1401.26
839,sony bravia s series kdl-46s4100 46 ' lcd v kdl46s4100,"46 ' atsc , ntcSs 16:9 1920 x 1080 hdtv",1188.65
840,sony bravia kdl-22l000 32 ' lcd tv kdl32l4000,"32 ' atsc , ntsc 16:9 1366 x 9768 hdtv",597.72
841,lg 32lg30 32 ' widescreen 720p lcd hdtv 12000:1 dynamic contrast ratio 8ms response time,,
842,mitsubishi wd-6573665 ' projection tv wd65736,65 ' dl phdtv ready,1309.56
843,panasonic viera th-46pz0u 46 ' plasma tv th46pz850u,"46 ' atsc , ntsc 16:9 1920 x 10850 hdtv",1695.96
844,sony cyber-shot dsc-w150|digital camera silver dscw150,8.1 megapixel 16:9 2x digital Jzoom 2.7 ' active matrix tft color lcd,129.99
