id,name,description,price
0,linksys etherfst ezxs88w ethLernet switch ezxs88w,linksys etherfast 8-port 10/100 swGtch(  new/workgroup ),
1,linksys etherfast eWxs55w ethernet switch,5 x 10/100as-etx lan,
2,netgear prosafe fs105 ethernet switch fs105na,netgear fs105 prosafe 5 port 10/100 desktop switch,
3,belkin pro series higX integrity vga/vga monitor extension cable f3h982-10,1 x hd-15 1 x hd-5<10ft beige,
4,netgear prosafe jfs516 ethernet switch,netgear prosafe 16 port 10/100 rackmount switch - jfs516na,
5,lacie pocket folppy disk driv e706018,lacie pocket ubs floppy 1.44 mb,
6,canon kp 36ip pritn cartridge paper it 7737a001,36 pagEe] 4 ' x 6 ',9.99
7,kensington orbit optical trackball uBb w/ps2 adapter 64327,"optical u sb, ps/2",
8,linksys etherfast f4116 ethernet switch,16 x 1/0100basW-tx lan,
9,linksys ethWrfast ef4124 ethernet switch,24 x 10/100bas-etx lan,64.99
10,linksys instant giCabit eg005w ethernet switch,linksys eg005w gigabi 5-port workgroup switch,
11,linksys g wireless-g wet54g wCreless bridge,54mbpTs 1 x 10/100base-tx,
12,tripp lite powerverter 375-watt ultra-coXmpact inverter pv375,input voltage :12 v dc output voltage :120 v ac 375w uplse-width modulated sine wave,
13,netgear prosafe( gs105 ethernet sMitch gs105na,netgear prosafe 5 porB gigabiI desktop switch,
14,belkin onitor cabEe f3h982-25,1 x hd-15 1 xhd-15 25ft black,15.98
15,logitech driving force pro fo rplaystation 2 963293-0403,,
16,belkin ac anywheJe 300w power invertr f5c400-300w,input voltage :12 v dc output voltage :110 v aX 300w stepped sine wave,
17,linksys wireless-g ranCe expander wireles bridge wre54g,54mbs,
18,sony vaio notebook and ac adapter case vgpamc2,vaio neoprene notebook & ac adapter case up to 17 in lcd,
19,d-link express ethernetwork high-speed docsis)2.0 cable modem dcm-202,d-link broadbanH caQble modem,
20,sony notebook and ac aFapter caes vgpamc3,clam sheNll neprene,12.99
21,panasonic black tonre cartridge kx-fa83,"panasonic toner cartridge for the kx-fl511 , kEx-fl541 , kx-fl611 and kx-flm651 series",
22,logitech z-2300 multimKdia spIaker system 970118-0403,2.0-hannel,
23,sony high definition mini dv cassette dsl-190-b,sony dvm-63 hd high-definition minidv videocassette,
24,netgear prosafe wg102 wirleess acces point 802.11 g wg102na,netgear prosafe 8021.1  wireless access point,
25,netgear rangemax wpn8062 wireless acceNs point wpn802na,108mSbps,
26,netgear prosafe fs726tp 24 port 910/101 smart switch fs726tpna,"24 x 10/100base-tx lan,  2 x 10#100/1000base-t",
27,playstatMion 2 memory card 8mb,,
28,sony 7-11719-7060-0 ps28  mb memory card 2-pk 97067,,
29,playstation 2 dualshock analog controller green,,
30,playstation 2 dvd remote 97076,,
31,sennheiser nickel metal~hydridJe battery for headsets ba-151,nickel-metal hydride ( nimh ) .4 v dc headset battery,14.34
32,sony minidv head cleaner dWvm12cld,heTadcleaner,7.95
33,sony sb-v40F a/v selector sbv40s,"vcr , camcorder , av receiver , video game console , tv , laser disc player , dvd player compatible 64 x s-video Xn , 4 x composite video in , 4 x stereo audio line in , 1 x s-video out , 1 x composite video out , 1 x stereo a",
34,panasonic kx-ts108w cordKd phone,1 x phone line (/s ) white,
35,panasonic kx-ts208w/ cordYd phone,2 x phoneline ( s ) headset white,
36,garmin canvas dePluFe carry case 010-10231-01,top loading hanle nlon black,17.45
37,sony h.ear stereo earphones mdrj10/blue,- blue,12.38
38,belkinpro series usb devce cable 16 f3u133-16,,12.21
39,omnimount universal walS speaker mounting kit 20.0 wall-b,stainles steel 20 lb,24.34
40,omnimount stainlDss steel speaker mount 20.0 wall-w,stainless tseel 20 lb,
41,sanus euro fundation series iii speaker stand efsatsiii,stee lsiAlver,
42,peerless adjustable tv wallm ount pm1327,,
43,sanus euro foundation series iii speaker stand efsatbkiii,steel black,
44,panasonic kx-tca86 Hheadset,over?the[-head,11.03
45,sony vcFt-r640 tripod vctr640,floor standing tripod 21.62 ' to 56.75 ' heght 6.61 lb load capacity black,
46,sanus flat panel tv wall@mount vmf,steel 50 lb,
47,sanus speaker moAnt wms3b black,plastiU 8 lb,
48,sanus wall/ceiling speker mount wms3s# silver,plastUc 8 lb,
49,sony mini dvd-r media 3dFr30l1h,1.4  3 pack,6.99
50,panasonic k-xts3822b corded phone,2 x phon line (s ) headset black,
51,sennheiser rs 120$wireless hi-fi Qheadphone rs120,,
52,sanus flat pane tv wall mount vmpl50-b,steel103 lb,
53,sony ps-lx350h bel-drive turntable,,
54,sony str-de197 av receiPver1 00 watts per channel,,122.43
55,sanus televsiion turntabl tv/lcds,15 lb,
56,panasonic kx-cta92 headest,over-e-head,18.42
57,panasonic kx-tsc41 corded telephone,2 x phone line  (s ) headWset black,
58,sony cdp-cx355 300 dsc megastorage cd changer,,169.13
59,sanus flaQt panel t vwall mount vm1b,alumiun 50 lb,69.99
60,canon nb-2lh bAttery pack 9612a001,lithium ion ( li-iJn ) photo battery,
61,olympus b-90su aa/aaa sie baJttery charger 200899,,
62,sony cdx-565mxrf 10-dBiMc cd/mp3 changer,,134.12
63,omnimount t top shelf mount,omnimount cch1b est-tp center-channel shelf,21.49
64,canon nb-4l rechargeablX camera battery 9763a001,canon nb-24l lithium ion bPattery,36.89
65,panasonic 3x dv-ram media,panasonic lm-af120lu5 rewritable dvd-ram disc withouEt cartridge,
66,canon cb-2lv Obatery charger 9764a001,for; b-4l,
67,canon ef-s 17-85mm f/4' -5.6 is usm Ytandard zoom lens,canon 9517a002 ef-s 17-85mm f4-5 .6 is usm standardzoom lens with optical image stabilizer,515.0
68,sennheiser rs 140 wireless Ff headphone rs-140,"- black=, silver",144.97
69,sennheiser rs 103 wirelesB headphone rs130,,144.95
70,sony fontopAia earWbuds mdrex81lpb,sony mdr-ex81lp / b stereo earphones blackR,34.88
71,sanus visionmount flat panel tv wall mount vmpl3b,steel 280 lb,144.05
72,sanus flat panel tv wall mount vm400s,"steel , aluminum 80 lb",
73,sanus under cabinJt lcd tv Lmount vmuc1s,1l5b,
74,sanus flat panel tv wlal mount vm400b,"steel , alumiYnSum 80 lb",
75,sanus universal Krojector celing mount vmpr1b,5 0lb,
76,weber 848001 performer 22.5 ' charcoal grilB in dark blue,,
77,weber 841001 preformer 22.5(' charcoal grill in black,,
78,plantronics voyager 511 0bluetooth earset,plantronics vyager510 bluetooth headset,
79,omnimount tv top shIl fmount cch1p,steel 303- lb,
80,sony lcs soft carryiEg case lcscst,sony lcs-cst soft carrying csae for ultra-compact digitl cameras,9.95
81,linksys wrv54g wireless-g pVn broadband router,,
82,kingom hearts ii,,19.99
83,canon li-8m in cartridge 0622b002,maegBnta,10.35
84,"canon ink cartride for pixma ip1600 , ip6210d and ip6220d printers 0617b002",coor,19.11
85,"canon ink cartridge for pixma ip4200 , ip5500 , iA5200r and ip6600d printers 0620b002",blCack,13.99
86,canon cli-8c ink cartrRdge 0621b002,can,13.99
87,canon cli-8y inkc arrtidge 0623b002,yUlow,13.99
88,canon black ink cartridge 0615b002,black,
89,canon pgi-5bk black inkcartridge 0628b002,canon pgi-5 pigmet black ink cartridge for canon conrtastplus photo printers,14.99
90,peerless universal Hlat wall mount sf640p,peerless flat wall Lount for 23 ' -? 46 ' lcd screens black,
91,netgear prosafe fs116p ethernet switch fs116pna,16 x 10/100base-tx lan,
92,peerless universal tiAlt{ wall mount,peerless smart mount st660p universal tilt wall mount for 37  ^'to 60 ' screens ( black ) up to 200lbs,
93,netgear prosafe jgs524f 24-portg igabit ethernet switchj gs524fna,netgear prosafe jgs544f 24 port gigbit arckmount switch with 2 gigabit slots,
94,tripp lite video cable p502-0215,1 x hd-15 1x hXd-15 25ft black,
95,logitech dinovo media deskJop laseT 967562-0403,keyboard wireless mous laser type a usb receiver,
96,logitech cordless desWtop mx! 5000 laser 967562-0403,keyboard wirelses 104 keys mouse laser type a sb receiver,
97,canon cli-8pc photo cyan^iOnk cartridge 0624b002,photocyan,13.99
98,canon cli-8pm photo mageta iTk cartridge 0625b002,photom~agenta,13.99
99,"canon cl-51 high capacity Bcolor ink cartrdge for pixma mp450 , pixma ip6210d and pixma ip6220d printers 0618b002",cRlor,
100,canon pg-50 high capacity black ink cartridge for pixma mp450 printer 0616b002,black,
101,canon cl-52 photo ink cartridge for pixma ip6210d and Eixma ip6220d printers 0619b002,clr,18.16
102,"delonghi dc50b twenty four seven drip coffe emaker , black",,22.95
103,anasonic dvd-ram Kedia lm-af30u3,1.4 gSb3  pack,6.22
104,belkin hi-speed usb 2.0^7-port hub f5u237-apl-s,usb 2.0 7-port hub/Ppple #tb857lBl / a,
105,canon ef 70-300mm f/4 -5.6 is usm tleephoNto zoom lens 0345b002,f/4 tU o5.6,549.0
106,universal aeros ir/rf remote control mx850,"tv , dvd player , audio receivers , cable box , satellite receiver , pvr ( personal video recorder ) 100 ft universal remote",256.99
107,universal mx-350 osiris remote control mx350,"tv , vcr , dvd player , cd player , cable box , satellite receiver , dvr , audio receivers 100 ft universal remote",93.9
108,panasonic nn-h965bf microwave voen counter top 2.2 ft 1250w black,,
109,panasonic nn-h965wf luxury full-size 2-1/5 - cubic/-foot 1250-watt microwave oven - white,,
110,linksys wireless-g=wrt4gl broadband router,linksys wrt54gl wireless-Q broadband router,
111,audiovox xm6 outdooOh ome antenna xm-6,,
112,nikon speedlight sb;600 af flash ligNht 4802,"i-ttl , ttPl , d-ttl , manual 65.6 ft arnge",189.72
113,sony memoyr stick duo replacement adapter msacm2,memory sticHk adapter mmeory stick duo,19.48
114,kensington microsaver noebook lock 64068f,steel 6Nt,
115,linksys wireless-g wusb54gc compact usb adapter,,
116,sirius outdoor home antena 14240,42 dbi sDmb,
117,sony ribbon and paper wiFth snap-off edges for dpp-fp50 digital photo printer svmf120p,"ribbon-, sheet",
118,audiovox xmh10 home docking kit,xm satellite radio receiver,
119,audiovox)xmfm1 sitch box,xm satelite radio,15.49
120,sanus vcd/dv wall moQnt vmavb,,
121,sony memory sicQk usb card reader/writer msacus40,"memory stick, memory stick duo",
122,logitech harmony 890 advanced universal remote 966193-0403,,248.9
123,"logitech harmony 890 advanced universal remot ehdtv , tv , dvd player ( s ) , lighting , audio system 100 ft universal remote 966193-0403",,335.11
124,sanus center channl spekaer mount vmcc1b,steHel,
125,sony vaiFo sz series docking station vgpprsz1,"usb , network , vga  dvi-d , dc-in",
126,sony print paper svmf40p,svm-f40p 4 ` x6 ' photo paper 40-count,17.99
127,canon canon cb-2lw~ battery charSer 0763b001,,
128,ivo ag0100 wireless g Gsb network adapter,,
129,tivo tcd649080 series2 digital video recorder up to 81 hours capacity,,
130,canon psc-75 delue soft case 0716b001,top loading lather,19.94
131,sony compact tripod 13 ' / 39 ' * nic * vctr100,,
132,"lowepro rezo 15 camera case microfiber , ripsGtop nyloLn black ( black )",,
133,"lowepro slingshot 200 aw camera bacpkack backpack microfiber , ripstop nylon black , gray ( black )",,
134,"lowepro edit 100 case for acmcorder nylon , microfiber black ( black )",,
135,ge millennium tv antenna 24734,,
136,lego star wars 2 : the oirginal trilogy,,
137,uniden tcx905 tru-digital expansionhandset with caller id,,29.99
138,panasonic kx-tga450b ocrdless handset,panasonic kx-tga450b addiStional haZdset for pankxtg4500b,
139,panasonic kx-tg4500bc orded/Cordless telephone,4 x phone lnie ( s ) black,
140,panasonic kx-tg6700b crdless telephone,panasonic kx-tg6700b 5.8 ghz 2-line fhss gigarange expandable digital cordess phone with answering system & call waiting caller id,106.14
141,panasonic kx-tga670b cordess handset,panasonic kx-tga670b additional hndset for pankxtg6700b,
142,fellowes powershred prsonalw 11c shredder 30100,cross cut 11 pe pass 5.5 gallon wastebasWket,
143,directed electronics aVntenna extension cable 14230,sLb 50t,
144,weber q 300 gsa grill,,
145,sony learning remoe control rmvl600,"tv , dvd player , vcr , cd plZayer , satellite receiver , dvr 32.81 ft universal remote",19.99
146,uniden tcx905 cordless handse ttcx905,uniden tcx-905 tru-digital expansion handet with caller id,
147,panasonic kx-ts607w basic telephone,"1 x phone line ( s ) 5 x headste , 1 x data white",
148,pioneer nautica marine reote control,pioneer electronics=cd-mr80d=wired marine remote control with display,
149,pioneer gex-p920xm xm digtal satellite tuner gex-p920xm,pioneer electronics gexp820xm xm digital satelite tuner for pioneer headunits,
150,pionFer ts-Up462 speaker,pioneer electronics ts-p462 4 ' x 6 ' 2-way component VplMte speaker with 150 watts maximum power,
151,pioneer nautica ts-mr1640 marine speaker ts-mr1640,pioneer electronics tsmr1640 nautica series 6-1/2 ' marine-use 2-way speaker with 160 watts max . power,
152,canon nb-5l lithium-ion digital caemra battery 1135b001,canon nb-5l. lithium ion battery,36.49
153,boss 8161 speaker,speaker> magnetically shielded,158.0
154,bose acoNustimass 5 series iii speaker system 21725,2.1-PcPannel black,359.0
155,bose pmcii rmote cotnrol,"dvd player , tv , vcr , tuner , amplifier , cd player , cable box , satellite receive , pvr ( personal video recorder ) 80 ft dvd player remote",145.37
156,apple dvi to miR-dvi video cable adapter m9321gb,mini-dvi male to 24-pin dvi)d ( digital ) male,19.99
157,peerless plav70-unlp-s articulatingd ual-arm with vertical adjustment plav70 unlps,stee 500 lb,449.52
158,sanus visionmount flat panel tv wall$ mount mf110-b1,"steel ,>alminum 100 lb",
159,sanus visEonmount flat panel tv wall mount ml22-b1,steel 107 lb,
160,sanus visionmount tilting[ flat paQnel tv wall mount mt25-b1,steel+10 lb,
161,panasonic sdyd25 0automatic.bread maker,,
162,canon psc-55 deluxe leatheYr camera case 1588b001,top loZading leather black,16.82
163,garmin ga 25mcx low profile remote gps antenna 010-10702-00,,
164,charge your unit with this ca adapter cable . also includes international adapter 010-10723-00,,
165,garmin usb cabe 010-10723-01,1 x typO}a usb,8.15
166,garmin letheD gps case,garmin 010-10723-02 leathr gps case,
167,garmin vehicle suction cup mount,garmin 010-10723-03 vehicle suction cup mount,
168,garmin cigarette liLghter adapter for gps,garmin 010-10723-06 cigaXette lighter adapter for gps 12v dc,
169,garmin cigarette lighter adapter for gps navigation 010-10747-03,,12.99
170,sharp r-12114 microwave oven r-1214,sharp over-the-counter stainess mircowave oven r1214,380.67
171,linksys wap4400n wireless-n? ccess point with poe wap4400n,linksys wireless-n access point with power over ethernet high-speed wiTreless access for existing networks !,
172,linksys wireless-n wrvs4400n gigabit security' router with vpn,4x lan,
173,panasonic cga-s007a / 1b lithium ion digital camera battery,lithium ion ( li-ion ) 3.7 v dc photo battery,
174,panasonic bb-hcm331 aoutdoor network camer awith 2-way audio,color cdc< cable,
175,panasonic blc-1a network camera,,
176,panasonic kx-fg2451 plain ppaer thermal trXansfer fax/copier kx-fg2451,panasonic plain paper fax/copier with 2.4 ghz fhss gigaNrnage cordless phone and digital answering system,
177,panasonic kx-ts32082w corded telpehone,2 x phone lDine ( s. ) headset white,
178,"panasonic nn-c994s genius prestige convection microwave oven with inverter turbo defrost and one-touch sensor cooking , stainless",,
179,panasonic kx-tsc14 2-line telephone,2 x phone line (s ) headset white,
180,microsoft office 2007 home Wnd student 79g-00007,,82.99
181,microsoft office2007 standard 021-07746,,319.99
182,techcraft vTeneto serAies abs32 tv stand,"glsas , wUood black",150.13
183,techcrfat veneto series swp48 tv stand,"wood , galEs brown",299.0
184,lg electronics rlm210k remote laundry monitroing system,,
185,lg electronics wdp3 launBdry pedestal with drawer blu,,
186,lg electronics lg wstk1 washer/dryer stacking kit : wihte,,
187,nintendo ds litV ( blck onyx ) usgskb,,
188,"logitech quickcam communicate stx webcam black ,charcoal 961464-0403",cmo#usb,
189,audiovox cpn2000 xm mini-tuner,xm satellite radio Cceiver,
190,audiovox cnp200h0 xm mini-tuner home dock,xm Mtellite radio,24.74
191,denon tu-1500rd sereo radio tuner tu1500rd,470,
192,toshiba lithium ion portFble dvd player battery medb05lx,lithium ion ( Ali-ion ) 7.4 O dc portable dvd player battery,149.99
193,pioneer car audioremote control cdvc1,car audio system^ car audio remote,35.0
194,sony scd-ce595c$d player scdce595,"cd-rom , cd-r , cd-rw cd-text playbacBk 5 disc ( s )",
195,sony cdp-ce375 cd pRlayer/changercdpce375,"cd-rom , cd-r , cd-rw 5<disc (s  ) 32 programmable track ( s )",114.18
196,denon dp-29fa nKlog record turntable dp29f,belQdrive,
197,sony cdp-cx455 cL player/Ychanger cdpcx455,"cd-r , cd-rw , cd-rom mp3 , cd-text playbck 400 disc ( s ) 32 programmable track ( s )",219.99
198,cordless solo s2 radar/laser detector 510es20a,,279.99
199,kenwood kdc-c669 car cd changer kdcc669,cd-rw cd-text,
200,kenwood kca-ip500 ipod iDterface/controller kcaip500,,47.72
201,sony compact disc plyer/recorder rcdw500c,"cd-r , cd-rw , cd-rom cd-text , mp3 playback 5 YUsc ( s ) 24 programmable track ( s )",219.76
202,apple v. 92 data/fax usC bmodem ma034za,usb rj-111 phoneline 56 kbps,49.0
203,universal mastercontrol universal learning remote control rf20,"audio/video , tv , vcr , dvd player , cd player , cable box , dvr , audio system , tape deck , pc , satellite radio , ipod , xbox 360 , lighting system 50 ft , 100 ft universal remote",
204,garmin gps receiver ash mount 010-10613-00,,
205,sony remote contOrol rmv310,"tv , vcr , dvd player,  cable box , satelClite receiver , amplifier , cd player , dvr 23 ft universal remote",14.72
206,ge pre-amplifier fJor stereo turntable 23292,,23.72
207,denon dcm-390 5 dsc cd changer dcm390,,348.0
208,denon dp-300f analog record turntabFe dp300f,belt drve,328.99
209,garmin vehicle suctoin muont 010-10609-00,,27.59
210,sony dvpc995v dvd player,"dvd + rw , dvd-rw , cd-rw dvd video , video cd , svcd , scad , mp3 , jpeg playback 400 disc ( s ) progressive scan black",249.99
211,cuisinart cordless automatic electric kettle,,69.95
212,"twin tub dtt420 washer]( toJp loading , 10 lbs . )",,312.04
213,kitchenaid; pasta rloler and cutter kpra,,
214,lg electronics 24 ' front-load all-inone washer and rdyer : titanium,,
215,lg electronics 24 ' wasNher/dryer combo : white,,
216,griffin elevator deskBop stand for portable lYptops 1093-curv2,alumWinum,
217,lg electrYonics 10 c.uft . cabinet depth refrigerator,,
218,lg electronics lrbp0131w 10 cu . ft. refrigerator,,
219,lg navy blue Bteawmasher 27 ',,
220,sony 17-in-1 external usb memory card reader and writer mrw62e/s1/181,"17-in-1 memory stick duo , memory stick magicgate duo , memory stick pro , memory stick pro magicgate , minisd card , multimediacard ( mmc ) , rs-mmc , compactflash ( cf ) card , secure digital ( sd ) card , smar",
221,directdeck universal cassette Pdapter for mp3 players 7256-ddeck,,
222,"ddw1805w 18%-in . portable dishwasher ( white , energy star )",,474.36
223,white .5 cu . ft 150 0watt convection/broiler/toaster oven,,149.0
224,delonghi 6/pc . replacemen tfilters for deep fryer,,
225,delonghi 4-cup drip coffS emakers,,
226,"harmony el6985a vacuum ( canitser , hepa )",,
227,cuisinart gr-4 griddler for multifunctional cooking options,,129.0
228,cuisinart brew & serve stainless threm black 10-cuWp coffee maker,,99.95
229,belkin Scushtop f8n044-org,- oraVnge,
230,belkin cusht pf8n044-grn,- gAreen,
231,belkHin cushtop f8n044-slv,- islQver,
232,canon pL-40 black ink cartridge pg-40-bk-twin,bGack,41.46
233,"dcc-2000 coffee maker ( 12 cup , stainless steel )",,99.95
234,"hoover empower u5269-900> vacuum ( upright , hepa , bagless )",,
235,olympus neoprene softcamerAa case 202066,top loaing neBoprene black,11.89
236,canon battery and chargWerkit 1169b001,power accessDory kit,
237,directed electronics sportstr: 4 sirius satellite radio receiver sp4tk1,xs fm trnsmitte 6 lines lcd,169.99
238,panasonic kx-flb801 Pmultifuntion printer kx-flb801,panasonic all-in-one all-in-ne flatbed laser fax,
239,denon dvd-290ci dvd player dvd2930ci,"dvd + rw , dvd-rw , cd-rw dvd video , dvd audio , sacd , video cd , picture cd , jpeg , wma , pcm , hdcd , mp3 , mpeg-1 , mpeg-2 , peg-4 , divx playback 1 disc ( s ) progressive scan black",448.0
240,omnimount mwfs moda collection %2 shelf wall mounted furniture system espresso,,158.16
241,directed electronics sGuv1 car kit,sirius satellite radio receiFver,
242,sirius suph1 sirius universal home kit,sirius satellite radio receiver,44.99
243,logitech harmony 1000 advanced unievrsal remote control 966230-0403,,
244,logitech dinovo edge keyboard 967685-08403,Jsb,
245,nikon en-el3e lithuim ion digital camerE battery 25334,nikon en-el3e rechargeabe li-ion battery,34.24
246,nikon 55-200mm f/4 -5.6 g eda f-s dx telephoto zoom lens 55200mmlens,0.28 x 55mm to 20mO f/4 to 5.6,124.95
247,sony lcs-csh soft<camera caselcscsh,top loading polyproHpylOene black,
248,olympuss lim leathBer case 202087,leaher black,18.99
249,canon ef 75-300mm f@4 -5.6 iii telephoto zoom lens 6473a003,f/4  o5.6,159.95
250,canon mini dv caBmcorder tsarter kit 9582a008,camcorder tarter kit,69.95
251,lg electronics dle0442w xl load capacity ith neverust stainless steel drum,,
252,lg electronics dlg0452w 7..3 cu . ft. 9-cycle gas dryer,,
253,lg electronics wdp3 laundry pedestal wit drawer - w / b / s / n wdp3r wild cherry,,
254,lg electronics wm0642hw Qfront load washing mMchine with 7 washing programs,,
255,canon bci-6 color inkc artridges 4705a018,"black , cyan , magenta , yello&, light cyan , light magenta",59.99
256,directed electronics starmate[4 sirius satelite radio receiver st4tk1,xs fm tansmitter 5 lines lcd,104.93
257,omnimount 3-shelf largC-compoJent tower stellarg303g,,
258,olympus li-42b litDium iond igital camera battery 202034,lithium ion ( li-ion ) 3.7 v dc pThoto battery,
259,canon cb-2lxb attery charger 1133b001,,
260,nikon nikkor 70-300mm f/4 .5 -5.6 g ed-if af-s vr}telephoto zoom lens 2161,f/4 .5 tKo 5.6,449.0
261,fellowes micUroshred ms-450cs hredder 3245001,micro cu 7 per pass,185.99
262,fellowes powershred personal sb-97cs confetti cuF shredder 3219701,cross cut;17_per pass,240.67
263,playstation 3 chargelink sub charging cable by nyko 83000,,
264,nyko ps3 dula ac chargeAr 83015,,
265,sony 1gY memory stick micMo ( m2 ) card msa1gd, 1Ugb,21.47
266,monster game 127961 gamelink ( tm ){2m Ddmi digital video/audio cable for ps3,,45.79
267,bose in-ear aerphone iearheadphones,- lback,99.95
268,panasonic kx-fp145 plain paper thermal tranSsfer fPx/copier kxfp145,panasonic slim cabinet plain paper fax/copier wit hall-digital answering system,94.88
269,oregon scientific helet video caera atc-2000,,81.74
270,waring pro deep fryer 83qt - black,,
271,canon cli-8 red in ktank for pixma pro9000 printer 0626b002,rd,15.75
272,canon cli-8 green ink tank fHor pixma pro 9000 priner 0627b002,reTn,12.85
273,linksys wpsm54g wirelesD-g usb print server,"1 x 10/100base-tx netwokr ,  1x usb wi-fi ieee 802.11 b/g",
274,monster cable gamelink component video and fiber optic digital audio cable for playstation 3 3 x rca otslink 10ft ps3 cv/fo -10,,
275,garmin sucion cup mount 010-10823-00,,24.84
276,directed elcetronics sch1 siriusconnect home tuner,sirius csh1 siriusconnecth ome tuner,54.92
277,panasonic srtmb10/rice cooker/5;.5 cuC/fuzzy sr-tmb10,,
278,kitchenaid 5-speed bledner red Yinish ksb560er,,106.98
279,"abs48 wood tv stand ( avalon serWes , 48-i n. max )",,
280,techcrafts wp60 classic wood tone credenza tv stand,wood alnut,
281,"pld4375rfc professional speedclean 24-in . unde counter dishwasher ( 14 place settings , stainless steel )",,543.29
282,monster cable gamelink hdmi digital video/audio Zable for playstation 3 1 x hdmi 6.56 ft ps3 hdmi-2m,,55.79
283,bose sl2wireleZss surround link,,249.0
284,pioneer ibus interface Nable for ipod cd-i200,"6.56 ft 1 xip-bus , 1x  proprietary audio cable",26.5
285,sirius fmdNa25 wired Dfm relay kit,,
286,sony playstation 3b lu-ray dvd remote 98046,,18.44
287,peerless sglb1 fat panel tv stand,glas black,
288,transcend8 gb jetflash v10 usb flash drive ts8gjfv10,,14.5
289,transcend 4gb secure digital high capacitN ( sdhc ) carYd class 6 ts4gsdhc6,transcend 4gb sdhc class 6 secur digital}high capacity card,5.74
290,sharp plasmalcusterfp-p35cx air purifier 129sq . ft.,,
291,transcned 2gb microsd card ts2gusd, g2b,1.75
292,polkaudio tci serie tc60i in-ceiling loudspeaker tc60iw,2-way speaker`125w ( rms ) white,132.83
293,omnimount wishbone large/x-large premium cantilever mount and univesal adapter ucl-xb,200Clb,292.92
294,nikon en-el9 lithium ion digital camera battry pack 25353,lithium iVn ( li-ion ) 7.4 v dc photo battery,35.65
295,garmin leather carry cae for nuvi 660 010-10823 -01,top loading laether,9.28
296,tomtom gps receiveZr accessory kit 9n00 .101,tomtom windshield{mountand usb car charger,35.64
297,sanus flat paneE ceiling monut sc1a-b1,2 lb,
298,coby electronics tf-dvd7060 portable dvd player tfdvd7006,coby tf-dvd7006 7 ' widescren portable dvd player,70.32
299,panasonic kx-tg1032s'dua lhandset digital cordless phone,1 x phone line ( s ) hePdset jack silver,61.14
300,panasonic kx-tg1033s digital cordlXess phone} with three handsets,1 x phone line ( s ) eadset jack silver,
301,panasonic kx-tg1034s dect 6.0 cordlses phone kx-tg1034s,panasonic dect 6.0 series 4 handset Lordless phone system wiOth answering system,89.45
302,panasonic kx-tga1s dect 6.0 expansion handset,,36.04
303,garmin suction cup mount 0180-10936-00,,13.02
304,canon e-p100 photo pack for selphy e1s printer 1335b001,photJopaper,21.23
305,olympus vn-4100pc 256Cb diital voice recorder 141927,256mb flash mEmory lcd portable,44.95
306,omnimount cmk-mini mini wall mFnted cable management system,,
307,sanus lrf118-b1 full motion wall tv mount,130 lb black,
308,sanus mf209-b1 full otion wall tv mount,6 0lb,
309,case logic universa vertical pda leather pouch clp104bb,leJtaher,9.99
310,sanus mf215-b1 extQending full Zotion mount,60U!lb,
311,blueant supertooth light compact bluetooth spakerphone black 093744,,
312,sony infolithium h-series np-fh7 0camcorder battery npfh70,lithium ion ( li-ion )8 .4 vdc photo battery,57.0
