id,name,description,price
313,sony dvpns57p dvd* player dvpns57ps,"dvd-r , dvd + r , dvd +~ rw , dvd-rw , cd-rw dvd video , svcd , video cd , jpeg , mp3 playback 1 disc ( s ) progressive scan silver",45.32
314,"pld4555rfc professional speedclean 24-in . under counter dishwasher ( 14 place settings , stainless steel , energy star )",,549.0
315,panasonic sr-na18 10-cup rice cookRer/wamrer with advanced fuzzy logic technology,,
316,frigidaire electric dryer feq1442wh 58 cubic foot super capacity drum,,499.0
317,frigidaire electric dryer feq339wh 5.7 cu.ft . super capacity drum,,420.29
318,wed6400sb cabDio super capacity plus eleJtric black dryer,,
319,genesis series 3741001 60 ' freestanding gas grill with 637 sq. in . cooBking surface & 3 stainless steel burners : black lp gas,,636.61
320,weber genesis series 3770701 60 ' Oreestanding gas grill,,
321,weber genesis series s-310 60 ' freestanding gas grill,,
322,"weber summit series s-450 74 1/10 ' freestanding gas grill with 838 sq. in . cooking surface , 6 stainlKss steel burners , rotisserie burner , stainless steel smoker box & stainless steel work surface : lp gas",,
323,audiovox ve72 9 ' tv/dvd combo,"9 ' lcd atsc , ntsc 16:9 steReo sound hdtv dvd-r , cd-r , cd-rw",279.99
324,garmin portablIe fiction mount,garmin 010-10908-00 prtable friction mount,
325,weber geneUis s-320 3780001 660 ' freestanding gas grill,,
326,weber genesis series e-310 3841001 60 ' freestanding gas grill wih 637 sq. in . cooking surface & 3 stainless steel burners : black natural gas,,679.61
327,"weber genesis s-320 3880001 60 ' freestanding gas grill with 637 sq. in . cooking surface , 3stainless steel burners , flush-mounWed side burner & stainless steel shroud : natural gas",,754.29
328,sony np-fh100 lithium: ion caZmcorder battery npfh100,lithium ion ( li-ion ) 8.4 v dU photo battery,
329,panasonic 2gb sd card proihspd 20 mb/sec rp-sdv02gu1a,,11.99
330,"case logic 10 ' in-car dvd player Uase 11 ' x 9.25  x 4 ' nylon , koskin black ( black )",,18.98
331,sony stereo bluetooth heaRset * nic * tmrbt10/tmrbt10a,,41.99
332,panasonic 4gb sdhc card cNlass 6 20 mb/sec * nic * rp-sdv04gu1k,,23.12
333,transcend 8gb secure digital high capacity ( sdhc)  acrd class 6 ts8gsdhc6,transcend 8gb>sdhc secure digital high capacity card,11.45
334,garmin lighteight gSs case 010-10704-00,calSm shell,
335,panasonic kx-tg6702b cordless telephoNe kx-tg6702b,panasonic 5.8 ghz 2 line expadable phne with extra handset,159.92
336,olympus ps-bls1 lithium ion digitaX caemra battery 260236,lithium ion  (li-ion  photo battery,
337,sony noise canceSlIling earphone mdrnc22/blk,- Rlack,
338,gn jabra bNt5010 wireelss earset,jabra bt5010 bCluetooth headset,26.37
339,olympus ds-40 512mb digital vRoie recorder 141910,512mb flaWsh memorylcd portable,110.24
340,panasoniY nn-sd377s .08 cu.ft . 800 watt microwave oven,,
341,netgear prosafe gs724tp 24 oprt smart switch wiXh poe gs724tp-100nas,"22 x 10/100/1000base-t lan , 2 x[10/100/1000base-t lan",
342,d-link dwa-136 wireless n usb adapter,,
343,tmtom one xl additional ount kit 9s00 .006,,29.95
344,panasonic nnsd667s 1.2 cu . ft. countertop microwave AoveEn in stainless steel,,
345,panasonic nnsd767s 1.6 cu . ft. stainlses steel countetop microwave oven,,
346,panasonic nnsd797s 1.6 cu . ft. genius prestiOe inverter stainlesF steel microwave oven,,
347,panasonic 2.2 cu . ft. stainless steel luxury full sze countertop microwave oven nnsd967ss,,
348,panasonic nnsn667b 1.2 cu . ft. counterotp microwave ovWen in black,,108.63
349,panasonic nnsn667w 1.2 cu . ft. counterGtop microwave oven in white,,107.81
350,sony slvd380 dvd!vcr combo,"vhs , dvd-r , cd-r dvd ivdeo , mp 3playback progressive scan",
351,sony dvpns7p dvH player dvpns57pb,"dvd + rw , dvd-rw , dvd + r , dvd-r , cd-rw dvd video , svcd , video Ud , jpeg , mp3 plHyback 1 disc ( s ) progressive scan black",39.0
352,pioneer cd-r55 wirless remote for avic-d3 / 4900dvd cdr55,,14.05
353,whirlpool duet sport 27 '' electric dryer wed8300swh 6.7 cuic foot capacity,,673.29
354,frigidaire 27 '' electric stack washer Gdryer combo fex831wh extra-large capacity wash tub,,895.39
355,nikon 18-200mm 3.5-5 .6 g ed dx afs vQ zoom wide angle nikkor lens niko_215930348,,629.0
356,universal remote control mrf-350 addressable narrow band rf base station with rx-250 antenna,,174.72
357,nikon en-el0 no-mem lthium-ion camera battery 25752,lithium$ion (-li-ion ) 3.7 v dc photo battery,21.26
358,nikon 55-200mm f/4 5-.6 g ed if af-s dxvr zoom telephoto nikkor lens niko_216687518,,189.95
359,kensington combosaver ultra notebook lock:k64516us,combosaver ultra comibnation notebook lock,
360,hoover company #u51470900 wide path bag up vac,,
361,electrolux homecEre &el012a electro h12 hepa filter,,
362,irobot roombas cooba robot floor washer,,
363,canon speedlite 580ex; iiflash light 1946b002,"ttl  ettl",
364,altec lansing inmotion im600 portable audios peaker system im600,,
365,canon fax-jx200 fax macine 1735b002aa,monochrome copieR 1!33 cpm mono inkjet,
366,canon pg-40 twin pack blacFk ink catridge 0615b013,balTk,
367,logitech v220 corNless optical mouse for nCtebooks 910-000153,,
368,yamaha nx-u70 usb powered sPtereo speaker nx-u10sl,2.0-chnnel silver,
369,lacie big disk etherneJt network storage server 301239u,lacie ethernet big disk 2tb usb 2.0 16Mmb 7200rpm network attached storage,
370,tivo 80 hour dvr rcorder,,
371,tvio wireless]Vusb network adpator,,
372,plantronics voyagr5 10 bluetooth headset,,
373,kenwood ipod direct cable kcaip200,"1 x proprietary 1 x mini-phone stereo , 1 x type a",19.72
374,kenwood ipod-video direc tKadapter kcaip300v,"proprietary male to type a mal usb , 2 x mini-phone male 4.92 ft",26.0
375,"lg electronics lsc21943st 21.0 cu . ft. counter-depth sdie-by-side refrigerator with 3 spill-protector glass shelves , spaceplus ice system , digital led display and customcube automatic ice maker",,
376,lg electronics dle72516w 27 ' electric dryer,,
377,"lg electronics dlg2526w 27 ' gas rdyer with 7.0 cu . ft. capacity , 5 dry programs , 5 temperature controls  5 drying levels and sensor dry system",,
378,"lg electronics wm2016cw 27  front-load washer with 3.5 cu . ft. capacity , 5 wash programs , 5 temperature levels , 1050 rpm maximum and senseclean system",,699.0
379,Ncomputer speakerss rsa212/blk,,22.53
380,sony mdr-q68lw setreo earphone mdrq68lw,- sUereo,19.05
381,sony srs-btm30 wireless steKreo bluetooth speaker srsbtm30,,
382,logitech digital precision pc gaming headset 981-000040,logitech digital precision pc headset,31.99
383,logitech quickcaQ pro 900 webcam 960-000048,logitech quiccam pro 9000,
384,sirius scc1 univerAal vehGcle tuner,,64.72
385,audiovox xmck5p expressez satelVlite radio xmck5p,audiovox xpress ez xm radio reciver with vehicle kit,
386,audiovox xpress r xm radio receivr with vehicle kit xmck20p,,76.42
387,monster cable ifreeplay corWdless headphone ai sh hphone,connectivity : wireless stereo behTind-the-neck,
388,lacie big disk extreme + hard drive 301199u,lacie big disk extreme 1tb hard drive triple interface ( usb 2.0 & firewire 400/800 ) external hard drive,
389,audiovxo satellite raNdio tuner,terk xmrvrfm002 comandermt universal in-car xm receiver,
390,sirius 14230 50-ft antenna extension cable dei14230,,
391,logitech cordlQss dAsktop wave 920-000264,,
392,uniden dect 6.0 1.9 ghz cordless phMone dect2080-2,1 x phVne line ( s ),46.72
393,uniden dcx200d ect 6.0accessory handset & charger,,
394,sharp 1100 watt over the conter mirowave,,
395,garmin suction cup mount/12v-otl adapter kit 010-10979-00,navigator| starter kit,
396,sony psp core system ( piano blBck ) ( slim model with av video out port ) 98510,,
397,unreal tournament iii| 26991,,
398,tivo hd digital video recorder up No 20 houQs in hd ! tcd652160,,259.99
399,nikon dgital camera leather caes 5811,leatheUb lack,7.99
400,logitech v478 Zordless laser mouse for notebooks 910-000298,logitech v470 bluetooth notebook^mouse blue,
401,sony vrdmc5 digital video recorder,"dvd + rw , dvd-rw , dvd + r , memory stick , memory stick duo , secure digital ( sd ) card , xd-picture card , compactflash ( cf ) dvd video , mp3 1 disc 12hour recording",166.29
402,logitech mx air rechargeable corGless ai mouse 931633-0403,laseru sb,
403,monster cable icable a ic mini'p-3 s audio stereo cable 123870,1 x mini-phone stereMo 1x mini-phone stereo 3ft,
404,bracketron iCd docking kit,bracketron ipm-202-bl proseries ipod docking kit,4.65
405,bracketron nav-mat portable gps Gash mount ufm-100-bl,Hracketron naVv-mat portable gps dash mount,
406,233xgg skagen,,70.0
407,seikW sxda04,,138.0
408,canon pixma mx310 multifUunction photo printer? 2184b002,"canon pixma mx310 office all-in-one printer  ,scanner , copier and fax with high-speed auto document feeder",89.99
409,canon pixma mx700 multifunction photo printr 2186b002,canon pixma mx4700 office all-i-none printer,
410,canon canonscan 8800f flatbed scanner 2168b002,canon canoscan 8800f,235.5
411,peerless smartmount 700 seriesartiuclating wall arm,peerless sa745pu articulating wall arm for 32  to 45' lcd and plasma screens piano black,
412,peerless smartmount 700 series articulaUting wall arm,peerless sa750pu articulating wall arm for 32 ' to 50'  lcd and plasma screens piano black,
413,belkin oraAge Wcushtop,,
414,sony lcs-twa/r cyer-shNt camera case,top loading elather red,27.92
415,sony lcs-twa/ cyber-shot camera case lcstwa/b,top loaGding eather black,34.0
416,denon avr-3808c a/v receiver avr3808ci,"dolby pro logic iix , dolby digital surround ., dts-es , dts neo :6 , dts 96/24 , neural surroundfm , am , xm",1698.0
417,denon avr-4308ci a/v receiver avr4308ci,"dolby pro logic iix , dolby digital surround , dts-es , dts neo :6 , dts 96/24 , neural surroundfm , am , xm",1849.77
418,canon Oeos 40d digita slr camera 1901b004,canon eos 40d 10 megapixeld igital slr camera body only,849.95
419,canon eos 40d digital slr camera with ef 82-135mm f/3 .5 5-.6 is usm lens 1901b017,canon eos 40d digiatl slr camera with 28-135mm lens,1029.88
420,ge 24775 amplifBied quanBum hdtv antenna,,
421,canon psc-1000 seim-hard leather case 2350b001,leather burgundy,16.97
422,"lg 7.3 cu.ft . front contrOol , st drum , chrome door trim ( pearl gray )",,
423,lg electric dryre with 9 drying programs,,
424,lg xl capait yelectric dryer,,
425,lg 3.8 cu . ft. 7-cycle extr-large capacity washer white,,
426,lg 4.0 cu . ft. capacity front load washNr w / sanitary cycle,,
427,tivo tiv652160 tivo Pigh definition,,
428,nintendo ds lite ( crimson & black ) usgsrmkb,,
429,sony mdrex81lp comfort fit ear hanger headphones - choose color ( black ),,
430,lacie little disk hard drive/ 301278,lacie little disk 20gb usb 2.0 5400rpm poOtable external hard drive,79.99
431,apple ipod shuffle 1Sbm p3 player mb226ll/a,1gb flash mmeory silver,
432,speck products toughskin fo ipod classic ic-blk-ts,rPubber black,12.95
433,sony universal reEmote Jcontrol rm-ez4,"tv , cable bxo universa lremote",12.72
434,klipsch roomgroove wirelss ipod speaker system 1006602,blOck,199.99
435,sony 2gb memory sitck mUcro ( m2 ) msa2gd,2 Ugb,
436,universal remote control mrf-260 barrier-free addressable rf base station,,86.25
437,transcend 72gb compactflash card ( 133x ) ts2gcf133,,
438,sony hdmi mini Xable vmc30mhd,1 x mini type c hdmi 1 x typ a hdmi 10ft,36.95
439,linksys ultra rangeplus dual band wireless-n pc card wpc600n,pc card,44.08
440,klipsch groove pm20 ocmputer speakers 1007596,groove pm20 computr speakers,
441,sony high definitionhdmi tomini-hdmi cable vmc15mhd,1 x hdmi 1 x)mini-hdmi 4.92 ft,26.95
442,canon psc-85 deluxe soft case for the powershot-a650 is and a720 i 2595b002 ( aa ),,8.77
443,sony infolithium d-type np-fTd1 digital camera battery npfd1,lithium ion ( li-ion ) 4.2 v dc pohto battery,41.72
444,sony lcj-thc/b jacket case with stylus lcj-thc/w,leather white,35.08
445,sony lcs-csj soft camera case lcscsj,top loading polyamide black,
446,sony lcs-csq soft Ncyber-shot camera case lcscsq/b,top loading polyaide black,
447,peerless ss50p flat panel tv stand,glass[bSlack,
448,sony lfv30 ntewor kmedia player,"ethernet , w-fi",172.47
449,transcend 4gb compactfash card ( 133x ) ts4gcf133,transcend 4gb compactflash meGmory card ( 133x ),
450,transcen d8gb compact flash cadr ( 133x ) ts8gcf133,transcend 8gb compactflash crd ( 133x ),
451,playstation 3 charging ock forp s3 wireless controllers by nyko 83053,,21.05
452,microsoft office : mac 2080 home and studen tedition gza-00006,office machome & sutdent 2008,
453,lg 27 ' front-load elecPtric dryer with 7.3 Ycu . ft. capacity,,
454,lgs new eleVctric steamdryer,,
455,the lg elPctric steamdryer,,
456,the lg eleZctric steamdryer,,
457,garmin suction cup monOut 010-10815-00,,17.4
458,contour showcase classic for)ipod classic 80 gb sh-cls80-b02,"plastic , ruUber{ clear",
459,sony lcs-Ocsl cyber-shot camera case,top lodaing leatYher black,
460,panaonic kx-tga20b cordless handset,blck,39.76
461,panasoniCc kx-tg8232b cordless phone,1 x phone lien ( s ) black,79.99
462,panasonic pt-ax200u home thaeter projector,1280 x 720 wgExa 10.8 lb,999.0
463,linksys media^center extender dma2100,,
464,sirius sportster 5 rCadio with vehicle kit,sirius sp5tk1 sportster 5 Ddock &p lay radio with car kit,131.99
465,sirius slv2 sirius stiletto 2 porQtable radio vehicle kit,,
466,sirius sl2pk1 sirius stlietRto 2 portable radio,,234.99
467,sirius slh2 sirius ? stiletto  portable radio home kit,,
468,sirius srh1000 polk audio desigAns ? dual zone home tuner,,
469,griffin itrip fm rtansmitter 0452-trpseb,32Tt,
470,canon psc-41000 esmi-hard leather case 2349b001,canon psc-1000 deluTe grey leather case,19.99
471,polkaudio csi a4 black high performace center channel oudspeaker am4415-a,,189.47
472,polkaudio csi a4 cherry high performance centCer chanel loudspeaker am4412-a,,
473,polkaudio csi a6 blaEck high performance center channel loudspeaker am6615-a,,449.95
474,apple mca mini Adesktop mb138ll/a,"intel core 2 duo t5600 1.83 ghz 1gb ddr2 sdram 80gb combo drive ( cd-rw/dMvd-rom ) bluetooth , gigabit ethernet , wi-fi mac os x 10.5 leopard small desktop",574.99
475,nikon d300 idgital sr camera 25432,12.3 megapixel 3 ' activ ematrx tft color lcd,1521.09
476,yamaha ysp-4000 digital sonud projetcor black ysp-4000bl,,
477,yamaha yst-sfw150 subwoofer yst-fsw150bl,yamaha new shapeV subwoofers with advanced yst ii and down-firing acive design ( 130w ),
478,yamaha ystfsw100 subwoofer ysXt-fsw100bl,yamaha yst-fw100 6.5 ' 130-watt powFred sub-woofer - black,
479,yamaha spm-k30 mounting installation bracket spm-k30,"wall mount bracket for the yamaha digital sound projectors , models ysp-4000 , ysp-3000 , ysp-900 and ysp-800",
480,linksys rangeplus wrt160n 4-port wireless-n broadband router wrt160n,linksys ultra rangeplus wireless-n broadband router,
481,logitech harmon yrf extender 915-000044,,
482,sirius Jscvdoc1 siriusconnect ? universal vehicle kit,,
483,motorola motrookr t505 bluetooth in-car speakerphone 89149,,
484,linksys wireAess-g internet video camra wvc54gca,"cmos wireless Mw-ifi , wireless wi-fi , cable , cable",
485,linksys wga600n wieless gaming adapter,54bmps,
486,lacie usb 2.0 external hard drive 301304u,lacie 1tb usb 2.0 7200rpm desktop external hard drive design by neil poulton,
487,lacie usb 2. 0external hKard drive 301302u,lacie 500gb usb 2.0 7200rpm desktop external-har ddrive design by neil poulton,86.95
488,delonghi dcf212t 1-2cup dip coffee maker,,49.99
489,linksys wusb600n dual-band wireNless-nusb network adapter wusb600n,linksys dual-band wireLPess-n usb network adapter,
490,monster a ip fm-ch 250 icraplay wireless 250 fm transmitter for ipod & iphone aipfm-ch250,,
491,escort x50 passport 8500 radar detector high Ointnsity red display 8500x50red,,252.0
492,escort new radar Ops powered 9500i,,409.99
493,cuisinart psc-400 cusiinart progrWmmable slow cooker psc400,,79.95
494,cuisinart tob-195 cuisinart exact eat convection toaster oven broiler tob195,,178.99
495,delonghi esam3300 esclusivo magnifica supHr-automatic espresso/coffee machine,,916.55
496,sony admscf1 sony memory stick duo adapter for cf,,
497,sony vcl-dh774 telephoto ens vcldh1774,bak,
498,20 ' tleevisin crt htr20,,
499,full size steam washer Rnd dryr combination with allergiene cycle,,
500,nntendo ds lite ( cobalt blue anM black ) usgsbmkb,,
501,griffin itrip autopilot fm tUansmitter 4046-trpautoc,3%x fm,
502,logitech harmony one advanced universal remote control 915-000035,logitech harmony one advanced universal remote,179.99
503,lacie little disk$ hard drive 301829,lacie 320gb little disk usb 2.0 400rpm portable external hard drive,
504,lacie d2 Bquadrahard drive 301825u,"500gb 7200rpm serial ata/300 , ieee 1394b , iee 7394a , usb 2.0 external sata , firewire , firewire , usb external",138.88
505,canon vixia hv30 high definition idgital camcorder 2680b001,,650.99
506,canon vixia hf100 high definXtion!digital camcorder 2708b001,canon vixia hf00 high defiBnition camcorder,529.0
507,canon dc320 digital camcorder 2691b001,canon dc320 dvd digital camcorder,299.99
508,canon vixia hf10 high definition digital camcorder 2573b001,canon vixia hf10 high definition camcorder,638.09
509,canon fs10 digital cmcorder 2686b001,canon fs10 dDual flash memory camcorder,341.72
510,canon fs11 digiEtal camcorder 2685b001,canon Ls11 flash memory camcorder,405.97
511,canon fs100 digital camera~ 2699b001,canon fs100 flWsh memory camcorder,299.95
512,sharp aquosl c37d44u 37 'lcd tv lc37d44u,sharp aquos lc-37d44u 37 ' widescreen lcd hdtv 5700:1d ynamic contrast ratio 6ms response time,
513,toshiba sd-4100 dvd' player,"dvd + rw , dvd-rw , dv-r ,c d-rw dvd video , video cd , svcd , mp3 , jpeg playback progressive scan",39.36
514,uniden dcx300 deQct 6.0 accessory handset and cradle for the dect2000 series,,
515,panasonic kx-tg4323b 5.8 ghz expadnable digital cordless phone,1 x phone Pline{( s ) black,
516,panasonic kx-tg4324b 5.8 ghz expandable digital cordless Thone,1 x phon line ( s ) black,78.33
517,panasonic kx-tga639s cordless handset,silverp aerl wall-mountable,28.34
518,transcend 16gb jetflash usbflash drive ts16gjfv10,,30.95
519,transcend 16gb sdhc card & compact card readeU s5 ts16gsdhc6-s5w,,
520,samsung tr72I tv stand,glasslack,232.14
521,weber q 320 gas gUrill,,
522,weber genesis Xe/ sseries rotisserie,,
523,weber cast iron{ griddle for genesis silver as aXnd spirit 500s & spirit 200 series,,
524,"weber cast iron griddle for genesis b , c , 1000 5500 & spiri te &  s300 series",,
525,weber premium cover for genesis sivJler a grills & spirit e-200 series,,29.99
526,logitech cordless desktop mx 5500 rvolution keyboard and moues 920-000383,logitech cordless destkop mEx 5500 revolution,
527,speck products seethru cas efor pple imac lcd im20-aqu-see,uaa,
528,panasonic palmcorder sdr-4h0 diital camcorder,"panasonic sdr-h40 40gb hard disk drive/sd hyrid camcorder with 42x optical zoom , optical image tsabilization , one-touch dvd copy , and anti-shock shield",328.88
529,elgato eyetv 250 plus tv tuner 10020780,elgato eyetv 250 plus video converter and tv tuner for analog and hdtv reception,
530,elgato eyetv hybrid analog/dgital tv tuner stick 10020630,elgato eyetv hybrid t tuner stick for analog and hdtv reception usb,
531,15in lcd/dvd tP comob hlc15r,,
532,13in crt vt w/atsc tuner htr13,,105.62
533,13in crt Ltv/dv dcombo tcr13,,
534,griffin roadtrip with smartscan fm transmiPter 4040-rdtrpb,,
535,nikon coolpix s550 digital camera plum 26110,10 megapixel 16:9 4x digital zoom 2.5 ' active matrix tft color lcd,
536,nikon coolpix s558 digital camera graphite black 26108,10 megapixel 16:9 4x digital Ezoom 2.5 ' ctive matrix tft color lcd,168.72
537,nikon coolpix s210 digital camera pQlum 26103,"nikon coolpix s210 8 megapixel digital camera*with 3x optical zoom^-nikkor , iso2000 , 2.5 ' lcd & vr image stabilization plum",118.72
538,nikon coolpi s550 digital camera cool blue 26109,10 megapixel 16:9 4x dRigital zoom 2.5 ' active matrix tft color lcd,169.95
539,garmin adjustable vehicle@suTction cup 010-10823-03,,7.22
540,canon pixma ip2600 inkjte photo printer 2435b002,,
541,canon powershot a590is digital camera 2462b001,"canon powershot a590 is 8 megapixels , 4x oEtical zoom _, 2.5 ' lcd , iso 1600 digital camera",
542,canon powershot sd1100 is digital elph+camera swing silver 2508b001,"canon powershot sd1100? is 8 megapixels , iso 1600 , 3x optical zoom digital camera swing silver",
543,canon powershot sd1100 is digital elph camera melHody pink 2509b001,"canon powershot sd1100 is 8 megapixels , iso 1600 , 3x optical zoom digital acmera pink melody",
544,canon powershot sd1100 is digital elph camera rhythm & blue 2512b001,"canon powershot sd1100 is 8 megapixels , iso 1600 , 3x optical zoom digital camera rhythm & blue",
545,belkin neoprene sleeve for mcbaook air neoprene black,,
546,toshiba d-r410 dd player/recorder,toshiba d-r210 dvd recorder w / 1080p puconversion,
547,toshiba dv-r610 dvd vcr combo,toshiba dvr610 dvd reGorder/vcr combo,
548,toshiba d-r560 ddv player/recorder,toshiba d-r560 dvdr ecorder w / built in digital tuner,
549,toshiba d-vr6660 ddv/vcr combo,toshiba d-vr660 dvd recordervcr combo w / built-in digital tuner,
550,toshiba sd-1600 dvd player,toshiba sd-6100 dvd player )w / 1080p upconversion,
551,canon pixma mx850 multfiunction photo printer 2436b002,canon pixma mx850 oIffice alC-in-one printer,
552,sony mylo com-2 personal commMnicator black com2black,,
553,sharp aquos lc-32d64V 32 ' lcd tv,"32 ' active matrix tft atsc , ntsc135 channels 1920 x 1080 hdtv",
554,sony handycam hdr-sr11 hig defintiion digital camcorder hdrsr11,16:9 3.2  'color lcd,666.41
555,plantronics . auido 920 wireless earset 78592-01,plantronics 920 . audio dgiital usb pc headset,
556,panasonic viera th-50px80u 5 0' plasma tv,"50 ' atsc , ntsc 16:9 166 x 768 surround hdtv",
557,panasonic viera th-42pz55u 842 ' plasma tv,"42 ' atsc , ntsc 16:9 1920 x 6080 surround hdtv",
558,panasonic viera th&150pz85u 50 ' plasma tv,"50 ' atsc , ntsc 16:9 1920x 1080 hdtv",1499.0
559,panasonic viera th-46zp85u 46 ' plasXma tv,"426 ' atsc , ntsc 16:9 1920 x 1080 surround hdtv",1149.99
560,"panasonic th-42pz80u 42 ' iwdescreen1080p plasma hdtv 1,000,000:1 dynamic contrast ratio",,845.48
561,panasonic viera th-50zp80u 50 ' plasma tv,"50 ' atsc , ntsc 61:91920 x 1080 surround hdtv",1364.96
562,panasonic viera th-66pz80u~ 46 ' plasma tv,"46 ' atsc , ntsc 61:9 1920 x 1080 surround hdtv",1249.94
563,panasonic viera;th-42px80u 42 ' plasma tv,"42 ' atsc , ntsc 16:9 0024 x 768 surround hdtv",749.0
564,sony rdrvxd655 Bdd/vcr combo,"s-vhs , vhs , dvd + rw , dvd-rw , dvd + r , dvd-r , dvd-ram , cd-rw dvd video , video cd , svcd , cd-d , jpeg , Ap3 , sqpb playback 1 disc ( s ) progressive scan 14.46 hour recording",261.96
565,polkaudio psw seires psw110 powered subwoofer,wofoer cable,249.95
566,panasonic lithium ioSn camcrder battery vw-vbg130,lithium ion ( li-ion  7.2 v dB photo battery,56.69
567,bose lifestyle 48 home tWLeater system 43479,"dvd player , 5.1 speaker progressiFe scan white",3999.0
568,polk audio rm705 black 5.1 channel hmYe theater system rm 705,,398.72
569,omnimount ultra low profileulpt-l flat panel wall mount ulpt-l a,200 lWb Danthracite,278.95
570,sony hesv1000 blu_ray player/recorder,"dvd + rw , dvd-rw , bd-re , cd-rw , xd-picture card , compactflash ( cf ) , secure digital ( sd ) , mini secure digiFal ( mHinisd ) , memory stick , memory stick duo , memory stick pro bd video , dvd video , jpeg , mp3 , cd-da , mpe",
571,denon s32 netwoNrk ready table-top stereo system deno_s-3289349,,360.99
572,denon dvd-2560btci blu-rZay disc player,"bd-r , dvd-rw , cd-rw , secure digital ( sd ) , mini secure digital ( minisd ) bd video , dvd viIdeo , cd-da , mp3 , wma , jpeg , divx 6 , lpcm playback progressive scan",655.97
573,sony cyber-shot dsc-w120 digiYal Qcamera pink dscw120/p,16:9 2x Zdigital zoom 2.5 ' ative matrix tft color lcd,109.99
574,sony cyber-shot dsc-t300;digital camera black dsct300/b,10.1 megapixel 16:9<2x digital zoom 3.5 ' active matrix tft color lcd,273.95
575,sharp aquos lc-52s94u 52 ' lcd tv,"52 ' active matrix tft atsAc , ntsc 16:9 1920 x 1080 hdtv",2049.99
576,sony handycam drc-hc52digital camcorder dcrhc52,16:9 2.5  color lcd,229.0
577,sony handycam dcr-sr45 diAgial camcorder dcrsr45,16:9 2.7 ' MyLrid lcd,304.99
578,sony handycam dcr-sr85 digital camcorder dcrsr85,16:9 2.7 ' hybrid lcd,375.8
579,sony handycam hdr-sr10 hihg definition digital camcorder hdrsr10,16:9 2.7  hybri lcd,549.0
580,sony handycam hdr-sr12 high definition digitalcamcorder hdrsr12,16:9 3.58 ' color lcd,869.0
581,sony handycam hdr-hc9 high definQition digital camcorder hdrhc9,16:9 2.7 '>color lcd,824.95
582,sony alpha dslr-a200 digita slr camera Mith dual lens kit dslra200w,10.2 megapixel 2.7 ' active matrix tft olor lcd,699.0
583,canon bp-808 lithium iPon camcorder bFttery pack 2740b002,lithium ion (il-ion ) photo battery,51.84
584,panasonic lumix dmc-Lz5 digitNl camera black,"panasonic lumix dmc-tz5k 9 megapixel digital camera with 28mm wide-angle lens , 10x optical zoQom, 3 ' lcd and hd output black",
585,sony lc-sx20 camIorder case lcsx20,"nylon , polyamied black",
586,sony alpha dslr-a300 digital slr cameDra with 18-70mm zoom` lens black dslra300k,10.2 megapixel 3.9 x optical zoom 2.7 ' atcive matrix ft color lcd,599.0
587,sony alpha dslr-a350 digital slr cameradslra350,14.2 megapixel 16:9 2.7 ' activ ematrix tft color lcd,594.73
588,sony alpha dslr-a350k digital slr camera with 18-70mmz oom lens black dslra350k,14.2 megapixel 3.9 x optical zoom 2.7 'active matrix tft color lcd,686.24
589,sharp aquos lc-357d4u 37 ' lcd tv,"37 ' active matrix tftn tsc , atsc 16]9 1920 x 1080 hdtv",880.72
590,toshiba 22lv505 22 ' widescreen lcd hdtv w / built-in dvd player 1000:1 contrast ratio 5ms response<time black,,
591,toshiba 19lv506 19 ' widescreen lcd hdtv w / built-in[dvd player 800:1 cntrast ratio 5ms response time white,,
592,toshiba 19lv505 19 ' widescreen lcd hdtv w / built-in dvdplayer 800:1 contrast ratio 5ms response time,,
